"Title","Date","Author","Author_Hyperlink"
"tint 0.0.3: Tint Is Not Tufte","October 15, 2016","Thinking inside the box","https://www.r-bloggers.com/author/thinking-inside-the-box/"
"USA/ Canada Roadtrip 2016","October 15, 2016","Shirin's playgRound","https://www.r-bloggers.com/author/shirins-playground/"
"R code to accompany Real-World Machine Learning (Chapter 3)","October 15, 2016","data prone - R","https://www.r-bloggers.com/author/data-prone-r/"
"Visualizing ROC Curves in R using Plotly","October 15, 2016","Riddhiman","https://www.r-bloggers.com/author/riddhiman/"
"The Grammar of Graphics and Radar Charts","October 15, 2016","C","https://www.r-bloggers.com/author/c/"
"Tidyverse Presentation","October 15, 2016","R-bloggers – JIDDU ALEXANDER","https://www.r-bloggers.com/author/r-bloggers-jiddu-alexander/"
"Progress bar overhead comparisons","October 15, 2016","Peter Solymos","https://www.r-bloggers.com/author/peter-solymos/"
"anytime 0.0.3: Extension and fixes","October 14, 2016","Thinking inside the box","https://www.r-bloggers.com/author/thinking-inside-the-box/"
"On the ifelse function","October 14, 2016","Florian Privé","https://www.r-bloggers.com/author/florian-prive/"
"Converting mouse to human gene names with biomaRt package","October 14, 2016","radiaj","https://www.r-bloggers.com/author/radiaj/"
"Introducing qualpalr","October 14, 2016","Johan Larsson - R","https://www.r-bloggers.com/author/johan-larsson-r/"
"Association Rules on WideWorldImporters and SQL Server R Services","October 14, 2016","tomaztsql","https://www.r-bloggers.com/author/tomaztsql/"
"Shiny Server (Pro) 1.4.7","October 14, 2016","Joe Cheng","https://www.r-bloggers.com/author/joe-cheng/"
"Optimize Data Exploration With Sapply() – Exercises","October 14, 2016","John Akwei","https://www.r-bloggers.com/author/john-akwei/"
"Make tilegrams in R with tilegramsR","October 14, 2016","David Smith","https://www.r-bloggers.com/author/david-smith/"
"“smooth” package for R. es() function. Part I","October 14, 2016","Ivan Svetunkov","https://www.r-bloggers.com/author/ivan-svetunkov/"
"reproducible logo generated by ggtree","October 14, 2016","R on Guangchuang Yu","https://www.r-bloggers.com/author/r-on-guangchuang-yu/"
"Statistics New Zealand experimental API initiative","October 14, 2016","Peter's stats stuff - R","https://www.r-bloggers.com/author/peters-stats-stuff-r/"
"The Importance of Out-of-Sample Tests and Lags in Forecasts and Trading Algorithms","October 14, 2016","David Zimmermann","https://www.r-bloggers.com/author/david-zimmermann/"
"Global Temp: Geo-Spatial Records over Time","October 14, 2016","data_steve","https://www.r-bloggers.com/author/data_steve/"
"Eight (not 10) things an R user will find frustrating when trying to learn Python","October 14, 2016","Andy Nicholls","https://www.r-bloggers.com/author/andy-nicholls/"
"grim knight [a riddle]","October 13, 2016","xi'an","https://www.r-bloggers.com/author/xian/"
"The schedule is out – rstudio:conf 2017","October 13, 2016","Roger Oberg","https://www.r-bloggers.com/author/roger-oberg/"
"Sentiment analysis and Parts of Speech tagging in Dutch/French/English/German/Spanish/Italian","October 13, 2016","BNOSAC - Belgium Network of Open Source Analytical Consultants","https://www.r-bloggers.com/author/bnosac-belgium-network-of-open-source-analytical-c/"
"Converting (British) National Grid references","October 13, 2016","mikerspencer","https://www.r-bloggers.com/author/mikerspencer/"
"Fixing R Documentation","October 13, 2016","DataCamp Blog","https://www.r-bloggers.com/author/datacamp-blog/"
"shinythemes 1.1.1","October 13, 2016","winstonchang","https://www.r-bloggers.com/author/winstonchang/"
"Upcoming Practical Data Science courses in London, Chicago, Zurich, Oslo and Stockholm","October 13, 2016","David Smith","https://www.r-bloggers.com/author/david-smith/"
"Use R to Calculate Inflation with the blscrapeR Package","October 13, 2016","Kris Eberwein","https://www.r-bloggers.com/author/kris-eberwein/"
"Seinfeld streak at GitHub: Round Three","October 12, 2016","Thinking inside the box","https://www.r-bloggers.com/author/thinking-inside-the-box/"
"importance sampling by kernel smoothing [experiment]","October 12, 2016","xi'an","https://www.r-bloggers.com/author/xian/"
"3 Reasons to Learn Caret","October 12, 2016","DataCamp Blog","https://www.r-bloggers.com/author/datacamp-blog/"
"Tutorial: Scalable R on Spark with SparkR, sparklyr and RevoScaleR","October 12, 2016","David Smith","https://www.r-bloggers.com/author/david-smith/"
"Exporting R tables in LaTeX","October 12, 2016","Ivan Svetunkov","https://www.r-bloggers.com/author/ivan-svetunkov/"
"Performance comparison between kmeans and RevoScaleR rxKmeans","October 12, 2016","tomaztsql","https://www.r-bloggers.com/author/tomaztsql/"
"Mapping Walmart Growth Across the US using R","October 11, 2016","n.ashutosh","https://www.r-bloggers.com/author/n-ashutosh/"
"Multilevel Modeling of Educational Data using R (Part 1)","October 11, 2016","Andrés Gutiérrez","https://www.r-bloggers.com/author/andres-gutierrez/"
"Understanding empirical Bayesian hierarchical modeling (using baseball statistics)","October 11, 2016","David Robinson","https://www.r-bloggers.com/author/david-robinson/"
"bayesAB 0.7.0 + A Primer on Priors","October 11, 2016","Frank Portman","https://www.r-bloggers.com/author/frank-portman/"
"Watch the world warm with this animated globe, created with R","October 11, 2016","David Smith","https://www.r-bloggers.com/author/david-smith/"
"EARL Boston Full Agenda Released","October 11, 2016","Angela Roberts","https://www.r-bloggers.com/author/angela-roberts/"
"Reproducible Reports with RStudio","October 11, 2016","""Mauricio Vargas S. <U+5E15><U+590F>""","https://www.r-bloggers.com/author/mauricio-vargas-s/"
"R heroes unite – The starting gun for the eRum 2016 will be fired tomorrow","October 11, 2016","eoda GmbH","https://www.r-bloggers.com/author/eoda-gmbh/"
"Movies and Series subtitles in R with subtools","October 11, 2016","franzk","https://www.r-bloggers.com/author/franzk/"
"corrr 0.2.1 now on CRAN","October 11, 2016","Simon Jackson","https://www.r-bloggers.com/author/simon-jackson/"
"Update of `ggseas` for seasonal decomposition on the fly","October 11, 2016","Peter's stats stuff - R","https://www.r-bloggers.com/author/peters-stats-stuff-r/"
"7th MilanoR Meeting: October 27","October 11, 2016","MilanoR","https://www.r-bloggers.com/author/milanor/"
"Next Kölner R User Meeting: Friday 14 October","October 11, 2016","R on mages' blog","https://www.r-bloggers.com/author/r-on-mages-blog/"
"RTutor: The effect of air pollution on house prices","October 11, 2016","Economics and R - R posts","https://www.r-bloggers.com/author/economics-and-r-r-posts/"
"Pauly et al. (1992) Seasonal Cessation in Growth Model","October 10, 2016","fishR Blog","https://www.r-bloggers.com/author/fishr-blog/"
"Create an inset plot","October 10, 2016","Bluecology blog","https://www.r-bloggers.com/author/bluecology-blog/"
"Animate maps with mapmate: R package for map- and globe-based still image sequences","October 10, 2016","Matt Leonawicz","https://www.r-bloggers.com/author/matt-leonawicz/"
"Make ggplot graphics2 interactive with ggiraph","October 10, 2016","David Smith","https://www.r-bloggers.com/author/david-smith/"
"R package `MCMCvis` now on CRAN","October 10, 2016","caseyyoungflesh","https://www.r-bloggers.com/author/caseyyoungflesh/"
"Mapping (historic) tracks in ggplot2","October 10, 2016","James","https://www.r-bloggers.com/author/james/"
"The yarrr package (0.0.8) is (finally!) on CRAN","October 10, 2016","ndphillips","https://www.r-bloggers.com/author/ndphillips/"
"Streamline your analyses linking R to SAS: the workfloweR experiment","October 10, 2016","Andrea Cirillo","https://www.r-bloggers.com/author/andrea-cirillo/"
"R’s Testing Predicament","October 10, 2016","Mango Blogger","https://www.r-bloggers.com/author/mango-blogger/"
"Comparing performance on dplyr package, RevoScaleR package and T-SQL on simple data manipulation tasks","October 10, 2016","tomaztsql","https://www.r-bloggers.com/author/tomaztsql/"
"Big Salaries, Recommendation Systems, and Where We’ll Be 5 Years from Now","October 10, 2016","r-exercises","https://www.r-bloggers.com/author/r-exercises/"
"Data Scientist with a Wine hobby (Part II)","October 9, 2016","Pareto's Playground","https://www.r-bloggers.com/author/paretos-playground/"
"Cartograms with R","October 9, 2016","Theory meets practice...","https://www.r-bloggers.com/author/theory-meets-practice/"
"A set of #rstats #AdventureTime themed #openscience slide decks","October 9, 2016","lortie","https://www.r-bloggers.com/author/lortie/"
"Let’s (briefly) revisit the Nobel API","October 9, 2016","nsaunders","https://www.r-bloggers.com/author/nsaunders/"
"How can we improve R-exercises?","October 9, 2016","Onno Dijt","https://www.r-bloggers.com/author/onno-dijt/"
"Next Kölner R User Meeting: Friday 14 October","October 9, 2016","Markus Gesmann","https://www.r-bloggers.com/author/markus-gesmann/"
"New release of pqR — faster, and now compatible with R-2.15.1","October 8, 2016","Radford Neal","https://www.r-bloggers.com/author/radford-neal/"
"Map of Middle Earth in R","October 8, 2016","C","https://www.r-bloggers.com/author/c/"
"Intro to R Programming | AP Statistics Histograms with ggplot","October 8, 2016","Kevin","https://www.r-bloggers.com/author/kevin/"
"Scalable plotting with ggplot2 – Part I","October 7, 2016","Rsome - A blog about some R stuff","https://www.r-bloggers.com/author/rsome-a-blog-about-some-r-stuff/"
"Align Assign: RStudio addin to align assignment operators","October 7, 2016","Luke Smith","https://www.r-bloggers.com/author/luke-smith/"
"Creating Sample Datasets – Exercises","October 7, 2016","Avi Blinder","https://www.r-bloggers.com/author/avi-blinder/"
"On calculating AUC","October 7, 2016","John Mount","https://www.r-bloggers.com/author/john-mount/"
"Shiny happy people in the land of the Czar","October 7, 2016","Gianluca Baio","https://www.r-bloggers.com/author/gianluca-baio/"
"In case you missed it: Septemer 2016 roundup","October 7, 2016","David Smith","https://www.r-bloggers.com/author/david-smith/"
"tint 0.0.2: Tint Is Not Tufte","October 7, 2016","Thinking inside the box","https://www.r-bloggers.com/author/thinking-inside-the-box/"
"Extending accessibility of open-source statistical software to the masses A shiny case study","October 6, 2016","Educate-R - R","https://www.r-bloggers.com/author/educate-r-r/"
"Shiny happy people in the land of the Czar","October 6, 2016","R on Gianluca Baio","https://www.r-bloggers.com/author/r-on-gianluca-baio/"
"Data Driven Logo Design with ggraph and gtable","October 6, 2016","Data Imaginist - R posts","https://www.r-bloggers.com/author/data-imaginist-r-posts/"
"text2vec 0.4","October 6, 2016","Data Science notes","https://www.r-bloggers.com/author/data-science-notes/"
"Making a team survey to get my colleagues hooked on R","October 6, 2016","Florian Privé","https://www.r-bloggers.com/author/florian-prive/"
"What you need to know about data augmentation for machine learning","October 6, 2016","Brian Lee Yung Rowe","https://www.r-bloggers.com/author/brian-lee-yung-rowe/"
"Import data to R from SAS, SPSS and Stata with Haven","October 6, 2016","David Smith","https://www.r-bloggers.com/author/david-smith/"
"15 new jobs for R users – from around the world (2016-10-06)","October 6, 2016","Tal Galili","https://www.r-bloggers.com/author/rlover/"
"ourworldindata: an R data package","October 6, 2016","Simon Jackson","https://www.r-bloggers.com/author/simon-jackson/"
"Raccoon: Statistical Models with R free web-book","October 6, 2016","Quantide srl","https://www.r-bloggers.com/author/quantide-srl/"
"Creating an image of a matrix in R using image()","October 6, 2016","biomickwatson","https://www.r-bloggers.com/author/biomickwatson/"
"Text Mining in R and Python: 8 Tips To Get Started","October 6, 2016","DataCamp Blog","https://www.r-bloggers.com/author/datacamp-blog/"
"Get air quality data for the United Kingdom using the rdefra package","October 6, 2016","Claudia Vitolo","https://www.r-bloggers.com/author/claudia-vitolo/"
"The End of the Line","October 5, 2016","R-SquareD","https://www.r-bloggers.com/author/r-squared/"
"The case for reproducibility","October 5, 2016","The USGS OWI blog","https://www.r-bloggers.com/author/the-usgs-owi-blog/"
"Hadley Wickham Master R Developer course coming to Melbourne","October 5, 2016","R on Rob J Hyndman","https://www.r-bloggers.com/author/r-on-rob-j-hyndman/"
"Hadley Wickham Master R Developer course coming to Melbourne","October 5, 2016","Rob J Hyndman","https://www.r-bloggers.com/author/rob-j-hyndman/"
"Statcheck: an R package to check statistical results in psychology papers","October 5, 2016","David Smith","https://www.r-bloggers.com/author/david-smith/"
"R Notebooks","October 5, 2016","Jonathan","https://www.r-bloggers.com/author/jonathan/"
"R Puzzle No. 2 – Where’s the zebra?","October 5, 2016","José Romero","https://www.r-bloggers.com/author/jose-romero/"
"haven 1.0.0","October 5, 2016","hadleywickham","https://www.r-bloggers.com/author/hadleywickham/"
"Introducing artyfarty: a theming package for ggplot2","October 5, 2016","FishyOperations","https://www.r-bloggers.com/author/fishyoperations/"
"New package graphql: A GraphQL Query Parser","October 5, 2016","Jeroen Ooms","https://www.r-bloggers.com/author/jeroen-ooms/"
"The Problem With Depmix For Online Regime Prediction","October 5, 2016","Ilya Kipnis","https://www.r-bloggers.com/author/ilya-kipnis/"
"#PredictiveCOL – Forecasting Colombia’s peace plebiscite (final update)","October 4, 2016","Andrés Gutiérrez","https://www.r-bloggers.com/author/andres-gutierrez/"
"RcppGSL 0.3.1","October 4, 2016","Thinking inside the box","https://www.r-bloggers.com/author/thinking-inside-the-box/"
"Using the dataRetrieval Stats Service","October 4, 2016","The USGS OWI blog","https://www.r-bloggers.com/author/the-usgs-owi-blog/"
"Reactive shiny filters through collapsible d3js trees","October 4, 2016","Tal Galili","https://www.r-bloggers.com/author/rlover/"
"Linpe: make sending and receiving data analysis faster and easier","October 4, 2016","Michy Alice","https://www.r-bloggers.com/author/michy-alice/"
"Network visualization – part 6: D3 and R (networkD3)","October 4, 2016","Vessy","https://www.r-bloggers.com/author/vessy/"
"Adding polished significance summaries to papers using R","October 4, 2016","John Mount","https://www.r-bloggers.com/author/john-mount/"
"And Yet It Moves: Gravitational Waves","October 4, 2016","Patrick Rhodes","https://www.r-bloggers.com/author/patrick-rhodes/"
"Dates and Times – Simple and Easy with lubridate Exercises (part 3)","October 4, 2016","Avi Blinder","https://www.r-bloggers.com/author/avi-blinder/"
"Building Scalable Data Pipelines with Microsoft R Server and Azure Data Factory","October 4, 2016","Guest Blogger","https://www.r-bloggers.com/author/guest-blogger/"
"Visualizing the Daily Variability of Bitcoin with Quandl and Highcharts","October 4, 2016","@aschinchon","https://www.r-bloggers.com/author/aschinchon-2/"
"Notes from 4th Bayesian Mixer Meetup","October 4, 2016","R on mages' blog","https://www.r-bloggers.com/author/r-on-mages-blog/"
"Trump vs. Clinton in N-grams","October 4, 2016","Bora Beran","https://www.r-bloggers.com/author/bora-beran/"
"Notes from 4th Bayesian Mixer Meetup","October 4, 2016","Markus Gesmann","https://www.r-bloggers.com/author/markus-gesmann/"
"Program of the european R users meeting [only 7 days to go]","October 3, 2016","smarterpoland","https://www.r-bloggers.com/author/smarterpoland/"
"Journal of Open Source Software","October 3, 2016","xi'an","https://www.r-bloggers.com/author/xian/"
"Simple automated web-scraping with R CMD BATCH and Task Scheduler","October 3, 2016","Luke Smith","https://www.r-bloggers.com/author/luke-smith/"
"Homer, not Bart, is the star of the Simpsons","October 3, 2016","David Smith","https://www.r-bloggers.com/author/david-smith/"
"A Bayesian Information Criterion for Singular Models","October 3, 2016","Martyn","https://www.r-bloggers.com/author/martyn/"
"Do you know Sparse Principal Components Analysis, Mr Trump?","October 3, 2016","Giovanni","https://www.r-bloggers.com/author/giovanni/"
"ggplot2 2.2.0 coming soon!","October 3, 2016","hadleywickham","https://www.r-bloggers.com/author/hadleywickham/"
"Analyzing the first Presidential Debate","October 3, 2016","Anup Nair","https://www.r-bloggers.com/author/anup-nair/"
"Metodologiczne inspiracje 2016","October 3, 2016","Michal","https://www.r-bloggers.com/author/michal-2/"
"Data analysis of the French football league players with R and FactoMineR","October 3, 2016","Antoine R","https://www.r-bloggers.com/author/antoine-r/"
"Rocker – explanation and motivation for Docker containers usage in applications development","October 3, 2016","Marcin Kosinski","https://www.r-bloggers.com/author/marcin-kosinski/"
"Marketing Analytics Using R Training Course 31 October – 04 November 2016","October 2, 2016","Allan Engelhardt","https://www.r-bloggers.com/author/allan-engelhardt/"
"Proofing statistics in papers","October 2, 2016","John Mount","https://www.r-bloggers.com/author/john-mount/"
"Network Analysis Part 2 Exercises","October 2, 2016","Miodrag Sljukic","https://www.r-bloggers.com/author/miodrag-sljukic/"
"approximate lasso","October 2, 2016","xi'an","https://www.r-bloggers.com/author/xian/"
"Binomial Logistic Regression.","October 2, 2016","datadrumstick","https://www.r-bloggers.com/author/datadrumstick/"
"GirlswithDeepPockets.com","October 2, 2016","Steph","https://www.r-bloggers.com/author/steph/"
"How To Make a Scatter Plot in R for AP Statistics Using R Markdown","October 2, 2016","Kevin","https://www.r-bloggers.com/author/kevin/"
"Analyzing #first7jobs tweets with Monkeylearn and R","October 1, 2016","Maëlle Salmon","https://www.r-bloggers.com/author/maelle-salmon/"
"RcppAnnoy 0.0.8","October 1, 2016","Thinking inside the box","https://www.r-bloggers.com/author/thinking-inside-the-box/"
"R code to accompany Real-World Machine Learning (Chapter 2)","October 1, 2016","data prone - R","https://www.r-bloggers.com/author/data-prone-r/"
"Watching the Watchers – An Analysis of Pakistani Journalists using their Twitter Data","October 1, 2016","Ali Arsalan Kazmi","https://www.r-bloggers.com/author/ali-arsalan-kazmi/"
"R Course Finder update","October 1, 2016","Onno Dijt","https://www.r-bloggers.com/author/onno-dijt/"
"On the German Tank / Taxicab Problem","November 30, 2016","Frank Portman","https://www.r-bloggers.com/author/frank-portman/"
"The hourly heatmap with ggplot2","November 30, 2016","HighlandR","https://www.r-bloggers.com/author/highlandr/"
"The hourly heatmap with ggplot2","November 30, 2016","HighlandR","https://www.r-bloggers.com/author/highlandr/"
"asymptotically exact inference in likelihood-free models [a reply from the authors]","November 30, 2016","xi'an","https://www.r-bloggers.com/author/xian/"
"Euler Problem 1: Multiples of 3 or 5","November 30, 2016","Peter Prevos","https://www.r-bloggers.com/author/peter-prevos/"
"Frequency and chi-square test for independence Exercises","November 30, 2016","Hasan Imtiaz","https://www.r-bloggers.com/author/hasan-imtiaz/"
"Missing Values, Data Science and R","November 30, 2016","Joseph Rickert","https://www.r-bloggers.com/author/joseph-rickert/"
"Jupyter And R Markdown: Notebooks With R","November 30, 2016","DataCamp Blog","https://www.r-bloggers.com/author/datacamp-blog/"
"Microsoft R Open 3.3.2 now available","November 30, 2016","David Smith","https://www.r-bloggers.com/author/david-smith/"
"How to Summarize a Data Frame by Groups in R","November 30, 2016","Douglas E Rice","https://www.r-bloggers.com/author/douglas-e-rice/"
"satRday in Cape Town (from Exegetic Analytics)","November 30, 2016","Andrew Collier","https://www.r-bloggers.com/author/andrew-collier/"
"Package ggguitar on CRAN","November 30, 2016","C","https://www.r-bloggers.com/author/c/"
"BERT: a newcomer in the R Excel connection","November 30, 2016","The R Trader","https://www.r-bloggers.com/author/the-r-trader/"
"ggplot2: multiple legends for the same aesthetic","November 30, 2016","Nicola Sturaro","https://www.r-bloggers.com/author/nicola-sturaro/"
"Visualization Example: Interactive Oilfield Map","November 30, 2016","Steffen","https://www.r-bloggers.com/author/steffen/"
"vtreat data cleaning and preparation article now available on arXiv","November 30, 2016","John Mount","https://www.r-bloggers.com/author/john-mount/"
"Extract Twitter Data Automatically using Scheduler R package","November 29, 2016","Leonardo Toglia","https://www.r-bloggers.com/author/leonardo-toglia/"
"Russell 2000 Quantitative Stock Analysis in R: Six Stocks with Amazing, Consistent Growth","November 29, 2016","mattdancho.com - Articles","https://www.r-bloggers.com/author/mattdancho-com-articles/"
"How to create a ggplot Theme – Unicorn Edition","November 29, 2016","Florian Teschner","https://www.r-bloggers.com/author/florian-teschner/"
"Free online course: Analyzing big data with Microsoft R Server","November 29, 2016","David Smith","https://www.r-bloggers.com/author/david-smith/"
"Create, Interpret, and Use a Linear Regression Model in R","November 29, 2016","Douglas E Rice","https://www.r-bloggers.com/author/douglas-e-rice/"
"Examine a Data Frame in R with 7 Basic Functions","November 29, 2016","Douglas E Rice","https://www.r-bloggers.com/author/douglas-e-rice/"
"5 Ways to Subset a Data Frame in R","November 29, 2016","Douglas E Rice","https://www.r-bloggers.com/author/douglas-e-rice/"
"Nesting Functions in R with the Piping Operator","November 29, 2016","Douglas E Rice","https://www.r-bloggers.com/author/douglas-e-rice/"
"Repeated measures ANOVA in R Exercises","November 29, 2016","Sammy Ngugi","https://www.r-bloggers.com/author/sammy-ngugi/"
"The Hitchhiker’s Guide to Ggplot2 in R","November 29, 2016","""Mauricio Vargas S. <U+5E15><U+590F>""","https://www.r-bloggers.com/author/mauricio-vargas-s/"
"DataChats: An interview with Garrett Grolemund","November 29, 2016","DataCamp Blog","https://www.r-bloggers.com/author/datacamp-blog/"
"A new `subprocess` package for R","November 29, 2016","Lukasz","https://www.r-bloggers.com/author/lukasz/"
"Working at RStudio","November 28, 2016","Max Kuhn","https://www.r-bloggers.com/author/max-kuhn/"
"Seasonal Analysis in EGRET","November 28, 2016","The USGS OWI blog","https://www.r-bloggers.com/author/the-usgs-owi-blog/"
"elasticsearchr – a Lightweight Elasticsearch Client for R","November 28, 2016","alexioannides","https://www.r-bloggers.com/author/alexioannides/"
"Bill and Ted Make the best out of a Shi… Stata situation: Rstudio + Rstata + Stata","November 28, 2016","MikeJackTzen","https://www.r-bloggers.com/author/mikejacktzen/"
"Data frame exercises Vol. 2","November 28, 2016","Maria Elisa Bertinat Tulipano","https://www.r-bloggers.com/author/maria-elisa-bertinat-tulipano/"
"A heat map of Divvy bike riders in Chicago","November 28, 2016","David Smith","https://www.r-bloggers.com/author/david-smith/"
"Simulation in R For AP Statistics","November 28, 2016","Kevin","https://www.r-bloggers.com/author/kevin/"
"Simple Anagram Finder Using R","November 27, 2016","John","https://www.r-bloggers.com/author/john/"
"More about Flexible Frequency Models","November 27, 2016","statcompute","https://www.r-bloggers.com/author/statcompute/"
"anytime 0.1.1: More robust","November 27, 2016","Thinking inside the box","https://www.r-bloggers.com/author/thinking-inside-the-box/"
"String Manipulation – Exercises","November 27, 2016","Miodrag Sljukic","https://www.r-bloggers.com/author/miodrag-sljukic/"
"Basic Shiny Application","November 27, 2016","Steffen","https://www.r-bloggers.com/author/steffen/"
"Plotting my trips with ubeR","November 27, 2016","Simon Jackson","https://www.r-bloggers.com/author/simon-jackson/"
"Building a column selecter","November 27, 2016","That’s so Random","https://www.r-bloggers.com/author/thats-so-random/"
"Daily metric tracking with ggplot2","November 26, 2016","HighlandR","https://www.r-bloggers.com/author/highlandr/"
"Daily metric tracking with ggplot2","November 26, 2016","HighlandR","https://www.r-bloggers.com/author/highlandr/"
"Can we predict flu deaths with Machine Learning and R?","November 26, 2016","Shirin's playgRound","https://www.r-bloggers.com/author/shirins-playground/"
"The Effective Number of Parties in the Electorate by Year and Region","November 26, 2016","Daniel's Blog","https://www.r-bloggers.com/author/daniels-blog/"
"Error, trend, seasonality –  ets and its forecast model friends","November 26, 2016","Peter's stats stuff - R","https://www.r-bloggers.com/author/peters-stats-stuff-r/"
"Learning R programming by reading books: A book list #rstats","November 26, 2016","Liang-Cheng Zhang","https://www.r-bloggers.com/author/liang-cheng-zhang/"
"How to write and document %special% functions in R","November 26, 2016","Peter Solymos","https://www.r-bloggers.com/author/peter-solymos/"
"Compare Dates With RForcecom","November 25, 2016","Dan Thompson","https://www.r-bloggers.com/author/dan-thompson/"
"Compare Dates With RForcecom","November 25, 2016","Dan Thompson","https://www.r-bloggers.com/author/dan-thompson/"
"Deck on an Authorial Analysis of the Prime Minister’s Speeches","November 25, 2016","Ali Arsalan Kazmi","https://www.r-bloggers.com/author/ali-arsalan-kazmi/"
"Some Technical Reading JBR","November 25, 2016","Joseph Rickert","https://www.r-bloggers.com/author/joseph-rickert/"
"RStudio Server on OS X Sierra","November 25, 2016","""Mauricio Vargas S. <U+5E15><U+590F>""","https://www.r-bloggers.com/author/mauricio-vargas-s/"
"Chi-Square Test of Independence in R","November 25, 2016","Easy Guides","https://www.r-bloggers.com/author/easy-guides/"
