"Title","Date","Author","Author_Hyperlink"
"Data Cleaning Part 1 – NYC Taxi Trip Data, Looking For Stories Behind Errors","January 31, 2016","dracodoc","https://www.r-bloggers.com/author/dracodoc/"
"Introduction to RcppNT2","January 31, 2016","Rcpp Gallery","https://www.r-bloggers.com/author/rcpp-gallery/"
"Using RcppNT2 to Compute the Variance","January 31, 2016","Rcpp Gallery","https://www.r-bloggers.com/author/rcpp-gallery/"
"Using RcppNT2 to Compute the Sum","January 31, 2016","Rcpp Gallery","https://www.r-bloggers.com/author/rcpp-gallery/"
"Connecting Religion and Demographics","January 31, 2016","Julia Silge","https://www.r-bloggers.com/author/julia-silge/"
"Using RcppNT2 to Compute the Variance","January 31, 2016","Rcpp Gallery","https://www.r-bloggers.com/author/rcpp-gallery/"
"Introduction to RcppNT2","January 31, 2016","Rcpp Gallery","https://www.r-bloggers.com/author/rcpp-gallery/"
"Shiny Developer Conference","January 31, 2016","John Mount","https://www.r-bloggers.com/author/john-mount/"
"R Tagosphere!","January 31, 2016","Amit","https://www.r-bloggers.com/author/amit/"
"Pitfall of XML package:  issues specific to cp932 locale, Japanese Shift-JIS, on Windows","January 31, 2016","tomizono","https://www.r-bloggers.com/author/tomizono/"
"Hillary Clinton’s Biggest 2016 Rival: Herself","January 30, 2016","Francis Smart","https://www.r-bloggers.com/author/francis-smart/"
"Strategies to Speedup R Code","January 30, 2016","Selva Prabhakaran","https://www.r-bloggers.com/author/selva-prabhakaran/"
"Manhattan Rental Rates | Plotting Rental and Spatial Data","January 30, 2016","Abdalla","https://www.r-bloggers.com/author/abdalla/"
"Manhattan Rental Rates | Plotting Rental and Spatial Data","January 30, 2016","screenshotguy","https://www.r-bloggers.com/author/screenshotguy/"
"R Graph Objects: igraph vs. network","January 30, 2016","Gregory Kanevsky","https://www.r-bloggers.com/author/gregory-kanevsky/"
"The R-Podcast Episode 16: Interview with Dean Attali","January 30, 2016","Eric","https://www.r-bloggers.com/author/eric/"
"The correlation between original and replication effect sizes might be spurious","January 29, 2016","Daniel Lakens","https://www.r-bloggers.com/author/daniel-lakens/"
"The correlation between original and replication effect sizes might be spurious","January 29, 2016","Daniel Lakens","https://www.r-bloggers.com/author/daniel-lakens/"
"New Yorkers, municipal bikes, and the weather","January 29, 2016","David Smith","https://www.r-bloggers.com/author/david-smith/"
"Stop Press: Additional dates for the 2016 Prior Exposure Bayesian Data Analysis workshops","January 29, 2016","Thom Baguley","https://www.r-bloggers.com/author/thom-baguley/"
"2016 Prior Exposure Bayesian Data Analysis workshops for social scientists","January 29, 2016","Thom Baguley","https://www.r-bloggers.com/author/thom-baguley/"
"Formal informal testing of research code","January 29, 2016","philmikejones","https://www.r-bloggers.com/author/philmikejones/"
"Cricket analytics with cricketr!!!","January 29, 2016","Tinniam V Ganesh","https://www.r-bloggers.com/author/tinniam-v-ganesh/"
"FQDN (Fully Qualified Domain Names) in R","January 29, 2016","Mango Blogger","https://www.r-bloggers.com/author/mango-blogger/"
"Better prediction intervals for time series forecasts","January 29, 2016","Peter's stats stuff - R","https://www.r-bloggers.com/author/peters-stats-stuff-r/"
"Visualizing international demographic indicators with idbr and Plotly","January 28, 2016","Kyle Walker","https://www.r-bloggers.com/author/kyle-walker/"
"Visualizing international demographic indicators with idbr and Plotly","January 28, 2016","Kyle Walker","https://www.r-bloggers.com/author/kyle-walker/"
"Obama 2008 received 3x more media coverage than Sanders 2016","January 28, 2016","Francis Smart","https://www.r-bloggers.com/author/francis-smart/"
"Obama 2008 recieved 3x more media coverage than Sanders 2016","January 28, 2016","Francis Smart","https://www.r-bloggers.com/author/francis-smart/"
"Adding basemap.at tiles to an R leaflet plot","January 28, 2016","Verena","https://www.r-bloggers.com/author/verena/"
"This is just a test page for forecastersblog.org","January 28, 2016","Ivan Svetunkov","https://www.r-bloggers.com/author/ivan-svetunkov/"
"R User Groups on GitHub","January 28, 2016","Joseph Rickert","https://www.r-bloggers.com/author/joseph-rickert/"
"A Million Text Files And A Single Laptop","January 28, 2016","Randy Zwitch","https://www.r-bloggers.com/author/randy-zwitch/"
"Adelaide Traffic – Part I","January 28, 2016","Jonathan Carroll","https://www.r-bloggers.com/author/jonathan-carroll/"
"A Million Text Files And A Single Laptop","January 28, 2016","randyzwitch.com","https://www.r-bloggers.com/author/randyzwitch-com/"
"Discount R courses at Simplilearn","January 28, 2016","Tal Galili","https://www.r-bloggers.com/author/rlover/"
"love-hate Metropolis algorithm","January 27, 2016","xi'an","https://www.r-bloggers.com/author/xian/"
"In-depth analysis of Twitter activity and sentiment, with R","January 27, 2016","David Smith","https://www.r-bloggers.com/author/david-smith/"
"Materials for NYU Shortcourse “Data Science and Social Science”","January 27, 2016","Alex","https://www.r-bloggers.com/author/alex/"
"Intro to Sound Analysis with R","January 27, 2016","Tal Galili","https://www.r-bloggers.com/author/rlover/"
"Delaware versus Chesapeake revisited","January 26, 2016","AdventuresInData","https://www.r-bloggers.com/author/adventuresindata/"
"Delaware versus Chesapeake revisited","January 26, 2016","AdventuresInData","https://www.r-bloggers.com/author/adventuresindata/"
"How To Import Data Into R – New Course","January 26, 2016","DataCamp Blog","https://www.r-bloggers.com/author/datacamp-blog/"
"R typos","January 26, 2016","xi'an","https://www.r-bloggers.com/author/xian/"
"H2o encoders starter","January 26, 2016","Vincent D. Warmerdam","https://www.r-bloggers.com/author/vincent-d-warmerdam/"
"Conditional execution exercises","January 26, 2016","r-exercises","https://www.r-bloggers.com/author/r-exercises/"
"“Introduction to Data Science” video course contest is closed","January 26, 2016","Nina Zumel","https://www.r-bloggers.com/author/nina-zumel/"
"Need any more reason to love R-Shiny? Here: you can even use Shiny to create simple games!","January 26, 2016","Dean Attali's R Blog","https://www.r-bloggers.com/author/dean-attalis-r-blog/"
"Need any more reason to love R-Shiny? Here: you can even use Shiny to create simple games!","January 26, 2016","Dean Attali's R Blog","https://www.r-bloggers.com/author/dean-attalis-r-blog/"
"Pipelining R and Python in Notebooks","January 26, 2016","Joseph Rickert","https://www.r-bloggers.com/author/joseph-rickert/"
"Linear regression with random error giving EXACT predefined parameter estimates","January 26, 2016","anspiess","https://www.r-bloggers.com/author/anspiess/"
"Launching Data Science Africa Blog","January 26, 2016","Daniel Emaasit","https://www.r-bloggers.com/author/daniel-emaasit/"
"Bayesian regression with STAN Part 2: Beyond normality","January 26, 2016","Lionel Hertzog","https://www.r-bloggers.com/author/lionel-hertzog/"
"Flowing triangles","January 26, 2016","Markus Gesmann","https://www.r-bloggers.com/author/markus-gesmann/"
"How to create confounders with regression: a lesson from causal inference","January 25, 2016","Ben Ogorek","https://www.r-bloggers.com/author/ben-ogorek/"
"Flowing triangles","January 25, 2016","R on mages' blog","https://www.r-bloggers.com/author/r-on-mages-blog/"
"high dimension Metropolis-Hastings algorithms","January 25, 2016","xi'an","https://www.r-bloggers.com/author/xian/"
"American Community Survey analyzed with R","January 25, 2016","David Smith","https://www.r-bloggers.com/author/david-smith/"
"Mapping US Religion Adherence by County in R","January 25, 2016","Julia Silge","https://www.r-bloggers.com/author/julia-silge/"
"11 new R jobs from around the world (2016-01-25)","January 25, 2016","Tal Galili","https://www.r-bloggers.com/author/rlover/"
"Using sparklines in R projects","January 25, 2016","Appsilon Data Science - R language","https://www.r-bloggers.com/author/appsilon-data-science-r-language/"
"Do basic R operations much faster in bash [Slightly off-topic]","January 25, 2016","Sascha W.","https://www.r-bloggers.com/author/sascha-w/"
"Do basic R operations much faster in bash [Slightly off-topic]","January 25, 2016","Sascha W.","https://www.r-bloggers.com/author/sascha-w/"
"I will survive!","January 25, 2016","Gianluca Baio","https://www.r-bloggers.com/author/gianluca-baio/"
"I will survive!","January 25, 2016","Gianluca Baio","https://www.r-bloggers.com/author/gianluca-baio/"
"analyze the pesquisa nacional de saude (pns) with r","January 25, 2016","Anthony Damico","https://www.r-bloggers.com/author/anthony-damico/"
"RcppExamples 0.1.7","January 24, 2016","Thinking inside the box","https://www.r-bloggers.com/author/thinking-inside-the-box/"
"I will survive!","January 24, 2016","R on Gianluca Baio","https://www.r-bloggers.com/author/r-on-gianluca-baio/"
"More Fun with Choropleth Maps","January 24, 2016","Julia Silge","https://www.r-bloggers.com/author/julia-silge/"
"The ‘rsvg’ Package: High Quality Image Rendering in R","January 24, 2016","Jeroen Ooms","https://www.r-bloggers.com/author/jeroen-ooms/"
"Using webp in R: A New Format for Lossless and Lossy Image Compression","January 24, 2016","Jeroen Ooms","https://www.r-bloggers.com/author/jeroen-ooms/"
"Writing fast asynchronous SGD/AdaGrad with RcppParallel","January 23, 2016","Rcpp Gallery","https://www.r-bloggers.com/author/rcpp-gallery/"
"Intro to Text Analysis with R","January 23, 2016","Tal Galili","https://www.r-bloggers.com/author/rlover/"
"Some Comments on Donaho’s “50 Years of Data Science”","January 23, 2016","matloff","https://www.r-bloggers.com/author/matloff/"
"RcppEigen 0.3.2.7.0","January 22, 2016","Thinking inside the box","https://www.r-bloggers.com/author/thinking-inside-the-box/"
"RcppCCTZ 0.0.3","January 22, 2016","Thinking inside the box","https://www.r-bloggers.com/author/thinking-inside-the-box/"
"Big or small-lets save them all- Visualizing Data","January 22, 2016","Ashish Dutt","https://www.r-bloggers.com/author/ashish-dutt/"
"On Panel Sizes","January 22, 2016","Florian Teschner","https://www.r-bloggers.com/author/florian-teschner/"
"Running R jobs quickly on many machines","January 22, 2016","John Mount","https://www.r-bloggers.com/author/john-mount/"
"So you want to be a Data Science superstar","January 22, 2016","Robert","https://www.r-bloggers.com/author/robert/"
"Hierarchical Clustering in R","January 22, 2016","Teja Kodali","https://www.r-bloggers.com/author/teja-kodali/"
"Getting Started with Markov Chains: Part 2","January 22, 2016","Joseph Rickert","https://www.r-bloggers.com/author/joseph-rickert/"
"Kaggle: Santa’s Stolen Sleigh","January 22, 2016","Andrew Collier","https://www.r-bloggers.com/author/andrew-collier/"
"Modelling With the Generalized Hermite Distribution","January 22, 2016","Dave Giles","https://www.r-bloggers.com/author/dave-giles/"
"Modelling With the Generalized Hermite Distribution","January 22, 2016","Dave Giles","https://www.r-bloggers.com/author/dave-giles/"
"Filling in the gaps – highly granular estimates of income and population for New Zealand from survey data","January 22, 2016","Peter's stats stuff - R","https://www.r-bloggers.com/author/peters-stats-stuff-r/"
"Fun Data for teaching R","January 21, 2016","ibartomeus","https://www.r-bloggers.com/author/ibartomeus/"
"Kéry and Schaub’s Bayesian Population Analysis Translated to Stan","January 21, 2016","Bob Carpenter","https://www.r-bloggers.com/author/bob-carpenter/"
"RStudio Addin Code-Helpers for Plotting","January 21, 2016","R Contour - R","https://www.r-bloggers.com/author/r-contour-r/"
"R & GGMap Visualization Case Study","January 21, 2016","Tal Galili","https://www.r-bloggers.com/author/rlover/"
"Upcoming Microsoft R Webinars","January 21, 2016","David Smith","https://www.r-bloggers.com/author/david-smith/"
"Learn R From Scratch – Part 3","January 21, 2016","Selva Prabhakaran","https://www.r-bloggers.com/author/selva-prabhakaran/"
"A Checkpoint Of Spanish Football League","January 20, 2016","aschinchon","https://www.r-bloggers.com/author/aschinchon/"
"100 “must read” R-bloggers’ posts for 2015","January 20, 2016","Tal Galili","https://www.r-bloggers.com/author/rlover/"
"Shiny 0.13.0","January 20, 2016","winstonchang","https://www.r-bloggers.com/author/winstonchang/"
"Big data in ranching and animal husbandry","January 20, 2016","Brian Lee Yung Rowe","https://www.r-bloggers.com/author/brian-lee-yung-rowe/"
"Win-Vector data science mailing list (and a give-away!)","January 20, 2016","John Mount","https://www.r-bloggers.com/author/john-mount/"
"Prepping Data for Analysis using R","January 20, 2016","John Mount","https://www.r-bloggers.com/author/john-mount/"
"Jim Albert’s Baseball Blog","January 20, 2016","Bob Carpenter","https://www.r-bloggers.com/author/bob-carpenter/"
"Microsoft R Open 3.2.3 now available","January 20, 2016","David Smith","https://www.r-bloggers.com/author/david-smith/"
"Learn R From Scratch – Part 2","January 20, 2016","Selva Prabhakaran","https://www.r-bloggers.com/author/selva-prabhakaran/"
"Quantitative Trading Strategy Using R: A Step by Step Guide","January 20, 2016","R programming","https://www.r-bloggers.com/author/r-programming/"
"State of the Union Speeches and Data","January 20, 2016","jlebeau","https://www.r-bloggers.com/author/jlebeau/"
"State of the Union Speeches and Data","January 20, 2016","jlebeau","https://www.r-bloggers.com/author/jlebeau/"
"R trends in 2015 (based on cranlogs)","January 20, 2016","Max Gordon","https://www.r-bloggers.com/author/max-gordon/"
"Heston model for Options pricing with ESGtoolkit","January 20, 2016","Thierry Moudiki's blog","https://www.r-bloggers.com/author/thierry-moudikis-blog/"
"Mean and Quantile Regression using Mosek","January 19, 2016","Ignacio Sarmiento Barbieri","https://www.r-bloggers.com/author/ignacio-sarmiento-barbieri/"
"Who are Turkopticon’s Top Contributors?","January 19, 2016","Francis Smart","https://www.r-bloggers.com/author/francis-smart/"
"Who are Turkopticon’s Top Contributors?","January 19, 2016","Francis Smart","https://www.r-bloggers.com/author/francis-smart/"
"Learn R From Scratch – Part 1","January 19, 2016","Selva Prabhakaran","https://www.r-bloggers.com/author/selva-prabhakaran/"
"miniCRAN – developing internal CRAN Repositories","January 19, 2016","Mango Blogger","https://www.r-bloggers.com/author/mango-blogger/"
"Mastering R Plot – Part 1: colors, legends and lines","January 19, 2016","Lionel Hertzog","https://www.r-bloggers.com/author/lionel-hertzog/"
"A gentle introduction to parallel computing in R","January 19, 2016","Joseph Rickert","https://www.r-bloggers.com/author/joseph-rickert/"
"Bring Your Own Tool: the Latest Trend in Data Analysis","January 19, 2016","Raquel Sapnu","https://www.r-bloggers.com/author/raquel-sapnu/"
"Data Manipulation in R: Beyond SQL","January 19, 2016","C","https://www.r-bloggers.com/author/c/"
"Data Manipulation in R: Beyond SQL","January 19, 2016","C","https://www.r-bloggers.com/author/c/"
"Casting a Wide (and Sparse) Matrix in R","January 19, 2016","Andrew Collier","https://www.r-bloggers.com/author/andrew-collier/"
"Formatting table output in R","January 19, 2016","R on mages' blog","https://www.r-bloggers.com/author/r-on-mages-blog/"
"Formatting table output in R","January 19, 2016","Markus Gesmann","https://www.r-bloggers.com/author/markus-gesmann/"
"South Carolina Republican Debate with R","January 19, 2016","En El Margen - R-English","https://www.r-bloggers.com/author/en-el-margen-r-english/"
"Water World","January 18, 2016","Julia Silge","https://www.r-bloggers.com/author/julia-silge/"
"Central Iowa R User Group Talk [Updated]","January 18, 2016","Max Kuhn","https://www.r-bloggers.com/author/max-kuhn/"
"Central Iowa R User Group Talk [Updated]","January 18, 2016","Max Kuhn","https://www.r-bloggers.com/author/max-kuhn/"
"Use R to connect to twitter and create a wordcloud of your tweets","January 18, 2016","Verena","https://www.r-bloggers.com/author/verena/"
"Visualizing Census Estimate Margins of Error in R","January 18, 2016","Ari Lamstein","https://www.r-bloggers.com/author/ari-lamstein/"
"Creating plots in R using ggplot2 – part 4: stacked bar plots","January 18, 2016","""Mauricio Vargas S. <U+5E15><U+590F>""","https://www.r-bloggers.com/author/mauricio-vargas-s/"
"The Rise of Transparent Data Journalism – The BuzzFeed Tennis Match Fixing Data Analysis Notebook","January 18, 2016","Tony Hirst","https://www.r-bloggers.com/author/tony-hirst/"
"Introduction to CellMiner and rcellminer","January 18, 2016","Augustin Luna","https://www.r-bloggers.com/author/augustin-luna/"
"MCqMC 2016","January 18, 2016","xi'an","https://www.r-bloggers.com/author/xian/"
"Introduction to Statistical Methods in R","January 18, 2016","Augustin Luna","https://www.r-bloggers.com/author/augustin-luna/"
"Introduction to R Shiny Web Applications","January 18, 2016","Augustin Luna","https://www.r-bloggers.com/author/augustin-luna/"
"Confidence Regions for Parameters in the Simplex","January 18, 2016","arthur charpentier","https://www.r-bloggers.com/author/arthur-charpentier/"
"Introduction to R","January 18, 2016","Augustin Luna","https://www.r-bloggers.com/author/augustin-luna/"
"Google Geo Data – Data Access Without Restrictions","January 18, 2016","Daniel Boller","https://www.r-bloggers.com/author/daniel-boller/"
"ahp 0.2.4 on CRAN","January 18, 2016","gluc","https://www.r-bloggers.com/author/gluc/"
"Scheduling R Markdown Reports via Email","January 17, 2016","Marco Pasin","https://www.r-bloggers.com/author/marco-pasin/"
"Scheduling R Markdown Reports via Email","January 17, 2016","Marco Pasin","https://www.r-bloggers.com/author/marco-pasin/"
"Installing to R and RStudio","January 17, 2016","Augustin Luna","https://www.r-bloggers.com/author/augustin-luna/"
"Population Model Revisited","January 17, 2016","AdventuresInData","https://www.r-bloggers.com/author/adventuresindata/"
"Population Model Revisited","January 17, 2016","AdventuresInData","https://www.r-bloggers.com/author/adventuresindata/"
"stplanr 0.1.1","January 17, 2016","Robin Lovelace - R","https://www.r-bloggers.com/author/robin-lovelace-r/"
"Data analysis with ProjectTemplate in RStudio with Git","January 17, 2016","data prone - R","https://www.r-bloggers.com/author/data-prone-r/"
"Set up RStudio in the cloud to work with GitHub","January 17, 2016","Ken Kleinman","https://www.r-bloggers.com/author/ken-kleinman/"
"Set up RStudio in the cloud to work with GitHub","January 17, 2016","Ken Kleinman","https://www.r-bloggers.com/author/ken-kleinman/"
"Automating R exercises and exams using the exams package","January 17, 2016","Shravan Vasishth","https://www.r-bloggers.com/author/shravan-vasishth/"
"Nina Zumel and John Mount part of R Day at Strata + Hadoop World in San Jose 2016","January 17, 2016","John Mount","https://www.r-bloggers.com/author/john-mount/"
"A simple ANOVA","January 17, 2016","Wingfeet","https://www.r-bloggers.com/author/wingfeet/"
"A simple ANOVA","January 17, 2016","Wingfeet","https://www.r-bloggers.com/author/wingfeet/"
"Chilean copper crisis is more than just prices","January 17, 2016","""Mauricio Vargas S. <U+5E15><U+590F>""","https://www.r-bloggers.com/author/mauricio-vargas-s/"
"First step on GIS with R","January 17, 2016","tomizono","https://www.r-bloggers.com/author/tomizono/"
"Creating Calendars for Future’s Expiration","January 17, 2016","quintuitive","https://www.r-bloggers.com/author/quintuitive/"
"ggtern 2.0 now available","January 16, 2016","Nicholas Hamilton","https://www.r-bloggers.com/author/nicholas-hamilton/"
"Two Y-Axes","January 16, 2016","Kieran Healy","https://www.r-bloggers.com/author/kieran-healy/"
"Artificial Intelligence in the News?","January 16, 2016","Florian Teschner","https://www.r-bloggers.com/author/florian-teschner/"
"NBA Stat in a Shiny App","January 16, 2016","Jun Ma - Data Blog","https://www.r-bloggers.com/author/jun-ma-data-blog/"
"S-shaped data: Smoothing with quasibinomial distribution","January 16, 2016","msuzen","https://www.r-bloggers.com/author/msuzen/"
"S-shaped data: Smoothing with quasibinomial distribution","January 16, 2016","msuzen","https://www.r-bloggers.com/author/msuzen/"
"10 D3.js and WebGL weather, maps, and geography charts made in Python and R","January 16, 2016","Riddhiman","https://www.r-bloggers.com/author/riddhiman/"
"Turkopticon: Defender of Amazon’s Anonymous Workforce","January 16, 2016","Francis Smart","https://www.r-bloggers.com/author/francis-smart/"
"Turkopticon: Defender of Amazon’s Anonymous Workforce","January 16, 2016","Francis Smart","https://www.r-bloggers.com/author/francis-smart/"
"McElreath’s Statistical Rethinking: A Bayesian Course with Examples in R and Stan","January 15, 2016","Bob Carpenter","https://www.r-bloggers.com/author/bob-carpenter/"
"Using Excel versus using R","January 15, 2016","John Mount","https://www.r-bloggers.com/author/john-mount/"
"Artificial Intelligence: Solving the Chinese Room Argument","January 15, 2016","Patrick Rhodes","https://www.r-bloggers.com/author/patrick-rhodes/"
"RcppParallel: Getting R and C++ to work (some more) in parallel","January 15, 2016","jjallaire","https://www.r-bloggers.com/author/jjallaire/"
"Kaggle: Walmart Trip Type Classification","January 15, 2016","Andrew Collier","https://www.r-bloggers.com/author/andrew-collier/"
"Update to plot.qcc using ggplot2 and grid","January 15, 2016","Thomas Hopper","https://www.r-bloggers.com/author/thomas-hopper/"
"In case you missed it: December 2015 roundup","January 15, 2016","David Smith","https://www.r-bloggers.com/author/david-smith/"
"Speeding “Bayesian Power Analysis t-test” up with Snowfall","January 15, 2016","David Zimmermann","https://www.r-bloggers.com/author/david-zimmermann/"
"Data Science Radar – Communicator Profile","January 15, 2016","Mango Blogger","https://www.r-bloggers.com/author/mango-blogger/"
"Twitter Authentication with R","January 15, 2016","Julian Hillebrand","https://www.r-bloggers.com/author/julian-hillebrand/"
"ggtree supports phylip tree format","January 14, 2016","R on Guangchuang Yu","https://www.r-bloggers.com/author/r-on-guangchuang-yu/"
"New Tutorial Launched: Introduction to Machine Learning","January 14, 2016","DataCamp Blog","https://www.r-bloggers.com/author/datacamp-blog/"
"Learn R interactively with our new Introduction to R tutorial","January 14, 2016","DataCamp Blog","https://www.r-bloggers.com/author/datacamp-blog/"
"New online R tutorial by DataCamp: Intermediate R programming","January 14, 2016","DataCamp Blog","https://www.r-bloggers.com/author/datacamp-blog/"
"R Markdown Tutorial by RStudio and DataCamp","January 14, 2016","DataCamp Blog","https://www.r-bloggers.com/author/datacamp-blog/"
"ggvis tutorial: become a data visualization expert with RStudio","January 14, 2016","DataCamp Blog","https://www.r-bloggers.com/author/datacamp-blog/"
"New Course! A hands-on introduction to statistics with R by A. Conway (Princeton University)","January 14, 2016","DataCamp Blog","https://www.r-bloggers.com/author/datacamp-blog/"
"Complete dplyr tutorial for data analytics and data manipulation in R","January 14, 2016","DataCamp Blog","https://www.r-bloggers.com/author/datacamp-blog/"
"Complete data.table tutorial: Data analysis the data.table way","January 14, 2016","DataCamp Blog","https://www.r-bloggers.com/author/datacamp-blog/"
"Quandl Tutorial: learn to use quandl in R","January 14, 2016","DataCamp Blog","https://www.r-bloggers.com/author/datacamp-blog/"
"R in the cloud: R-fiddle of the Week","January 14, 2016","DataCamp Blog","https://www.r-bloggers.com/author/datacamp-blog/"
"Interactive R courses: free finance and data science courses","January 14, 2016","DataCamp Blog","https://www.r-bloggers.com/author/datacamp-blog/"
"R in the cloud: R-Fiddle, an online playground for R code","January 14, 2016","DataCamp Blog","https://www.r-bloggers.com/author/datacamp-blog/"
"Search r documentation and manuals with Rdocumentation","January 14, 2016","DataCamp Blog","https://www.r-bloggers.com/author/datacamp-blog/"
"Building DataMind: FREE Online Interactive Learning Platform for R","January 14, 2016","DataCamp Blog","https://www.r-bloggers.com/author/datacamp-blog/"
"R and education: a survey on the use of R in education","January 14, 2016","DataCamp Blog","https://www.r-bloggers.com/author/datacamp-blog/"
"Mini AI app using TensorFlow and Shiny","January 14, 2016","Yuki Katoh","https://www.r-bloggers.com/author/yuki-katoh/"
"Mini AI app using TensorFlow and Shiny","January 14, 2016","Yuki Katoh","https://www.r-bloggers.com/author/yuki-katoh/"
"Big or small-lets save them all- Making Data Management Decisions","January 14, 2016","Ashish Dutt","https://www.r-bloggers.com/author/ashish-dutt/"
"Talk to Upstate Data Science Group on Caret","January 14, 2016","John Johnson","https://www.r-bloggers.com/author/john-johnson/"
"Talk to Upstate Data Science Group on Caret","January 14, 2016","John Johnson","https://www.r-bloggers.com/author/john-johnson/"
"New Data Sources for R","January 14, 2016","Joseph Rickert","https://www.r-bloggers.com/author/joseph-rickert/"
"rstanarm and more!","January 14, 2016","andrew","https://www.r-bloggers.com/author/andrew/"
"Power analysis for default Bayesian t-tests","January 14, 2016","Daniel Lakens","https://www.r-bloggers.com/author/daniel-lakens/"
"Power analysis for default Bayesian t-tests","January 14, 2016","Daniel Lakens","https://www.r-bloggers.com/author/daniel-lakens/"
"Philip Glass Composition and Exploding Boxplot","January 14, 2016","jlebeau","https://www.r-bloggers.com/author/jlebeau/"
"Philip Glass Composition and Exploding Boxplot","January 14, 2016","jlebeau","https://www.r-bloggers.com/author/jlebeau/"
