"Title","Date","Author","Author_Hyperlink"
"Timezone conversion in R","July 25, 2016","Leo Li","https://www.r-bloggers.com/author/leo-li/"
"Read a lot of datasets at once with R","July 25, 2016","Econometrics and Free Software","https://www.r-bloggers.com/author/econometrics-and-free-software/"
"RcppHoney Introduction","July 25, 2016","Rcpp Gallery","https://www.r-bloggers.com/author/rcpp-gallery/"
"Read a lot of datasets at once with R","July 25, 2016","Bruno Rodrigues","https://www.r-bloggers.com/author/bruno-rodrigues/"
"Microsoft R Open 3.3.0 now available","July 25, 2016","David Smith","https://www.r-bloggers.com/author/david-smith/"
"Showing code changes when teaching","July 25, 2016","Robin Wilson","https://www.r-bloggers.com/author/robin-wilson/"
"Economy and dynamic modelling: Haavelmo’s approach","July 25, 2016","msuzen","https://www.r-bloggers.com/author/msuzen/"
"Economy and dynamic modelling: Haavelmo’s approach","July 25, 2016","msuzen","https://www.r-bloggers.com/author/msuzen/"
"Image recognition in R using convolutional neural networks with the MXNet package","July 25, 2016","Mic","https://www.r-bloggers.com/author/mic/"
"Image recognition in R using convolutional neural networks with the MXNet package","July 25, 2016","Mic","https://www.r-bloggers.com/author/mic/"
"Spark, RStudio and Shiny servers in a docker cluster hosted by Carina","July 24, 2016","Angel Sevilla Camins' Blog","https://www.r-bloggers.com/author/angel-sevilla-camins-blog/"
"The collaborative innovation landscape in data science","July 24, 2016","Murtaza Haider","https://www.r-bloggers.com/author/murtaza-haider/"
"The collaborative innovation landscape in data science","July 24, 2016","Murtaza Haider","https://www.r-bloggers.com/author/murtaza-haider/"
"Line plot for two-way designs using ggplot2","July 24, 2016","Simon Jackson","https://www.r-bloggers.com/author/simon-jackson/"
"Using 2D Contour Plots within {ggplot2} to Visualize Relationships between Three Variables","July 24, 2016","Tal Galili","https://www.r-bloggers.com/author/tal-galili/"
"RcppArmadillo 0.7.200.2.0","July 24, 2016","Thinking inside the box","https://www.r-bloggers.com/author/thinking-inside-the-box/"
"Mid-year R Packages Update Summary","July 24, 2016","hrbrmstr","https://www.r-bloggers.com/author/hrbrmstr/"
"Agents of Neoliberal Globalization Now in Print!","July 24, 2016","Derek Darves","https://www.r-bloggers.com/author/derek-darves/"
"Placement: An R package to Access the Google Maps API","July 24, 2016","Derek Darves","https://www.r-bloggers.com/author/derek-darves/"
"Predicting Agriculture, Poorly (Part I)","July 23, 2016","MeanMean","https://www.r-bloggers.com/author/meanmean/"
"Predicting Agriculture, Poorly (Part I)","July 23, 2016","MeanMean","https://www.r-bloggers.com/author/meanmean/"
"Hydrological uncertainty – Manning’s equation","July 23, 2016","mikerspencer","https://www.r-bloggers.com/author/mikerspencer/"
"Let’s be Faster and more Parallel in R with doParallel package","July 23, 2016","Amir Rahnama","https://www.r-bloggers.com/author/amir-rahnama/"
"Start here to learn R!","July 22, 2016","r-exercises","https://www.r-bloggers.com/author/r-exercises/"
"StatET IDE for R","July 22, 2016","matloff","https://www.r-bloggers.com/author/matloff/"
"Don’t miss Hadley Wickham’s Master R Workshop September 12 and 13 in NYC","July 22, 2016","Roger Oberg","https://www.r-bloggers.com/author/roger-oberg/"
"More data scientists prefer R: survey","July 22, 2016","Joseph Rickert","https://www.r-bloggers.com/author/joseph-rickert/"
"Mortality by Year and Age","July 22, 2016","Andrew Collier","https://www.r-bloggers.com/author/andrew-collier/"
"Eclipse – an alternative to RStudio – part 1","July 22, 2016","Catherine Dalzell","https://www.r-bloggers.com/author/catherine-dalzell/"
"Data science show at SQL Server Radio","July 22, 2016","tomaztsql","https://www.r-bloggers.com/author/tomaztsql/"
"RcppCCTZ 0.0.5","July 21, 2016","Thinking inside the box","https://www.r-bloggers.com/author/thinking-inside-the-box/"
"A budget of classifier evaluation measures","July 21, 2016","John Mount","https://www.r-bloggers.com/author/john-mount/"
"Yet Another Post on Logistic Regression","July 21, 2016","Once Upon a Data","https://www.r-bloggers.com/author/once-upon-a-data/"
"Return of the NEISS Data","July 21, 2016","Julia Silge","https://www.r-bloggers.com/author/julia-silge/"
"BioC 2016 Conference Overview and Few Ways of Downloading TCGA Data","July 21, 2016","Marcin Kosinski","https://www.r-bloggers.com/author/marcin-kosinski/"
"Introducing the Microsoft Data Science Summit, Sep 26-27","July 21, 2016","David Smith","https://www.r-bloggers.com/author/david-smith/"
"Bulk Downloading Adobe Analytics Data","July 21, 2016","randyzwitch.com","https://www.r-bloggers.com/author/randyzwitch-com/"
"Does sentiment analysis work? A tidy analysis of Yelp reviews","July 21, 2016","David Robinson","https://www.r-bloggers.com/author/david-robinson/"
"Performing Principal Components Regression (PCR) in R","July 20, 2016","Michy Alice","https://www.r-bloggers.com/author/michy-alice/"
"rearrange() your correlations with corrr","July 20, 2016","Simon Jackson","https://www.r-bloggers.com/author/simon-jackson/"
"Monte Carlo Analysis of Manning’s Equation:  A Shiny App","July 20, 2016","AdventuresInData","https://www.r-bloggers.com/author/adventuresindata/"
"Monte Carlo Analysis of Manning’s Equation:  A Shiny App","July 20, 2016","AdventuresInData","https://www.r-bloggers.com/author/adventuresindata/"
"Bayesian Bootstrap: The Movie + Some Highlights from UseR! 2016","July 20, 2016","Rasmus Bååth","https://www.r-bloggers.com/author/rasmus-baath/"
"Networks, mazes, and R (Rmaze)","July 20, 2016","Vessy","https://www.r-bloggers.com/author/vessy/"
"An analysis of Pokémon Go types, created with R","July 20, 2016","David Smith","https://www.r-bloggers.com/author/david-smith/"
"Working folders, logs and  sessions for sp_execute_external_script","July 20, 2016","tomaztsql","https://www.r-bloggers.com/author/tomaztsql/"
"Life Expectancy by Country","July 20, 2016","Andrew Collier","https://www.r-bloggers.com/author/andrew-collier/"
"Giving back with code","July 20, 2016","Steph","https://www.r-bloggers.com/author/steph/"
"leading edge analysis","July 20, 2016","R on Guangchuang Yu","https://www.r-bloggers.com/author/r-on-guangchuang-yu/"
"Random Forests in R","July 19, 2016","R on The Stats Guy","https://www.r-bloggers.com/author/r-on-the-stats-guy/"
"Calculating Memory Requirements","July 19, 2016","Daniel's Blog","https://www.r-bloggers.com/author/daniels-blog/"
"Discover R and RStudio at JSM 2016 Chicago!","July 19, 2016","Roger Oberg","https://www.r-bloggers.com/author/roger-oberg/"
"Updated OpenBLAS instructions for R-3.3+ and Rtools34","July 19, 2016","Avraham","https://www.r-bloggers.com/author/avraham/"
"Updated OpenBLAS instructions for R-3.3+ and Rtools34","July 19, 2016","Avraham","https://www.r-bloggers.com/author/avraham/"
"9 new R jobs from around the world (2016-07-19)","July 19, 2016","Tal Galili","https://www.r-bloggers.com/author/rlover/"
"Candlestick charts using Quandl and Plotly","July 19, 2016","Riddhiman","https://www.r-bloggers.com/author/riddhiman/"
"dplyr and Zika – Epilogue","July 19, 2016","Stevie P","https://www.r-bloggers.com/author/stevie-p/"
"Principal Component Analysis Cluster Plots with Plotly","July 19, 2016","Sahir Bhatnagar","https://www.r-bloggers.com/author/sahir-bhatnagar/"
"Sustainability through Energy Load Shaping for Buildings using R","July 19, 2016","Joseph Rickert","https://www.r-bloggers.com/author/joseph-rickert/"
"Installing the additional R packages in Oracle Big Data Lite VM 4.5.0","July 19, 2016","Christos - Iraklis Tsatsoulis","https://www.r-bloggers.com/author/christos-iraklis-tsatsoulis/"
"Rcpp 0.12.6: Rolling on","July 19, 2016","Thinking inside the box","https://www.r-bloggers.com/author/thinking-inside-the-box/"
"Spatio-Temporal Point Pattern Analysis in ArcGIS with R","July 19, 2016","Fabio Veronesi","https://www.r-bloggers.com/author/fabio-veronesi/"
"Spatio-Temporal Point Pattern Analysis in ArcGIS with R","July 19, 2016","Fabio Veronesi","https://www.r-bloggers.com/author/fabio-veronesi/"
"Easy access to data on US politics: New version of pvsR now on BitBucket","July 19, 2016","Ulrich Matter","https://www.r-bloggers.com/author/ulrich-matter/"
"Easy access to data on US politics: New version of pvsR now on BitBucket","July 19, 2016","Ulrich Matter","https://www.r-bloggers.com/author/ulrich-matter/"
"dplyr basics","July 18, 2016","Alexej's blog","https://www.r-bloggers.com/author/alexejs-blog/"
"stacksurveyr: An R package with the 2016 Developer Survey Results","July 18, 2016","David Robinson","https://www.r-bloggers.com/author/david-robinson/"
"dplyr basics","July 18, 2016","Alexej's blog","https://www.r-bloggers.com/author/alexejs-blog/"
"dplyr basics","July 18, 2016","Alexej's blog","https://www.r-bloggers.com/author/alexejs-blog/"
"Casting Call for MERS-CoV in Korea, 2015","July 18, 2016","Theory meets practice...","https://www.r-bloggers.com/author/theory-meets-practice/"
"Releasing the StackLite dataset of Stack Overflow questions and tags","July 18, 2016","David Robinson","https://www.r-bloggers.com/author/david-robinson/"
"Populating data frame cells with more than one value","July 18, 2016","markheckmann","https://www.r-bloggers.com/author/markheckmann/"
"The trick to understanding NAs (missing values) in R","July 18, 2016","David Smith","https://www.r-bloggers.com/author/david-smith/"
"Escalating Life Expectancy","July 18, 2016","Andrew Collier","https://www.r-bloggers.com/author/andrew-collier/"
"EARL 2016 London Workshops Selling Fast","July 18, 2016","Angela Roberts","https://www.r-bloggers.com/author/angela-roberts/"
"Exploring the diversity of Life using Rvest and the Catalog of Life","July 18, 2016","grumble10","https://www.r-bloggers.com/author/grumble10/"
"Dance of the Bayes factors","July 18, 2016","Daniel Lakens","https://www.r-bloggers.com/author/daniel-lakens/"
"Dance of the Bayes factors","July 18, 2016","Daniel Lakens","https://www.r-bloggers.com/author/daniel-lakens/"
"Data Science Boot Camp completed at Ryerson University","July 18, 2016","Murtaza Haider","https://www.r-bloggers.com/author/murtaza-haider/"
"Data Science Boot Camp completed at Ryerson University","July 18, 2016","Murtaza Haider","https://www.r-bloggers.com/author/murtaza-haider/"
"New Release of partools Package","July 17, 2016","matloff","https://www.r-bloggers.com/author/matloff/"
"Data frame columns as arguments to dplyr functions","July 17, 2016","Econometrics and Free Software","https://www.r-bloggers.com/author/econometrics-and-free-software/"
"Data frame columns as arguments to dplyr functions","July 17, 2016","Bruno Rodrigues","https://www.r-bloggers.com/author/bruno-rodrigues/"
"GREA: The RStudio Add-In to read ALL the data into R!","July 17, 2016","Tal Galili","https://www.r-bloggers.com/author/rlover/"
"Generating Interactive Maps | Leaflet","July 17, 2016","Abdalla","https://www.r-bloggers.com/author/abdalla/"
"Webinar: Model-Based Machine Learning and Probabilistic Programming using RStan","July 16, 2016","Daniel Emaasit","https://www.r-bloggers.com/author/daniel-emaasit/"
"Birth Month by Gender","July 16, 2016","Andrew Collier","https://www.r-bloggers.com/author/andrew-collier/"
"The cdlTools R package","July 15, 2016","MeanMean","https://www.r-bloggers.com/author/meanmean/"
"The cdlTools R package","July 15, 2016","MeanMean","https://www.r-bloggers.com/author/meanmean/"
"Quick plot of all variables","July 15, 2016","Simon Jackson","https://www.r-bloggers.com/author/simon-jackson/"
"Time Series Analysis in ArcGIS","July 15, 2016","Fabio Veronesi","https://www.r-bloggers.com/author/fabio-veronesi/"
"Time Series Analysis in ArcGIS","July 15, 2016","Fabio Veronesi","https://www.r-bloggers.com/author/fabio-veronesi/"
"How R is used at Microsoft","July 15, 2016","David Smith","https://www.r-bloggers.com/author/david-smith/"
"Finish line (nearly)","July 15, 2016","Gianluca Baio","https://www.r-bloggers.com/author/gianluca-baio/"
"Finish line (nearly)","July 15, 2016","Gianluca Baio","https://www.r-bloggers.com/author/gianluca-baio/"
"Most Probable Birth Month","July 14, 2016","Andrew Collier","https://www.r-bloggers.com/author/andrew-collier/"
"Day Drinking with R","July 14, 2016","Jasmine Dumas' R Blog","https://www.r-bloggers.com/author/jasmine-dumas-r-blog/"
"Finish line (nearly)","July 14, 2016","R on Gianluca Baio","https://www.r-bloggers.com/author/r-on-gianluca-baio/"
"recosystem: Recommender System Using Parallel Matrix Factorization","July 14, 2016","R on Yixuan's Blog","https://www.r-bloggers.com/author/r-on-yixuans-blog/"
"recosystem: Recommender System Using Parallel Matrix Factorization","July 14, 2016","Yixuan's Blog - R","https://www.r-bloggers.com/author/yixuans-blog-r/"
"New Open Course: Statistical Inference with swirl","July 14, 2016","DataCamp Blog","https://www.r-bloggers.com/author/datacamp-blog/"
"TLS for RStudio and Shiny using Let’s Encrypt","July 14, 2016","Brandon Bertelsen","https://www.r-bloggers.com/author/brandon-bertelsen/"
"As.Date() Exercises","July 14, 2016","John Akwei","https://www.r-bloggers.com/author/john-akwei/"
"Some New R Packages","July 14, 2016","Joseph Rickert","https://www.r-bloggers.com/author/joseph-rickert/"
"MICAD: A new algorithm/R package for anomaly detection","July 14, 2016","scottmutchler","https://www.r-bloggers.com/author/scottmutchler/"
"That’s like so random! Monte Carlo for Data Science","July 14, 2016","Corey Chivers","https://www.r-bloggers.com/author/corey-chivers/"
"Explore correlations in R with corrr","July 13, 2016","Simon Jackson","https://www.r-bloggers.com/author/simon-jackson/"
"Proportions with mean()","July 13, 2016","Simon Jackson","https://www.r-bloggers.com/author/simon-jackson/"
"“Writing Functions in R” from Hadley & Charlotte Wickham!","July 13, 2016","DataCamp Blog","https://www.r-bloggers.com/author/datacamp-blog/"
"R tutorials, Datacamp, and the new look of learning R","July 13, 2016","DataCamp Blog","https://www.r-bloggers.com/author/datacamp-blog/"
"Free Kaggle Machine Learning Tutorial for R","July 13, 2016","DataCamp Blog","https://www.r-bloggers.com/author/datacamp-blog/"
"A new interactive interface for learning R online, for free","July 13, 2016","DataCamp Blog","https://www.r-bloggers.com/author/datacamp-blog/"
"New Course: R Data Visualization with ggplot2 – Part 2","July 13, 2016","DataCamp Blog","https://www.r-bloggers.com/author/datacamp-blog/"
"Who wants to disrupt R training and R education?","July 13, 2016","DataCamp Blog","https://www.r-bloggers.com/author/datacamp-blog/"
"New Course: R Data Visualization with ggplot2 – Part 1","July 13, 2016","DataCamp Blog","https://www.r-bloggers.com/author/datacamp-blog/"
"Submission Correctness Testing in DataCamp DataCamp (Part I)","July 13, 2016","DataCamp Blog","https://www.r-bloggers.com/author/datacamp-blog/"
"R, Yelp and the Search for Good Indian Food – An Open Course","July 13, 2016","DataCamp Blog","https://www.r-bloggers.com/author/datacamp-blog/"
"New R course on Coursera: Data Analysis & Statistical Inference","July 13, 2016","DataCamp Blog","https://www.r-bloggers.com/author/datacamp-blog/"
"R tutorials and courses on OpenIntro","July 13, 2016","DataCamp Blog","https://www.r-bloggers.com/author/datacamp-blog/"
"New Course: Intermediate R Programming Training Course","July 13, 2016","DataCamp Blog","https://www.r-bloggers.com/author/datacamp-blog/"
"Intro to Statistics with R Series","July 13, 2016","DataCamp Blog","https://www.r-bloggers.com/author/datacamp-blog/"
"DataCamp talks @user2015aalborg","July 13, 2016","DataCamp Blog","https://www.r-bloggers.com/author/datacamp-blog/"
"DataCamp R Certifications – Now Available on Your LinkedIn Profile","July 13, 2016","DataCamp Blog","https://www.r-bloggers.com/author/datacamp-blog/"
"New Course: Learn data.table in R With Our Online Tutorial","July 13, 2016","DataCamp Blog","https://www.r-bloggers.com/author/datacamp-blog/"
"Learn How to Clean Your Data Using R","July 13, 2016","DataCamp Blog","https://www.r-bloggers.com/author/datacamp-blog/"
"DataCamp Student & Academic Plan ($9/month)","July 13, 2016","DataCamp Blog","https://www.r-bloggers.com/author/datacamp-blog/"
"New Open Course: Exploratory Data Analysis with swirl","July 13, 2016","DataCamp Blog","https://www.r-bloggers.com/author/datacamp-blog/"
"Who needs R tutorials? Sharing DataCamp’s user stats and insights.","July 13, 2016","DataCamp Blog","https://www.r-bloggers.com/author/datacamp-blog/"
"Microsoft Launches Its First Free Online R Course on edX","July 13, 2016","DataCamp Blog","https://www.r-bloggers.com/author/datacamp-blog/"
"New Course: Reporting with R Markdown To Create PDF, HTML & Other Reports","July 13, 2016","DataCamp Blog","https://www.r-bloggers.com/author/datacamp-blog/"
"New Course: Introduction to Machine Learning With R Online Tutorial","July 13, 2016","DataCamp Blog","https://www.r-bloggers.com/author/datacamp-blog/"
"New Course: Free Introduction to R Programming Course","July 13, 2016","DataCamp Blog","https://www.r-bloggers.com/author/datacamp-blog/"
"Create your own R tutorials with Github & DataCamp","July 13, 2016","DataCamp Blog","https://www.r-bloggers.com/author/datacamp-blog/"
"Bring Your Data to Life with googleVis and R – Tutorial","July 13, 2016","DataCamp Blog","https://www.r-bloggers.com/author/datacamp-blog/"
"R Tutorial by DrivenData & DataCamp: Data Mining the Water Table","July 13, 2016","DataCamp Blog","https://www.r-bloggers.com/author/datacamp-blog/"
"R documentation and R manuals from GitHub and Bioconductor on Rdocumentation","July 13, 2016","DataCamp Blog","https://www.r-bloggers.com/author/datacamp-blog/"
"Now you can start every R tutorial for free @DataCamp","July 13, 2016","DataCamp Blog","https://www.r-bloggers.com/author/datacamp-blog/"
"New: Spanish and French Translations of Introduction to R","July 13, 2016","DataCamp Blog","https://www.r-bloggers.com/author/datacamp-blog/"
"New Course: Learn How To Load & Import Data Into R","July 13, 2016","DataCamp Blog","https://www.r-bloggers.com/author/datacamp-blog/"
"Fundamentals of R: Free course by General Assembly & DataCamp","July 13, 2016","DataCamp Blog","https://www.r-bloggers.com/author/datacamp-blog/"
"nzelect 0.2.0 on CRAN","July 13, 2016","Peter's stats stuff - R","https://www.r-bloggers.com/author/peters-stats-stuff-r/"
"Launching our R Training Path","July 13, 2016","DataCamp Blog","https://www.r-bloggers.com/author/datacamp-blog/"
"Data Exploration with Kaggle – R Tutorial","July 13, 2016","DataCamp Blog","https://www.r-bloggers.com/author/datacamp-blog/"
"Computational finance with R course: an interactive tutorial","July 13, 2016","DataCamp Blog","https://www.r-bloggers.com/author/datacamp-blog/"
"Notes from the Kölner R meeting, 9 July 2016","July 13, 2016","R on mages' blog","https://www.r-bloggers.com/author/r-on-mages-blog/"
"Notes from the Kölner R meeting, 9 July 2016","July 13, 2016","Markus Gesmann","https://www.r-bloggers.com/author/markus-gesmann/"
"Why Not to Trust Statistics","July 13, 2016","James Bartlett","https://www.r-bloggers.com/author/james-bartlett/"
"Working on Data-Warehouse (SQL) with R","July 13, 2016","Barath Ravichander","https://www.r-bloggers.com/author/barath-ravichander/"
"EGRET plotFlowConc using ggplot2","July 12, 2016","The USGS OWI blog","https://www.r-bloggers.com/author/the-usgs-owi-blog/"
"Extending R","July 12, 2016","xi'an","https://www.r-bloggers.com/author/xian/"
"Slaying CIDR Orcs with Triebeard (a.k.a. fast trie-based ‘IPv4-in-CIDR’ lookups in R)","July 12, 2016","hrbrmstr","https://www.r-bloggers.com/author/hrbrmstr/"
"#rstudio #github missing command lines for mac setup @rstudio @github @swcarpentry","July 12, 2016","lortie","https://www.r-bloggers.com/author/lortie/"
"vtreat version 0.5.26 released on CRAN","July 12, 2016","John Mount","https://www.r-bloggers.com/author/john-mount/"
"covr: A Victory for Open Source","July 12, 2016","Mango Solutions » R Blog","https://www.r-bloggers.com/author/mango-solutions-r-blog/"
"SQL Server, Power BI, and R","July 12, 2016","Sheri Gilley","https://www.r-bloggers.com/author/sheri-gilley/"
"An Introoduction to Portfolio Component Conditional Value At Risk","July 12, 2016","Ilya Kipnis","https://www.r-bloggers.com/author/ilya-kipnis/"
"Announcing the R Shapefile Contest","July 12, 2016","Ari Lamstein","https://www.r-bloggers.com/author/ari-lamstein/"
"New R Editor Features in Bio7","July 12, 2016","» R","https://www.r-bloggers.com/author/%c2%bb-r/"
"Analyzing Mexican votes in the U.N.","July 11, 2016","En El Margen - R-English","https://www.r-bloggers.com/author/en-el-margen-r-english/"
"RProtoBuf 0.4.4, and new JSS paper","July 11, 2016","Thinking inside the box","https://www.r-bloggers.com/author/thinking-inside-the-box/"
"Analyzing Mexican votes in the U.N.","July 11, 2016","En El Margen - R-English","https://www.r-bloggers.com/author/en-el-margen-r-english/"
"New Course: Learn Data Manipulation in R with dplyr","July 11, 2016","DataCamp Blog","https://www.r-bloggers.com/author/datacamp-blog/"
"Get notified on R packages documentation and manuals updates","July 11, 2016","DataCamp Blog","https://www.r-bloggers.com/author/datacamp-blog/"
"2015 in review and a preview of 2016","July 11, 2016","DataCamp Blog","https://www.r-bloggers.com/author/datacamp-blog/"
"New R course on Coursera: Data Analysis and Statistical Inference","July 11, 2016","DataCamp Blog","https://www.r-bloggers.com/author/datacamp-blog/"
"Analyzing the US elections with Facebook and R","July 11, 2016","Daniel Boller","https://www.r-bloggers.com/author/daniel-boller/"
"Building your own DataCamp course with GitHub","July 11, 2016","DataCamp Blog","https://www.r-bloggers.com/author/datacamp-blog/"
"Case Study: DataCamp, dplyr, and blended learning","July 11, 2016","DataCamp Blog","https://www.r-bloggers.com/author/datacamp-blog/"
"New Course: Learn Data Visualization in R with Our ggvis Tutorial","July 11, 2016","DataCamp Blog","https://www.r-bloggers.com/author/datacamp-blog/"
"Switch from SAS, SPSS or STATA to R with our latest course","July 11, 2016","DataCamp Blog","https://www.r-bloggers.com/author/datacamp-blog/"
"Revolution R Enterprise tutorial: Free 8h interactive tutorial on Big Data Analytics","July 11, 2016","DataCamp Blog","https://www.r-bloggers.com/author/datacamp-blog/"
"New Course: Learn R Statistics Online With Our Introduction to Statistics","July 11, 2016","DataCamp Blog","https://www.r-bloggers.com/author/datacamp-blog/"
"R Documentation and R Manuals: Github and Bioconductor technicalities | RDocumentation","July 11, 2016","DataCamp Blog","https://www.r-bloggers.com/author/datacamp-blog/"
"How to Create Cross-Validation Partitions with Plain Text in R?","July 11, 2016","Amir Rahnama","https://www.r-bloggers.com/author/amir-rahnama/"
"Random Sampling of Plain Text in R","July 11, 2016","Amir Rahnama","https://www.r-bloggers.com/author/amir-rahnama/"
"Big Data Insights: Tale of IT Investments and Returns","July 11, 2016","Pradeep Mavuluri","https://www.r-bloggers.com/author/pradeep-mavuluri/"
"Big Data Insights: Tale of IT Investments and Returns","July 11, 2016","Pradeep Mavuluri","https://www.r-bloggers.com/author/pradeep-mavuluri/"
"Time series charts by the Economist in R using Plotly","July 11, 2016","Riddhiman","https://www.r-bloggers.com/author/riddhiman/"
"Introducing the free Microsoft R Client","July 11, 2016","David Smith","https://www.r-bloggers.com/author/david-smith/"
"Rcpp now used by over 700 CRAN packages","July 11, 2016","Thinking inside the box","https://www.r-bloggers.com/author/thinking-inside-the-box/"
"The Power of ggplot2 in ArcGIS – The Plotting Toolbox","July 11, 2016","Fabio Veronesi","https://www.r-bloggers.com/author/fabio-veronesi/"
"The Power of ggplot2 in ArcGIS – The Plotting Toolbox","July 11, 2016","Fabio Veronesi","https://www.r-bloggers.com/author/fabio-veronesi/"
"Why I Teach R Programming to my AP Statistics Class","July 11, 2016","Kevin","https://www.r-bloggers.com/author/kevin/"
"eMotion, an R function for evolutionary motion of character values","July 10, 2016","Javi Fernández-López","https://www.r-bloggers.com/author/javi-fernandez-lopez/"
"CRAN Packages on GitHub (and some CRAN DESCRIPTION observations)","July 10, 2016","hrbrmstr","https://www.r-bloggers.com/author/hrbrmstr/"
"Creating color palettes in R","July 10, 2016","radiaj","https://www.r-bloggers.com/author/radiaj/"
"Good Parameterisation in R","July 10, 2016","Andrew Worsley","https://www.r-bloggers.com/author/andrew-worsley/"
"Kernel k nearest neighbors","July 9, 2016","mlampros","https://www.r-bloggers.com/author/mlampros/"
"Using last.fm and R to understand my music listening habits","July 9, 2016","Jacobo Blanco","https://www.r-bloggers.com/author/jacobo-blanco/"
"Isolating confounding effects – Rankings and residuals","July 8, 2016","Andrés Gutiérrez","https://www.r-bloggers.com/author/andres-gutierrez/"
"Submitting your first package to CRAN, my experience","July 8, 2016","Roel M. Hogervorst","https://www.r-bloggers.com/author/roel-m-hogervorst/"
"Submitting your first package to CRAN, my experience","July 8, 2016","Roel M. Hogervorst","https://www.r-bloggers.com/author/roel-m-hogervorst/"
"I can’t recreate a graph from Ioannidis et al – can you?","July 8, 2016","biomickwatson","https://www.r-bloggers.com/author/biomickwatson/"
"dplyr do: Some Tips for Using and Programming","July 8, 2016","Veronica Giro","https://www.r-bloggers.com/author/veronica-giro/"
"The Mathematics of Machine Learning","July 8, 2016","AKINFADERIN ADEWALE","https://www.r-bloggers.com/author/akinfaderin-adewale/"
"Best way to draw heatmap for publication","July 8, 2016","Xianjun Dong","https://www.r-bloggers.com/author/xianjun-dong/"
