"Title","Date","Author","Author_Hyperlink"
"Data Visualization with R Workshop on April 2nd","March 12, 2016","Tony Ojeda","https://www.r-bloggers.com/author/tony-ojeda/"
"Data Visualization with R Workshop on April 2nd","March 12, 2016","Tony Ojeda","https://www.r-bloggers.com/author/tony-ojeda/"
"Short course on Statistical Methods for the Value of Information Analysis","March 11, 2016","Gianluca Baio","https://www.r-bloggers.com/author/gianluca-baio/"
"Computing Classification Evaluation Metrics in R","March 11, 2016","Joseph Rickert","https://www.r-bloggers.com/author/joseph-rickert/"
"R 3.2.4 released","March 11, 2016","David Smith","https://www.r-bloggers.com/author/david-smith/"
"R 3.2.4 is released","March 11, 2016","Tal Galili","https://www.r-bloggers.com/author/tal-galili/"
"New R package: a dictionary with arbitrary keys and values","March 11, 2016","Michael Kuhn","https://www.r-bloggers.com/author/michael-kuhn/"
"New R package: a dictionary with arbitrary keys and values","March 11, 2016","Michael Kuhn","https://www.r-bloggers.com/author/michael-kuhn/"
"Start plotting data!","March 11, 2016","Matteo Renzi","https://www.r-bloggers.com/author/matteo-renzi/"
"Image marginal histograms","March 11, 2016","Jonathan Carroll","https://www.r-bloggers.com/author/jonathan-carroll/"
"Rcpp now used by 600 CRAN packages","March 11, 2016","Thinking inside the box","https://www.r-bloggers.com/author/thinking-inside-the-box/"
"An Introduction to XGBoost R package","March 10, 2016","DMLC(distributed machine learning common)","https://www.r-bloggers.com/author/dmlcdistributed-machine-learning-common/"
"Correctly Reporting P-Values in Summary Tables Reported with xtable","March 10, 2016","Michael Floren","https://www.r-bloggers.com/author/michael-floren/"
"First JHB Meetup – Resources and Hackathons","March 10, 2016","Marko Jakovljevic","https://www.r-bloggers.com/author/marko-jakovljevic/"
"P-values: the Continuing Saga","March 10, 2016","matloff","https://www.r-bloggers.com/author/matloff/"
"Short course on Statistical Methods for the Value of Information Analysis","March 10, 2016","R on Gianluca Baio","https://www.r-bloggers.com/author/r-on-gianluca-baio/"
"Some Light Image Processing & Creation With R","March 10, 2016","hrbrmstr","https://www.r-bloggers.com/author/hrbrmstr/"
"Learn R by Intensive Practice","March 10, 2016","Selva Prabhakaran","https://www.r-bloggers.com/author/selva-prabhakaran/"
"It’s not the p-values’ fault – reflections on the recent ASA statement (+relevant R resources)","March 10, 2016","Tal Galili","https://www.r-bloggers.com/author/tal-galili/"
"Bend or break: strings in R","March 10, 2016","John Mount","https://www.r-bloggers.com/author/john-mount/"
"R: InternetOpenUrl failed: ‘The date in the certificate is invalid or has expired’","March 10, 2016","Andrew Z","https://www.r-bloggers.com/author/andrew-z/"
"R: InternetOpenUrl failed: ‘The date in the certificate is invalid or has expired’","March 10, 2016","Andrew Z","https://www.r-bloggers.com/author/andrew-z/"
"Bay Area R User Group at Strata and PAW","March 10, 2016","Joseph Rickert","https://www.r-bloggers.com/author/joseph-rickert/"
"Histograms by Just Defining Bin Width","March 10, 2016","fishR Blog","https://www.r-bloggers.com/author/fishr-blog/"
"Sharing htmlwidgets as Gists","March 9, 2016","ryan hafen","https://www.r-bloggers.com/author/ryan-hafen/"
"Further Comments on the ASA Manifesto","March 9, 2016","matloff","https://www.r-bloggers.com/author/matloff/"
"Add Authentication to Shiny Server with Nginx","March 9, 2016","Kris Eberwein","https://www.r-bloggers.com/author/kris-eberwein/"
"Plain Text and Pictures","March 9, 2016","Kieran Healy","https://www.r-bloggers.com/author/kieran-healy/"
"Developing a R Tutorial shiny dashboard app","March 9, 2016","Anup Nair","https://www.r-bloggers.com/author/anup-nair/"
"R Tools for Visual Studio preview now available","March 9, 2016","David Smith","https://www.r-bloggers.com/author/david-smith/"
"R on Travis-CI","March 9, 2016","Jim Hester","https://www.r-bloggers.com/author/jim-hester/"
"The making of cricket package yorkr – Part 2","March 9, 2016","Tinniam V Ganesh","https://www.r-bloggers.com/author/tinniam-v-ganesh/"
"Is it crowded in here?","March 9, 2016","Jonathan Carroll","https://www.r-bloggers.com/author/jonathan-carroll/"
"7 new R jobs (and dozens of Resumes) from around the world (2016-03-09)","March 9, 2016","Tal Galili","https://www.r-bloggers.com/author/rlover/"
"Few steps to connect R with Excel: XLConnect!","March 9, 2016","MilanoR","https://www.r-bloggers.com/author/milanor/"
"EigenCoder: Programming Stereotypes","March 9, 2016","Trestle Technology, LLC - R","https://www.r-bloggers.com/author/trestle-technology-llc-r/"
"EigenCoder: Programming Stereotypes","March 9, 2016","Trestle Technology, LLC - R","https://www.r-bloggers.com/author/trestle-technology-llc-r/"
"Australian rOpenSci Unconference","March 9, 2016","rOpenSci Blog - R","https://www.r-bloggers.com/author/ropensci-blog-r/"
"Monash Business Analytics Team Profile","March 9, 2016","R on Rob J Hyndman","https://www.r-bloggers.com/author/r-on-rob-j-hyndman/"
"preserving frequencies without resampling","March 8, 2016","xi'an","https://www.r-bloggers.com/author/xian/"
"Introduction to XGBoost R package","March 8, 2016","DMLC(distributed machine learning common)","https://www.r-bloggers.com/author/dmlcdistributed-machine-learning-common/"
"In case you missed it: February 2016 roundup","March 8, 2016","David Smith","https://www.r-bloggers.com/author/david-smith/"
"mockaRoo – making realistic test data in R","March 8, 2016","Steph","https://www.r-bloggers.com/author/steph/"
"gtrendsR 1.3.3","March 8, 2016","Thinking inside the box","https://www.r-bloggers.com/author/thinking-inside-the-box/"
"BallR: Interactive NBA Shot Charts with R and Shiny","March 8, 2016","Todd Schneider","https://www.r-bloggers.com/author/todd-schneider/"
"Avoiding unnecessary memory allocations in R","March 8, 2016","Michael Kuhn","https://www.r-bloggers.com/author/michael-kuhn/"
"Avoiding unnecessary memory allocations in R","March 8, 2016","Michael Kuhn","https://www.r-bloggers.com/author/michael-kuhn/"
"Urbanisation Continues – Modeling Regional Apartment Prices in Finland","March 7, 2016","Juuso Parkkinen","https://www.r-bloggers.com/author/juuso-parkkinen/"
"pokemon: visualize ’em all!","March 7, 2016","Joshua Kunst","https://www.r-bloggers.com/author/joshua-kunst/"
"Urbanisation Continues – Modeling Regional Apartment Prices in Finland","March 7, 2016","Juuso Parkkinen","https://www.r-bloggers.com/author/juuso-parkkinen/"
"After 150 Years, the ASA Says No to p-values","March 7, 2016","matloff","https://www.r-bloggers.com/author/matloff/"
"Computerworld’s 10-step tutorial for creating interactive election maps with R","March 7, 2016","David Smith","https://www.r-bloggers.com/author/david-smith/"
"OS X XQuartz Vulnerability Test Using R","March 7, 2016","hrbrmstr","https://www.r-bloggers.com/author/hrbrmstr/"
"A new website for MilanoR","March 7, 2016","MilanoR","https://www.r-bloggers.com/author/milanor/"
"Primary Plotting","March 7, 2016","hrbrmstr","https://www.r-bloggers.com/author/hrbrmstr/"
"Upcoming R for Microsoft training days","March 7, 2016","Steph","https://www.r-bloggers.com/author/steph/"
"Wrapper functions for Leaflet in R","March 7, 2016","Mitchell Gritts","https://www.r-bloggers.com/author/mitchell-gritts/"
"Rblpapi ‘Release Candidate’ 0.3.2.5","March 6, 2016","Thinking inside the box","https://www.r-bloggers.com/author/thinking-inside-the-box/"
"Are you doing parallel computations in R? Then use BiocParallel","March 6, 2016","Fellgernon Bit - rstats","https://www.r-bloggers.com/author/fellgernon-bit-rstats/"
"Creating a package for your data set","March 6, 2016","Roel M. Hogervorst","https://www.r-bloggers.com/author/roel-m-hogervorst/"
"Revisiting Data-driven Marketing, part III","March 6, 2016","Florian Teschner","https://www.r-bloggers.com/author/florian-teschner/"
"Are you doing parallel computations in R? Then use BiocParallel","March 6, 2016","Fellgernon Bit - rstats","https://www.r-bloggers.com/author/fellgernon-bit-rstats/"
"GG Periodic Highlight","March 6, 2016","Vincent D. Warmerdam","https://www.r-bloggers.com/author/vincent-d-warmerdam/"
"Book review: Storytelling With Data","March 6, 2016","Martin Monkman","https://www.r-bloggers.com/author/martin-monkman/"
"Quick Intro to NMF (the Method and the R Package)","March 6, 2016","matloff","https://www.r-bloggers.com/author/matloff/"
"WOMBAT 2016 Wrap Up","March 5, 2016","njtierney - rbloggers","https://www.r-bloggers.com/author/njtierney-rbloggers/"
"IRT equating using R functions – The calibrated pool method","March 5, 2016","Andrés Gutiérrez","https://www.r-bloggers.com/author/andres-gutierrez/"
"International Open Data Day","March 5, 2016","Andrew Collier","https://www.r-bloggers.com/author/andrew-collier/"
"gunsales 0.1.1","March 5, 2016","Thinking inside the box","https://www.r-bloggers.com/author/thinking-inside-the-box/"
"The making of cricket package yorkr – Part 1","March 5, 2016","Tinniam V Ganesh","https://www.r-bloggers.com/author/tinniam-v-ganesh/"
"Hierarchical MPT in Stan I: Dealing with Convergent Transitions via Control Arguments","March 5, 2016","Henrik Singmann","https://www.r-bloggers.com/author/henrik-singmann/"
"Mastering R plot – Part 3: Outer margins","March 5, 2016","Lionel Hertzog","https://www.r-bloggers.com/author/lionel-hertzog/"
"Explore  with Shiny the impact of sample size on “p-charts”","March 5, 2016","Peter's stats stuff - R","https://www.r-bloggers.com/author/peters-stats-stuff-r/"
"You Must Allow Me To Tell You How Ardently I Admire and Love Natural Language Processing","March 4, 2016","Julia Silge","https://www.r-bloggers.com/author/julia-silge/"
"ggplot2 2.1.0","March 4, 2016","hadleywickham","https://www.r-bloggers.com/author/hadleywickham/"
"Using Occam’s Razor to solve genius math puzzles","March 4, 2016","Brian Lee Yung Rowe","https://www.r-bloggers.com/author/brian-lee-yung-rowe/"
"Machine Learning for Hackers with Debian and Ubuntu","March 4, 2016","Daniel.Pocock","https://www.r-bloggers.com/author/daniel-pocock/"
"Machine Learning for Hackers with Debian and Ubuntu","March 4, 2016","Daniel.Pocock","https://www.r-bloggers.com/author/daniel-pocock/"
"Capturing wild widgets with webshot","March 4, 2016","hrbrmstr","https://www.r-bloggers.com/author/hrbrmstr/"
"Over 16 years of R Project history","March 4, 2016","David Smith","https://www.r-bloggers.com/author/david-smith/"
"Boston R User Group Talk [UPDATE]","March 4, 2016","Max Kuhn","https://www.r-bloggers.com/author/max-kuhn/"
"Boston R User Group Talk [UPDATE]","March 4, 2016","Max Kuhn","https://www.r-bloggers.com/author/max-kuhn/"
"Sunbelt and EUSN workshops on using R and ‘igraph’ for SNA","March 4, 2016","Michal","https://www.r-bloggers.com/author/michal-2/"
"Model variance for ARIMA models","March 4, 2016","R on Rob J Hyndman","https://www.r-bloggers.com/author/r-on-rob-j-hyndman/"
"Dynamic Predictions using Joint Models","March 4, 2016","Dimitris Rizopoulos","https://www.r-bloggers.com/author/dimitris-rizopoulos/"
"Dynamic Predictions using Joint Models","March 4, 2016","Dimitris Rizopoulos","https://www.r-bloggers.com/author/dimitris-rizopoulos/"
"Timer progress bar added to pbapply package","March 4, 2016","Peter Solymos","https://www.r-bloggers.com/author/peter-solymos/"
"useR! 2016 Conference Announcement (with updated dates)","March 4, 2016","Tal Galili","https://www.r-bloggers.com/author/rlover/"
"A horizontal scrolling code box in blogger","March 3, 2016","Trinostics LLC","https://www.r-bloggers.com/author/trinostics-llc/"
"An Analysis of the Flint Michigan Water Crisis: Part 1 Initial Corrosivity","March 3, 2016","DSTribune","https://www.r-bloggers.com/author/dstribune/"
"Semi-finished","March 3, 2016","Gianluca Baio","https://www.r-bloggers.com/author/gianluca-baio/"
"Semi-finished","March 3, 2016","Gianluca Baio","https://www.r-bloggers.com/author/gianluca-baio/"
"Confidence Intervals for Random Forests","March 3, 2016","Joseph Rickert","https://www.r-bloggers.com/author/joseph-rickert/"
"Where People Live","March 3, 2016","arthur charpentier","https://www.r-bloggers.com/author/arthur-charpentier/"
"Declutter a shiny report’s code v2.0","March 3, 2016","Steph","https://www.r-bloggers.com/author/steph/"
"How do I re-arrange??: Ordering a plot re-revisited","March 2, 2016","tylerrinker","https://www.r-bloggers.com/author/tylerrinker/"
"Semi-finished","March 2, 2016","R on Gianluca Baio","https://www.r-bloggers.com/author/r-on-gianluca-baio/"
"New R Package: rmote","March 2, 2016","ryan hafen","https://www.r-bloggers.com/author/ryan-hafen/"
"Introducing Package ‘fuzztest’","March 2, 2016","cloudcell","https://www.r-bloggers.com/author/cloudcell/"
"Upload shapefile to R Shiny app to extract leaflet map data","March 2, 2016","Matt Leonawicz","https://www.r-bloggers.com/author/matt-leonawicz/"
"Win-Vector video courses: price/status changes","March 2, 2016","John Mount","https://www.r-bloggers.com/author/john-mount/"
"How to Use R to Scrape Tweets: Super Tuesday 2016","March 2, 2016","Kris Eberwein","https://www.r-bloggers.com/author/kris-eberwein/"
"Gathering Twitter data with the TwitteR2Mongo package","March 2, 2016","Philipp Prettl and Lion Weber","https://www.r-bloggers.com/author/philipp-prettl-and-lion-weber/"
"Data Science Virtual Machine updated with Microsoft R Server","March 2, 2016","David Smith","https://www.r-bloggers.com/author/david-smith/"
"mefa4 R package update","March 2, 2016","Peter Solymos","https://www.r-bloggers.com/author/peter-solymos/"
"The difference between a confidence interval and a capture percentage","March 1, 2016","Daniel Lakens","https://www.r-bloggers.com/author/daniel-lakens/"
"The difference between a confidence interval and a capture percentage","March 1, 2016","Daniel Lakens","https://www.r-bloggers.com/author/daniel-lakens/"
"R projects at Google Summer of Code 2016","March 1, 2016","Gergely Daróczi","https://www.r-bloggers.com/author/gergely-daroczi/"
"R projects at Google Summer of Code 2016","March 1, 2016","Gergely Daróczi","https://www.r-bloggers.com/author/gergely-daroczi/"
"Most soccer matches are within one goal of 1-0","March 1, 2016","dan","https://www.r-bloggers.com/author/dan/"
"Innumeracy, Statistics and R","March 1, 2016","matloff","https://www.r-bloggers.com/author/matloff/"
"RcppEigen 0.3.2.8.1","March 1, 2016","Thinking inside the box","https://www.r-bloggers.com/author/thinking-inside-the-box/"
"From spss to R, part 3","March 1, 2016","Roel M. Hogervorst","https://www.r-bloggers.com/author/roel-m-hogervorst/"
"Revisiting Data-driven Marketing, part II","March 1, 2016","Florian Teschner","https://www.r-bloggers.com/author/florian-teschner/"
"Amazonish warning","March 1, 2016","xi'an","https://www.r-bloggers.com/author/xian/"
"50% Draft of Forthcoming Book Available","March 1, 2016","matloff","https://www.r-bloggers.com/author/matloff/"
"FALSE: Clinton Funded by ""Grassroots""","March 1, 2016","Francis Smart","https://www.r-bloggers.com/author/francis-smart/"
"Learn R from the Ground Up","March 1, 2016","Hamza Arab","https://www.r-bloggers.com/author/hamza-arab/"
"Analysing the movements of a cat","March 1, 2016","Joseph Rickert","https://www.r-bloggers.com/author/joseph-rickert/"
"A Gadget for tidyr","March 1, 2016","Mango Blogger","https://www.r-bloggers.com/author/mango-blogger/"
"Get-your-stuff-in-order exercises","March 1, 2016","r-exercises","https://www.r-bloggers.com/author/r-exercises/"
"R Crash Course, Data Science for Actuaries, Year 2","March 1, 2016","arthur charpentier","https://www.r-bloggers.com/author/arthur-charpentier/"
"Introducing pdftools – A fast and portable PDF extractor","March 1, 2016","rOpenSci Blog - R","https://www.r-bloggers.com/author/ropensci-blog-r/"
"A Silky Drawing and a Tiny Experiment","March 1, 2016","aschinchon","https://www.r-bloggers.com/author/aschinchon/"
"Notes from the Kölner R meeting, 26 February 2016","March 1, 2016","R on mages' blog","https://www.r-bloggers.com/author/r-on-mages-blog/"
"Notes from the Kölner R meeting, 26 February 2016","March 1, 2016","Markus Gesmann","https://www.r-bloggers.com/author/markus-gesmann/"
"Nairobi Data Science Meetup: Paradigm Shift in Research with Samuel Kamande","March 1, 2016","Douglas Kingori","https://www.r-bloggers.com/author/douglas-kingori/"
"New nasadata R package","April 30, 2016","En El Margen - R-English","https://www.r-bloggers.com/author/en-el-margen-r-english/"
"Register now for Hadley Wickham’s Master R in Amsterdam","April 30, 2016","Roger Oberg","https://www.r-bloggers.com/author/roger-oberg/"
"Introduction to R for Data Science","April 30, 2016","The Exactness of Mind","https://www.r-bloggers.com/author/the-exactness-of-mind/"
"Why I fart? (or how small data changes life)","April 30, 2016","manio","https://www.r-bloggers.com/author/manio/"
"Introduction to R for Data Science :: Session 1","April 30, 2016","The Exactness of Mind","https://www.r-bloggers.com/author/the-exactness-of-mind/"
"Lattice exercises – part 1","April 30, 2016","Matteo Renzi","https://www.r-bloggers.com/author/matteo-renzi/"
"Base R Nostalgia — by, tapply, ave, …","April 30, 2016","data_steve","https://www.r-bloggers.com/author/data_steve/"
"Base R Nostalgia — by, tapply, ave, …","April 30, 2016","Steve Simpson","https://www.r-bloggers.com/author/steve-simpson/"
"Identify, describe, plot, and remove the outliers from the dataset","April 30, 2016","Klodian Dhana","https://www.r-bloggers.com/author/klodian-dhana/"
"Data science with Docker","April 29, 2016","StatOfMind","https://www.r-bloggers.com/author/statofmind/"
"First Thoughts on Automatically Generating Accessible Text Descriptions of ggplot Charts in R","April 29, 2016","Tony Hirst","https://www.r-bloggers.com/author/tony-hirst/"
"Bad Neighbours (no, not the movie)","April 29, 2016","Jonathan Carroll","https://www.r-bloggers.com/author/jonathan-carroll/"
"Bad Neighbours (no, not the movie)","April 29, 2016","Jonathan Carroll","https://www.r-bloggers.com/author/jonathan-carroll/"
"Tufte-style graphics in R","April 29, 2016","David Smith","https://www.r-bloggers.com/author/david-smith/"
"Reasons to Move your Surveys Online","April 29, 2016","James Bartlett","https://www.r-bloggers.com/author/james-bartlett/"
"Cross-Validation: Estimating Prediction Error","April 29, 2016","Beau Lucas","https://www.r-bloggers.com/author/beau-lucas/"
"testthat 1.0.0","April 28, 2016","hadleywickham","https://www.r-bloggers.com/author/hadleywickham/"
"Talk on regtools and P-Values","April 28, 2016","matloff","https://www.r-bloggers.com/author/matloff/"
"Playing with Twitter Data","April 28, 2016","Michael Levy - Rstats","https://www.r-bloggers.com/author/michael-levy-rstats/"
"The Life-Changing Magic of Tidying Text","April 28, 2016","Julia Silge","https://www.r-bloggers.com/author/julia-silge/"
"Interactions between Categorical Variables in Mixed Graphical Models","April 28, 2016","Jonas Haslbeck - r","https://www.r-bloggers.com/author/jonas-haslbeck-r/"
"gap frequencies [& e]","April 28, 2016","xi'an","https://www.r-bloggers.com/author/xian/"
"“R for Beginners” Course | May 3-4 Milan","April 28, 2016","Quantide srl","https://www.r-bloggers.com/author/quantide-srl/"
"R Conferences: Europe 2016","April 28, 2016","Joseph Rickert","https://www.r-bloggers.com/author/joseph-rickert/"
"It’s Not Rocket Science, Just Pasta Carbonara","April 28, 2016","Salvino","https://www.r-bloggers.com/author/salvino/"
"yorkr ranks ODI batsmen and bowlers","April 28, 2016","Tinniam V Ganesh","https://www.r-bloggers.com/author/tinniam-v-ganesh/"
"rPref 1.0 – Computing Pareto Optima and Database	Preferences","April 28, 2016","Tal Galili","https://www.r-bloggers.com/author/rlover/"
"It’s Not Rocket Science, Just Pasta Carbonara","April 28, 2016","Salvino A. Salvaggio","https://www.r-bloggers.com/author/salvino-a-salvaggio/"
"Call for Papers: eRum 2016 (European R users meeting)","April 28, 2016","smarterpoland","https://www.r-bloggers.com/author/smarterpoland/"
"RcppRedis 0.1.7","April 27, 2016","Thinking inside the box","https://www.r-bloggers.com/author/thinking-inside-the-box/"
"Le Monde puzzle [#960]","April 27, 2016","xi'an","https://www.r-bloggers.com/author/xian/"
"A segmented model of CRAN package growth","April 27, 2016","Andrie de Vries","https://www.r-bloggers.com/author/andrie-de-vries/"
"CRAN CHECK NOTE   sub-directories of 1Mb or more: libs","April 27, 2016","bhejbiostat","https://www.r-bloggers.com/author/bhejbiostat/"
"Solving Inequality (the math kind)","April 27, 2016","Jonathan Carroll","https://www.r-bloggers.com/author/jonathan-carroll/"
"Solving Inequality (the math kind)","April 27, 2016","Jonathan Carroll","https://www.r-bloggers.com/author/jonathan-carroll/"
"Your strongly correlated data is probably nonsense","April 27, 2016","biomickwatson","https://www.r-bloggers.com/author/biomickwatson/"
"Explicit semantic analysis with R","April 26, 2016","Francesco Bailo","https://www.r-bloggers.com/author/francesco-bailo/"
"A simple proof that the p-value distribution is uniform when the null hypothesis is true","April 26, 2016","Shravan Vasishth","https://www.r-bloggers.com/author/shravan-vasishth/"
"Complex Tables – Exercises","April 26, 2016","John Akwei","https://www.r-bloggers.com/author/john-akwei/"
"A Data Scientist’s Perspective on Microsoft R","April 26, 2016","Joseph Rickert","https://www.r-bloggers.com/author/joseph-rickert/"
"On Nested Models","April 26, 2016","John Mount","https://www.r-bloggers.com/author/john-mount/"
"Last call for abstracts 29th April for EARL Conference London","April 26, 2016","Angela Roberts","https://www.r-bloggers.com/author/angela-roberts/"
"How to Install R on Linux Ubuntu 16.04 Xenial Xerus","April 26, 2016","Kris Eberwein","https://www.r-bloggers.com/author/kris-eberwein/"
"Password Input with getPass","April 26, 2016","wrathematics","https://www.r-bloggers.com/author/wrathematics/"
"Password Input with getPass","April 26, 2016","wrathematics","https://www.r-bloggers.com/author/wrathematics/"
"yorkr ranks T20 batsmen and bowlers","April 26, 2016","Tinniam V Ganesh","https://www.r-bloggers.com/author/tinniam-v-ganesh/"
"Effect of normalization of data","April 26, 2016","tomaztsql","https://www.r-bloggers.com/author/tomaztsql/"
"New package: weightr (v. 1.0.0)","April 26, 2016","Tal Galili","https://www.r-bloggers.com/author/rlover/"
"New R package to access World Bank data","April 26, 2016","R on mages' blog","https://www.r-bloggers.com/author/r-on-mages-blog/"
"Detecting Structural Breaks in China’s FX Regime","April 26, 2016","Anirudh","https://www.r-bloggers.com/author/anirudh/"
"New R package to access World Bank data","April 26, 2016","Markus Gesmann","https://www.r-bloggers.com/author/markus-gesmann/"
"RcppMgsPack 0.1.0","April 25, 2016","Thinking inside the box","https://www.r-bloggers.com/author/thinking-inside-the-box/"
"The five element ninjas approach to teaching design matrices","April 25, 2016","Maxwell B. Joseph","https://www.r-bloggers.com/author/maxwell-b-joseph/"
"Webinar April 28: Effective Graphs with Microsoft R Open","April 25, 2016","David Smith","https://www.r-bloggers.com/author/david-smith/"
"Just plot this…","April 25, 2016","Sascha W.","https://www.r-bloggers.com/author/sascha-w/"
"Free Workshop: Mapping Open Data in R","April 25, 2016","Ari Lamstein","https://www.r-bloggers.com/author/ari-lamstein/"
"yorkr ranks IPL batsmen and bowlers","April 25, 2016","Tinniam V Ganesh","https://www.r-bloggers.com/author/tinniam-v-ganesh/"
"Learning R for Data Visualization [Video]","April 25, 2016","Fabio Veronesi","https://www.r-bloggers.com/author/fabio-veronesi/"
"Learning R for Data Visualization [Video]","April 25, 2016","Fabio Veronesi","https://www.r-bloggers.com/author/fabio-veronesi/"
"Simulating Continuous-Time Markov Chains with ‘simmer’ (2)","April 25, 2016","Iñaki","https://www.r-bloggers.com/author/inaki/"
"The one machine learning concept you need to know","April 25, 2016","Sharp Sight Labs","https://www.r-bloggers.com/author/sharp-sight-labs/"
"Fast csv writing for R","April 25, 2016","Tal Galili","https://www.r-bloggers.com/author/rlover/"
"Missing Value Treatment","April 25, 2016","Selva Prabhakaran","https://www.r-bloggers.com/author/selva-prabhakaran/"
"Simulating Continuous-Time Markov Chains with simmer (part 2)","April 25, 2016","FishyOperations","https://www.r-bloggers.com/author/fishyoperations/"
"Candlestick charts using Plotly and Quantmod","April 24, 2016","Riddhiman","https://www.r-bloggers.com/author/riddhiman/"
"Map of the Windows Fonts Registered with R","April 24, 2016","Gregory Kanevsky","https://www.r-bloggers.com/author/gregory-kanevsky/"
"Fast csv writing for R","April 24, 2016","Matt Dowle","https://www.r-bloggers.com/author/matt-dowle/"
"Monthly patterns in Scottish snow (1946-2006)","April 24, 2016","mikerspencer","https://www.r-bloggers.com/author/mikerspencer/"
"Sparling Water for Spark(R)","April 22, 2016","Vincent D. Warmerdam","https://www.r-bloggers.com/author/vincent-d-warmerdam/"
"Create Amazing Looking Backtests With This One Wrong–I Mean Weird–Trick! (And Some Troubling Logical Invest Results)","April 22, 2016","Ilya Kipnis","https://www.r-bloggers.com/author/ilya-kipnis/"
"R Courses at Newcastle","April 22, 2016","csgillespie","https://www.r-bloggers.com/author/csgillespie/"
"yorkr crashes the IPL party! – Part 4","April 22, 2016","Tinniam V Ganesh","https://www.r-bloggers.com/author/tinniam-v-ganesh/"
"How to use SparkR in Cloudera Hadoop","April 22, 2016","Christos - Iraklis Tsatsoulis","https://www.r-bloggers.com/author/christos-iraklis-tsatsoulis/"
"Microsoft R Open 3.2.4 now available","April 22, 2016","David Smith","https://www.r-bloggers.com/author/david-smith/"
