"Title","Date","Author","Author_Hyperlink"
"R – Paolo Eusebi 2019-06-24 03:28:36","June 24, 2019","paoloeusebi","https://www.r-bloggers.com/author/paoloeusebi/"
"Data Quality Case Studies: How We Saved Clients Real Money Thanks to Data Validation","June 24, 2019","Pawel Przytula","https://www.r-bloggers.com/author/pawel-przytula/"
"Build Thousands of Automated Demand Forecasts in 15 Minutes Using AutoCatBoostCARMA in R","June 24, 2019","Adrian Antico","https://www.r-bloggers.com/author/adrian-antico/"
"A shinny app to compute and visualize roadkill hotspots over linear features","June 23, 2019","Bruno Silva","https://www.r-bloggers.com/author/bruno-silva/"
"Many similar models – Part 1: How to make a function for model fitting","June 23, 2019","Very statisticious on Very statisticious","https://www.r-bloggers.com/author/very-statisticious-on-very-statisticious/"
"RStudio Connect 1.7.6 – Publish Git-backed Content","June 23, 2019","Kristopher Overholt","https://www.r-bloggers.com/author/kristopher-overholt/"
"MODIStsp v. 1.3.9 is out !","June 23, 2019","Posts on Lorenzo Busetto Website & Blog","https://www.r-bloggers.com/author/posts-on-lorenzo-busetto-website-blog/"
"My Free Online Tutorial on R","June 23, 2019","matloff","https://www.r-bloggers.com/author/matloff/"
"Extracting the Data from Static Images of Graphs with magick","June 23, 2019","Eric Hare","https://www.r-bloggers.com/author/eric-hare/"
"Exploratory data analysis with categorical data","June 23, 2019","Posts on","https://www.r-bloggers.com/author/posts-on/"
"Finding CRAN packages right from the R console","June 23, 2019","Topics in R","https://www.r-bloggers.com/author/topics-in-r/"
"binb 0.0.4: Several nice improvements","June 23, 2019","Thinking inside the box","https://www.r-bloggers.com/author/thinking-inside-the-box/"
"Earned Doctorates","June 23, 2019","R on kieranhealy.org","https://www.r-bloggers.com/author/r-on-kieranhealy-org/"
"Shiny application (with modules) – Saving and Restoring from RDS","June 22, 2019","Anindya Mozumdar","https://www.r-bloggers.com/author/anindya-mozumdar/"
"GC6CQT9 Denken tut nicht weh / myslenie nie boli – 06","June 22, 2019","densurekalkun","https://www.r-bloggers.com/author/densurekalkun/"
"Mapping Anthony Bourdain’s Travels","June 22, 2019","JOURNEYOFANALYTICS","https://www.r-bloggers.com/author/journeyofanalytics/"
"How data.table’s fread can save you a lot of time and memory, and take input from shell commands","June 22, 2019","Jozef's Rblog","https://www.r-bloggers.com/author/jozefs-rblog/"
"Stacked Waterfall Graphs in R","June 21, 2019","exploRations in R","https://www.r-bloggers.com/author/explorations-in-r/"
"Explaining Predictions: Interpretable models (logistic regression)","June 21, 2019","R on notast","https://www.r-bloggers.com/author/r-on-notast/"
"tidyverse","June 21, 2019","densurekalkun","https://www.r-bloggers.com/author/densurekalkun/"
"magrittr","June 21, 2019","densurekalkun","https://www.r-bloggers.com/author/densurekalkun/"
"hello woRld","June 21, 2019","densurekalkun","https://www.r-bloggers.com/author/densurekalkun/"
"More On Slopegraphs","June 20, 2019","Posts on R Lover ! a programmer","https://www.r-bloggers.com/author/posts-on-r-lover-a-programmer/"
"Hierarchical Clustering for Location based Strategy using R for E-Commerce","June 20, 2019","Shubham Bansal","https://www.r-bloggers.com/author/shubham-bansal/"
"Upcoming Talk: Canberra July 2019","June 19, 2019","Blog on Credibly Curious","https://www.r-bloggers.com/author/blog-on-credibly-curious/"
"Intoducing ClustImpute: A new approach for k-means clustering with build-in missing data imputation","June 19, 2019","R on Datentrang","https://www.r-bloggers.com/author/r-on-datentrang/"
"2 Months in 2 Minutes – rOpenSci News, June 2019","June 19, 2019","rOpenSci - open tools for open science","https://www.r-bloggers.com/author/ropensci-open-tools-for-open-science/"
"Computation time of loops — for, *apply, map","June 19, 2019","Ulrik Stervbo","https://www.r-bloggers.com/author/ulrik-stervbo/"
"AzureVM update: flexible and powerful deployment and management of VMs in Azure","June 19, 2019","Hong Ooi","https://www.r-bloggers.com/author/hong-ooi/"
"Optimising your R code – a guided example","June 19, 2019","Jakob Gepp","https://www.r-bloggers.com/author/jakob-gepp/"
"Rmarkdown for Scientists in Canberra 3rd July 2019","June 18, 2019","Blog on Credibly Curious","https://www.r-bloggers.com/author/blog-on-credibly-curious/"
"Just Quickly: What I usually want from stringr","June 18, 2019","Blog on Credibly Curious","https://www.r-bloggers.com/author/blog-on-credibly-curious/"
"A Gentle Introduction to tidymodels","June 18, 2019","R Views","https://www.r-bloggers.com/author/r-views/"
"R: Gradient Boosted Machine to Predict MPG for 2019 Vehicles","June 18, 2019","Ian Johnson","https://www.r-bloggers.com/author/ian-johnson/"
"Using Gradient Boosted Machine to Predict MPG for 2019 Vehicles","June 18, 2019","Ian Johnson","https://www.r-bloggers.com/author/ian-johnson/"
"Cohen’s D for Experimental Planning","June 18, 2019","Nina Zumel","https://www.r-bloggers.com/author/nina-zumel/"
"Quick hit: Some ggplot2 Stat ???? for {logspline}","June 18, 2019","hrbrmstr","https://www.r-bloggers.com/author/hrbrmstr/"
"New Versions of R GUIs: BlueSky, JASP, jamovi","June 18, 2019","Bob Muenchen","https://www.r-bloggers.com/author/bob-muenchen/"
"How to Perform Ordinal Logistic Regression in R","June 18, 2019","Perceptive Analytics","https://www.r-bloggers.com/author/perceptive-analytics/"
"anytime 0.3.4","June 18, 2019","Thinking inside the box","https://www.r-bloggers.com/author/thinking-inside-the-box/"
"Understanding AdaBoost – or how to turn Weakness into Strength","June 18, 2019","Learning Machines","https://www.r-bloggers.com/author/learning-machines/"
"radian: a modern console for R","June 18, 2019","Gavin L. Simpson","https://www.r-bloggers.com/author/gavin-l-simpson/"
"Parametric survival modeling","June 17, 2019","Devin Incerti","https://www.r-bloggers.com/author/devin-incerti/"
"Getting from flat data a world of relationships to visualise with Gephi","June 17, 2019","R on Coding Club UC3M","https://www.r-bloggers.com/author/r-on-coding-club-uc3m/"
"Visualizing the Copa América: Historical Records, Squad Profiles, and Player Profiles with xG statistics!","June 17, 2019","R by R(yo)","https://www.r-bloggers.com/author/r-by-ryo/"
"Le Monde puzzle [#1104]","June 17, 2019","xi'an","https://www.r-bloggers.com/author/xian/"
"Digital Water Utility Competencies: R for Water Professionals","June 17, 2019","Peter Prevos","https://www.r-bloggers.com/author/peter-prevos/"
"On my way to Manizales (Colombia)","June 16, 2019","arthur charpentier","https://www.r-bloggers.com/author/arthur-charpentier/"
"Meteorite Falls and Finds in the UK","June 16, 2019","» R","https://www.r-bloggers.com/author/%c2%bb-r/"
"Forecasting tools in development","June 16, 2019","- r","https://www.r-bloggers.com/author/r/"
"modelDown is now on CRAN!","June 16, 2019","smarterpoland","https://www.r-bloggers.com/author/smarterpoland/"
"‘Simulating genetic data with R: an example with deleterious variants (and a pun)’","June 16, 2019","mrtnj","https://www.r-bloggers.com/author/mrtnj/"
"Introducing the {ethercalc} package","June 15, 2019","hrbrmstr","https://www.r-bloggers.com/author/hrbrmstr/"
"Comrades Marathon (2019) Start Delay","June 14, 2019","R | datawookie","https://www.r-bloggers.com/author/r-datawookie/"
"Comrades Marathon (2019) Start Delay","June 14, 2019","R on datawookie","https://www.r-bloggers.com/author/r-on-datawookie/"
"Comrades Marathon: Start Delay","June 14, 2019","R on datawookie","https://www.r-bloggers.com/author/r-on-datawookie/"
"Stabilising transformations: how do I present my results?","June 14, 2019","R on The broken bridge between biologists and statisticians","https://www.r-bloggers.com/author/r-on-the-broken-bridge-between-biologists-and-stat/"
"Exploring Categorical Data With Inspectdf","June 14, 2019","Alastair Rushworth","https://www.r-bloggers.com/author/alastair-rushworth/"
"Stabilising transformations: how do I present my results?","June 14, 2019","R on The broken bridge between biologists and statisticians","https://www.r-bloggers.com/author/r-on-the-broken-bridge-between-biologists-and-stat/"
"Fun with R and the Noops","June 14, 2019","David Smith","https://www.r-bloggers.com/author/david-smith/"
"EARL London keynote announcement: Helen Hunter, Sainsbury’s","June 14, 2019","Mango Solutions","https://www.r-bloggers.com/author/mango-solutions/"
"Periodogram with R","June 13, 2019","Chris Carbone","https://www.r-bloggers.com/author/chris-carbone/"
"Useful callbacks for DT (in Shiny)","June 13, 2019","Stéphane Laurent","https://www.r-bloggers.com/author/stephane-laurent/"
"Fixing your mistakes: sentiment analysis edition","June 13, 2019","Rstats on Julia Silge","https://www.r-bloggers.com/author/rstats-on-julia-silge/"
"#rstats adventures in the land of @rstudio shiny (apps)","June 13, 2019","lortie","https://www.r-bloggers.com/author/lortie/"
"#rstats adventures in the land of @rstudio shiny (apps)","June 13, 2019","lortie","https://www.r-bloggers.com/author/lortie/"
"Polygon plotting in R","June 13, 2019","Rbloggers – The Analytics Lab","https://www.r-bloggers.com/author/rbloggers-the-analytics-lab/"
"Polygon plotting in R","June 13, 2019","Jeanine Schoonemann","https://www.r-bloggers.com/author/jeanine-schoonemann/"
"R vs. Python","June 13, 2019","matloff","https://www.r-bloggers.com/author/matloff/"
"Equal Size kmeans","June 12, 2019","R Views","https://www.r-bloggers.com/author/r-views/"
"RStudio Connect 1.7.4.2 – Important Security Patch","June 12, 2019","Sean Lopp","https://www.r-bloggers.com/author/sean-lopp/"
"Community Call – Involving Multilingual Communities","June 12, 2019","rOpenSci - open tools for open science","https://www.r-bloggers.com/author/ropensci-open-tools-for-open-science/"
"Working with SPSS labels in R","June 12, 2019","Martin Chan","https://www.r-bloggers.com/author/martin-chan/"
"Predicting MPG for 2019 Vehicles using R","June 12, 2019","Ian Johnson","https://www.r-bloggers.com/author/ian-johnson/"
"padr is updated","June 12, 2019","That’s so Random","https://www.r-bloggers.com/author/thats-so-random/"
"RcppArmadillo 0.9.500.2.0","June 12, 2019","Thinking inside the box","https://www.r-bloggers.com/author/thinking-inside-the-box/"
"Interactive Network Visualization with R","June 12, 2019","Niklas Junker","https://www.r-bloggers.com/author/niklas-junker/"
"Why R? 2019 Conference – Keynotes and Workshops announced","June 11, 2019","Marcin Kosinski","https://www.r-bloggers.com/author/marcin-kosinski/"
"Why I migrated from Excel to R","June 11, 2019","Outsider Data Science","https://www.r-bloggers.com/author/outsider-data-science/"
"Intermittent demand, Croston and Die Hard","June 11, 2019","Econometrics and Free Software","https://www.r-bloggers.com/author/econometrics-and-free-software/"
"Intermittent demand, Croston and Die Hard","June 11, 2019","Econometrics and Free Software","https://www.r-bloggers.com/author/econometrics-and-free-software/"
"Taking over maintenance of a software package","June 11, 2019","rOpenSci - open tools for open science","https://www.r-bloggers.com/author/ropensci-open-tools-for-open-science/"
"another attempt at code golf","June 11, 2019","xi'an","https://www.r-bloggers.com/author/xian/"
"Makeover Jumbalaya: Beating Dumbbells into Slopegraphs Whilst Orchestrating EtherCalc","June 11, 2019","hrbrmstr","https://www.r-bloggers.com/author/hrbrmstr/"
"Shiny apps need more info! – our new shiny.info package","June 11, 2019","Dominik Krzeminski","https://www.r-bloggers.com/author/dominik-krzeminski/"
"R Functions Tutorial: Writing, Scoping, Vectorizing, and More!","June 11, 2019","Chelsea Parlett","https://www.r-bloggers.com/author/chelsea-parlett/"
"Does “Sell in May, Go Away” really work?","June 11, 2019","Andrew Treadway","https://www.r-bloggers.com/author/andrew-treadway/"
"Communication Breakdown","June 11, 2019","quantixed","https://www.r-bloggers.com/author/quantixed/"
"From Coin Tosses to p-Hacking: Make Statistics Significant Again!","June 11, 2019","Learning Machines","https://www.r-bloggers.com/author/learning-machines/"
"Stanford NLP Tips","June 10, 2019","R on Sam Portnow's Blog","https://www.r-bloggers.com/author/r-on-sam-portnows-blog/"
"Book Review: Regression and Other Stories by Gelman, Hill, and Vehtari","June 10, 2019","Statistical Science & Related Matters on Less Likely","https://www.r-bloggers.com/author/statistical-science-related-matters-on-less-likely/"
"Introducing rminiconda","June 10, 2019","Ryan Hafen on Ryan Hafen","https://www.r-bloggers.com/author/ryan-hafen-on-ryan-hafen/"
"Explaining Predictions: Interpretable models (logistic regression)","June 10, 2019","R on notast","https://www.r-bloggers.com/author/r-on-notast/"
"Don’t get too excited – it might just be regression to the mean","June 10, 2019","Keith Goldfeld","https://www.r-bloggers.com/author/keith-goldfeld/"
"riddles on Egyptian fractions and Bernoulli factories","June 10, 2019","xi'an","https://www.r-bloggers.com/author/xian/"
"I walk the (train) line – part quatre – Tell me why","June 10, 2019","Hello, world! My name is Justin.","https://www.r-bloggers.com/author/hello-world-my-name-is-justin/"
"Estimating Rates using Probability Theory: Chalk Talk","June 10, 2019","John Mount","https://www.r-bloggers.com/author/john-mount/"
"Cricketr adds team analytics to its repertoire!!!","June 10, 2019","Tinniam V Ganesh","https://www.r-bloggers.com/author/tinniam-v-ganesh/"
"rTRNG: Advanced Parallel RNG in R","June 10, 2019","Mirai Solutions","https://www.r-bloggers.com/author/mirai-solutions/"
"rTRNG: Advanced Parallel RNG in R","June 10, 2019","Mirai Solutions","https://www.r-bloggers.com/author/mirai-solutions/"
"R + binder = interactive Jupyter notebooks in the cloud","June 9, 2019","R on FeelML","https://www.r-bloggers.com/author/r-on-feelml/"
"salesforcer 0.1.3 – Features for Better CRM Data Management","June 9, 2019","Steven M. Mortimer","https://www.r-bloggers.com/author/steven-m-mortimer/"
"reticulate, virtualenv, and Python in Linux","June 9, 2019","R Views","https://www.r-bloggers.com/author/r-views/"
"Introduction to Interactive Graphics in R with plotly","June 9, 2019","Rstats on pi: predict/infer","https://www.r-bloggers.com/author/rstats-on-pi-predict-infer/"
"Overview of the CRAN checks API","June 9, 2019","R-hub blog","https://www.r-bloggers.com/author/r-hub-blog/"
"#22: Using Rocker and PPAs for Fun and Profit","June 9, 2019","Thinking inside the box","https://www.r-bloggers.com/author/thinking-inside-the-box/"
"Wrapping Up Exploration of John Deere’s MowerPlus Database","June 9, 2019","hrbrmstr","https://www.r-bloggers.com/author/hrbrmstr/"
"littler 0.3.8: Several nice new features","June 9, 2019","Thinking inside the box","https://www.r-bloggers.com/author/thinking-inside-the-box/"
"Build A R Shiny App (Tutorial) – Wedding Risk Model","June 8, 2019","Business Science","https://www.r-bloggers.com/author/business-science/"
"Why R? 2019 Conference – Keynotes and Workshops announced","June 8, 2019","Why R? Foundation","https://www.r-bloggers.com/author/why-r-foundation/"
"The most important chart for long-term investors","June 8, 2019","Data-based investor","https://www.r-bloggers.com/author/data-based-investor/"
"Running UMAP for data visualisation in R","June 8, 2019","chris2016","https://www.r-bloggers.com/author/chris2016/"
"Visualizing geographic data with geofacet","June 7, 2019","Ryan Hafen on Ryan Hafen","https://www.r-bloggers.com/author/ryan-hafen-on-ryan-hafen/"
"Deep (learning) like Jacques Cousteau – Part 6 – Dot products","June 7, 2019","Hello, world! My name is Justin.","https://www.r-bloggers.com/author/hello-world-my-name-is-justin/"
"R Companion to Linear Algebra Step by Step, part 2","June 7, 2019","Detroit Data Lab","https://www.r-bloggers.com/author/detroit-data-lab/"
"Reader Challenge: Have Some Fun with Apple’s WWDC 2019 Keynote Subtitles & Show Your Work","June 7, 2019","hrbrmstr","https://www.r-bloggers.com/author/hrbrmstr/"
"Version 0.8.0 of NIMBLE released","June 7, 2019","Chris Paciorek","https://www.r-bloggers.com/author/chris-paciorek/"
"Detecting U12-type introns using IntEREst R/Biocondcutor package","June 7, 2019","Di Cook","https://www.r-bloggers.com/author/di-cook/"
"Logistic Regression in R with Healthcare data: Vitamin D and Osteoporosis","June 6, 2019","Anisa Dhana","https://www.r-bloggers.com/author/anisa-dhana/"
"Introducing the new rOpenSci docs server","June 6, 2019","rOpenSci - open tools for open science","https://www.r-bloggers.com/author/ropensci-open-tools-for-open-science/"
"A precursor of ABC-Gibbs","June 6, 2019","xi'an","https://www.r-bloggers.com/author/xian/"
"How to Use If-Else Statements and Loops in R","June 6, 2019","Jeff Li","https://www.r-bloggers.com/author/jeff-li/"
"Technical books are amazing opportunities","June 6, 2019","John Mount","https://www.r-bloggers.com/author/john-mount/"
"10th MilanoR Meeting: Information Retrieval and Price Positioning","June 6, 2019","MilanoR","https://www.r-bloggers.com/author/milanor/"
"Work Week at a Glance","June 6, 2019","Becky Bajan","https://www.r-bloggers.com/author/becky-bajan/"
"Make Multi-point “dumbbell” Plots in ggplot2","June 6, 2019","hrbrmstr","https://www.r-bloggers.com/author/hrbrmstr/"
"Are you [R]eady for production? The Data Science Event 2019 – Register now!","June 6, 2019","eoda GmbH","https://www.r-bloggers.com/author/eoda-gmbh/"
"EARL London 2019 evening reception announcement","June 6, 2019","Mango Solutions","https://www.r-bloggers.com/author/mango-solutions/"
"Downloading Fitbit Data Histories with R","June 5, 2019","Method Matters","https://www.r-bloggers.com/author/method-matters/"
"Downloading Fitbit Data Histories with R","June 5, 2019","Method Matters","https://www.r-bloggers.com/author/method-matters/"
"Downloading Fitbit Data Histories with R","June 5, 2019","Method Matters","https://www.r-bloggers.com/author/method-matters/"
"Genotype experiments: fitting a stability variance model with R","June 5, 2019","R on The broken bridge between biologists and statisticians","https://www.r-bloggers.com/author/r-on-the-broken-bridge-between-biologists-and-stat/"
"Testing Contrasts from Bayesian Models with ’emmeans’ and ‘bayestestR’","June 5, 2019","R on easystats","https://www.r-bloggers.com/author/r-on-easystats/"
"Data flow visuals – alluvial vs ggalluvial in R","June 5, 2019","R on head spin - the Heads or Tails blog","https://www.r-bloggers.com/author/r-on-head-spin-the-heads-or-tails-blog/"
"Testing Contrasts from Bayesian Models with ’emmeans’ and ‘bayestestR’","June 5, 2019","R on easystats","https://www.r-bloggers.com/author/r-on-easystats/"
"Data flow visuals – alluvial vs ggalluvial in R","June 5, 2019","R on head spin - the Heads or Tails blog","https://www.r-bloggers.com/author/r-on-head-spin-the-heads-or-tails-blog/"
"Testing Contrasts from Bayesian Models with ’emmeans’ and ‘bayestestR’","June 5, 2019","R on easystats","https://www.r-bloggers.com/author/r-on-easystats/"
"Genotype experiments: fitting a stability variance model with R","June 5, 2019","R on The broken bridge between biologists and statisticians","https://www.r-bloggers.com/author/r-on-the-broken-bridge-between-biologists-and-stat/"
"Testing Contrasts from Bayesian Models with ’emmeans’ and ‘bayestestR’","June 5, 2019","R on easystats","https://www.r-bloggers.com/author/r-on-easystats/"
"Coding Random Forests in 100 lines of code*","June 5, 2019","André Bleier","https://www.r-bloggers.com/author/andre-bleier/"
"Simulating Emotions during a Basketball Game – Just a Feeling in the Crowd","June 4, 2019","R on Will Hipson","https://www.r-bloggers.com/author/r-on-will-hipson/"
"Getting Open Data into R from CKAN","June 4, 2019","R on Alan Yeung","https://www.r-bloggers.com/author/r-on-alan-yeung/"
"Getting Open Data into R from CKAN","June 4, 2019","R on Alan Yeung","https://www.r-bloggers.com/author/r-on-alan-yeung/"
"Simulating Emotions during a Basketball Game – Just a Feeling in the Crowd","June 4, 2019","R on Will Hipson","https://www.r-bloggers.com/author/r-on-will-hipson/"
"Hybrid Machine Learning Forecasts for the 2019 FIFA Women’s World Cup","June 4, 2019","Achim Zeileis","https://www.r-bloggers.com/author/achim-zeileis/"
"Email Automation for Google Trends","June 4, 2019","JOURNEYOFANALYTICS","https://www.r-bloggers.com/author/journeyofanalytics/"
"AzureR and AzureKeyVault","June 4, 2019","Hong Ooi","https://www.r-bloggers.com/author/hong-ooi/"
"A Shiny Comrades Marathon Pacing App","June 3, 2019","R | datawookie","https://www.r-bloggers.com/author/r-datawookie/"
"A Shiny Comrades Marathon Pacing App","June 3, 2019","R on datawookie","https://www.r-bloggers.com/author/r-on-datawookie/"
"Using cosine similarity to find matching documents: a tutorial using Seneca’s letters to his friend Lucilius","June 3, 2019","Econometrics and Free Software","https://www.r-bloggers.com/author/econometrics-and-free-software/"
"Wordclouds","June 3, 2019","R | All Your Bayes","https://www.r-bloggers.com/author/r-all-your-bayes/"
"Animating Plots","June 3, 2019","R | All Your Bayes","https://www.r-bloggers.com/author/r-all-your-bayes/"
"Introducing DeclareDesign, a Platform for Research Design","June 3, 2019","R Views","https://www.r-bloggers.com/author/r-views/"
"Access Publisher Copyright & Self-Archiving Policies via the ‘SHERPA/RoMEO’ API","June 3, 2019","rOpenSci - open tools for open science","https://www.r-bloggers.com/author/ropensci-open-tools-for-open-science/"
"Using cosine similarity to find matching documents: a tutorial using Seneca’s letters to his friend Lucilius","June 3, 2019","Econometrics and Free Software","https://www.r-bloggers.com/author/econometrics-and-free-software/"
"Kites and Darts: the Penrose Tiling","June 3, 2019","@aschinchon","https://www.r-bloggers.com/author/aschinchon-2/"
"Pareto Models for Top Incomes","June 3, 2019","arthur charpentier","https://www.r-bloggers.com/author/arthur-charpentier/"
"Learning R: Permutations and Combinations with base R","June 3, 2019","Learning Machines","https://www.r-bloggers.com/author/learning-machines/"
"What is a Statistic?","June 2, 2019","Gydo!","https://www.r-bloggers.com/author/gydo/"
"Become a Bayesian master with bayestestR (0.2)","June 2, 2019","R on easystats","https://www.r-bloggers.com/author/r-on-easystats/"
"Become a Bayesian master with bayestestR (0.2)","June 2, 2019","R on easystats","https://www.r-bloggers.com/author/r-on-easystats/"
"Become a Bayesian master with bayestestR (0.2)","June 2, 2019","R on easystats","https://www.r-bloggers.com/author/r-on-easystats/"
"Same name, different bird","June 2, 2019","Martin Monkman","https://www.r-bloggers.com/author/martin-monkman/"
"Visualizing the Green New Deal with R Shiny","June 2, 2019","Sam Collier","https://www.r-bloggers.com/author/sam-collier/"
"Trawling Through iOS Backups For Treasure (a.k.a. How to fish for target files in iOS backups) with R","June 2, 2019","hrbrmstr","https://www.r-bloggers.com/author/hrbrmstr/"
"IRT From Scratch","June 1, 2019","R on Sam Portnow's Blog","https://www.r-bloggers.com/author/r-on-sam-portnows-blog/"
"Quick Hit: Handling Cocoa Core Data Timestamps in R","June 1, 2019","hrbrmstr","https://www.r-bloggers.com/author/hrbrmstr/"
"Sometimes the Best Documentation is Code You’ve Already Written","June 1, 2019","R on Ryan Plant","https://www.r-bloggers.com/author/r-on-ryan-plant/"
"Here is Your Data","June 1, 2019","William Doane","https://www.r-bloggers.com/author/william-doane/"
"Sentiment analysis in R","July 31, 2019","Mario S.","https://www.r-bloggers.com/author/mario-s/"
"Apply family functions – Part 2","July 31, 2019","Posts on","https://www.r-bloggers.com/author/posts-on/"
"Announcing pdqr","July 31, 2019","QuestionFlow","https://www.r-bloggers.com/author/questionflow/"
"R package submission REX","July 31, 2019","Neonira","https://www.r-bloggers.com/author/neonira/"
"How to reshape a dataframe from wide to long or long to wide format","July 31, 2019","r-bloggers on Programming with R","https://www.r-bloggers.com/author/r-bloggers-on-programming-with-r/"
"Getting started with Tensorflow, Keras in Python and R","July 31, 2019","Tinniam V Ganesh","https://www.r-bloggers.com/author/tinniam-v-ganesh/"
"R, Docker and Checkpoint: A Route to Reproducibility","July 31, 2019","R on datawookie","https://www.r-bloggers.com/author/r-on-datawookie/"
"Modeling Motivation and Emotion using Feedback Loops","July 30, 2019","R on Will Hipson","https://www.r-bloggers.com/author/r-on-will-hipson/"
"Using different/modified version of the same package","July 30, 2019","R on B. Ogan Mancarci","https://www.r-bloggers.com/author/r-on-b-ogan-mancarci/"
"Find out Bulk Email ID Reputations Risk using R","July 30, 2019","AbdulMajedRaja RS","https://www.r-bloggers.com/author/abdulmajedraja-rs/"
"mlr3-0.1.0","July 30, 2019","r-bloggers on Machine Learning in R","https://www.r-bloggers.com/author/r-bloggers-on-machine-learning-in-r/"
"Validating Type I and II Errors in A/B Tests in R","July 30, 2019","R Views","https://www.r-bloggers.com/author/r-views/"
"Modeling Motivation and Emotion using Feedback Loops","July 30, 2019","R on Will Hipson","https://www.r-bloggers.com/author/r-on-will-hipson/"
"Network model trees","July 30, 2019","Achim Zeileis","https://www.r-bloggers.com/author/achim-zeileis/"
"Network model trees","July 30, 2019","Achim Zeileis","https://www.r-bloggers.com/author/achim-zeileis/"
"Network model trees","July 30, 2019","Achim Zeileis","https://www.r-bloggers.com/author/achim-zeileis/"
"Microsoft ML Server 9.4 now available","July 30, 2019","David Smith","https://www.r-bloggers.com/author/david-smith/"
