"Title","Date","Author","Author_Hyperlink"
"Quantile regression in R","January 31, 2019","kjytay","https://www.r-bloggers.com/author/kjytay/"
"Resources","January 31, 2019","Educators R Learners","https://www.r-bloggers.com/author/educators-r-learners/"
"About Me","January 31, 2019","Educators R Learners","https://www.r-bloggers.com/author/educators-r-learners/"
"rOpenSci Software Peer Review: Still Improving","January 31, 2019","rOpenSci - open tools for open science","https://www.r-bloggers.com/author/ropensci-open-tools-for-open-science/"
"How GPL makes me leave R for Python :-(","January 31, 2019","Hovav Dror","https://www.r-bloggers.com/author/hovav-dror/"
"Using Data Science to read 10 years of Luxembourguish newspapers from the 19th century","January 30, 2019","Econometrics and Free Software","https://www.r-bloggers.com/author/econometrics-and-free-software/"
"Announcing new software peer review editors: Melina Vidoni and Brooke Anderson","January 30, 2019","rOpenSci - open tools for open science","https://www.r-bloggers.com/author/ropensci-open-tools-for-open-science/"
"Book review: Beyond Spreadsheets with R","January 30, 2019","Dr. Shirin Glander","https://www.r-bloggers.com/author/dr-shirin-glander/"
"missing digit in a 114 digit number [a Riddler’s riddle]","January 30, 2019","xi'an","https://www.r-bloggers.com/author/xian/"
"Outpatient scatter charts: Analysing new and follow up activity with gganimate","January 30, 2019","Gary Hutson","https://www.r-bloggers.com/author/gary-hutson/"
"Fast Static Maps Built with R","January 30, 2019","hrbrmstr","https://www.r-bloggers.com/author/hrbrmstr/"
"Price’s Protein Puzzle: 2019 update","January 30, 2019","nsaunders","https://www.r-bloggers.com/author/nsaunders/"
"R Markdown Template for Business Reports","January 30, 2019","INWT-Blog-RBloggers","https://www.r-bloggers.com/author/inwt-blog-rbloggers/"
"Quick Hit: Using seymour to Subscribe to your Git[la|hu]b Repo Issues in Feedly","January 30, 2019","hrbrmstr","https://www.r-bloggers.com/author/hrbrmstr/"
"How many rounds of Tenzi does it take to win?","January 29, 2019","R on jmarriott.com","https://www.r-bloggers.com/author/r-on-jmarriott-com/"
"Using custom scales with the ‚scales‘ package","January 29, 2019","Rcrastinate","https://www.r-bloggers.com/author/rcrastinate/"
"December 2108: “Top 40” New CRAN Packages","January 29, 2019","R Views","https://www.r-bloggers.com/author/r-views/"
"Time Travel with RStudio Package Manager 1.0.4","January 29, 2019","Sean Lopp","https://www.r-bloggers.com/author/sean-lopp/"
"New R package: load and chart oceanic storms","January 29, 2019","Blog - BS","https://www.r-bloggers.com/author/blog-bs/"
"Expected goals from bookmaker odds","January 29, 2019","opisthokonta","https://www.r-bloggers.com/author/opisthokonta/"
"Correlation analysis of cyclically adjusted valuation measures and subsequent returns","January 29, 2019","Data-based investor","https://www.r-bloggers.com/author/data-based-investor/"
"EARL London 2019 announcement","January 29, 2019","Mango Solutions","https://www.r-bloggers.com/author/mango-solutions/"
"Using Travis-CI to Create R-bloggers for Taiwan","January 29, 2019","Yongfu, Liao","https://www.r-bloggers.com/author/yongfu-liao/"
"NHS-R Community: Up the R-evolution","January 29, 2019","Gary Hutson","https://www.r-bloggers.com/author/gary-hutson/"
"Creating a word cloud on R-bloggers posts","January 29, 2019","Andrew Treadway","https://www.r-bloggers.com/author/andrew-treadway/"
"Hash Me If You Can","January 29, 2019","Learning Machines","https://www.r-bloggers.com/author/learning-machines/"
"benchmarkme: new version","January 29, 2019","Colin Gillespie","https://www.r-bloggers.com/author/colin-gillespie/"
"Web Scraping Google Sheets with RSelenium","January 28, 2019","Matt.0","https://www.r-bloggers.com/author/matt-0/"
"Playing Around with Phyllotactic Spirals","January 28, 2019","R on Chi's Impe[r]fect Blog","https://www.r-bloggers.com/author/r-on-chis-imperfect-blog/"
"Watch if R is running from Shiny","January 28, 2019","Colin Fay","https://www.r-bloggers.com/author/colin-fay/"
"Forecast Framework Demo","January 28, 2019","- r","https://www.r-bloggers.com/author/r/"
"Interacting with The Demographic and Health Surveys (DHS) Program data","January 28, 2019","rOpenSci - open tools for open science","https://www.r-bloggers.com/author/ropensci-open-tools-for-open-science/"
"Problems in Estimating GARCH Parameters in R (Part 2; rugarch)","January 28, 2019","ntguardian","https://www.r-bloggers.com/author/ntguardian/"
"Scaling H2O analytics with AWS and p(f)urrr (Part 3)","January 28, 2019","Digital Age Economist on Digital Age Economist","https://www.r-bloggers.com/author/digital-age-economist-on-digital-age-economist/"
"SatRday LA – R Conference Announcement","January 28, 2019","Amy Tzu-Yu Chen","https://www.r-bloggers.com/author/amy-tzu-yu-chen/"
"IRS Data Shows Growth in Number not Income of Highest Earners since 2005","January 27, 2019","R on Redwall Analytics","https://www.r-bloggers.com/author/r-on-redwall-analytics/"
"Graphing My Daily Phone Use","January 27, 2019","Roel M. Hogervorst","https://www.r-bloggers.com/author/roel-m-hogervorst/"
"Mathematical Notation in Online R/exams","January 27, 2019","R/exams","https://www.r-bloggers.com/author/rexams/"
"Building Big Shiny Apps — A Workflow (1/2)","January 27, 2019","Colin Fay","https://www.r-bloggers.com/author/colin-fay/"
"10 Tips for Choosing the Optimal Number of Clusters","January 27, 2019","Matt.0","https://www.r-bloggers.com/author/matt-0/"
"R tips and tricks – higher-order functions","January 27, 2019","Eran Raviv","https://www.r-bloggers.com/author/eran-raviv/"
"Statistics Sunday: Creating a Stacked Bar Chart for Rank Data","January 27, 2019","","https://www.r-bloggers.com/author/"
"Summarizing rstudio::conf 2019 Summaries with Tidy Text Techniques","January 26, 2019","r on Tony ElHabr","https://www.r-bloggers.com/author/r-on-tony-elhabr/"
"littler 0.3.6: Two neat enhancements","January 26, 2019","Thinking inside the box","https://www.r-bloggers.com/author/thinking-inside-the-box/"
"R Vocabulary – Part 2","January 25, 2019","Anindya Mozumdar","https://www.r-bloggers.com/author/anindya-mozumdar/"
"An Rstudio Addin for Network Analysis and Visualization","January 25, 2019","schochastics","https://www.r-bloggers.com/author/schochastics/"
"satRdays Newcastle 2019 Conference is Here!","January 25, 2019","Theo Roe","https://www.r-bloggers.com/author/theo-roe/"
"What the world agrees with by @ellis2013nz","January 25, 2019","free range statistics - R","https://www.r-bloggers.com/author/free-range-statistics-r/"
"Purrring progress bars (adding a progress bar to `purrr::map`)","January 25, 2019","R on Adi Sarid's personal blog","https://www.r-bloggers.com/author/r-on-adi-sarids-personal-blog/"
"R Conference Costs v2.0","January 25, 2019","Theo Roe","https://www.r-bloggers.com/author/theo-roe/"
"My #TidyverseDevDay and #RStudioConf 2019 Reflections!","January 24, 2019","R by R(yo)","https://www.r-bloggers.com/author/r-by-ryo/"
"Keeping up to date with R news","January 24, 2019","Posts on Maëlle's R blog","https://www.r-bloggers.com/author/posts-on-maelles-r-blog/"
"more concentration, everywhere","January 24, 2019","xi'an","https://www.r-bloggers.com/author/xian/"
"Right Now It’s KDA…Asset Allocation.","January 24, 2019","Ilya Kipnis","https://www.r-bloggers.com/author/ilya-kipnis/"
"Quick Hit: Automating Production Graphics Uploads in R Markdown Documents with googledrive","January 24, 2019","hrbrmstr","https://www.r-bloggers.com/author/hrbrmstr/"
"ELK+R Stack","January 24, 2019","paoloeusebi","https://www.r-bloggers.com/author/paoloeusebi/"
"Zen and The Art of Competing Against MBA’s","January 24, 2019","John","https://www.r-bloggers.com/author/john/"
"Zen and The Art of Competing Against MBA’s","January 24, 2019","John","https://www.r-bloggers.com/author/john/"
"Using Word Similarity Graphs to Explore Themes in Text: A Tutorial","January 23, 2019","Mark White","https://www.r-bloggers.com/author/mark-white/"
"stringfix : new R package for string manipulation in a %>% way","January 23, 2019","Guillaume Pressiat","https://www.r-bloggers.com/author/guillaume-pressiat/"
"stringfix : new R package for string manipulation in a %>% way","January 23, 2019","R posts","https://www.r-bloggers.com/author/r-posts/"
"Using waterfall charts to visualize feature contributions","January 23, 2019","R on The Stats Guy","https://www.r-bloggers.com/author/r-on-the-stats-guy/"
"Let’s call it tidysearch","January 23, 2019","Jamie Lendrum","https://www.r-bloggers.com/author/jamie-lendrum/"
"Animating Data Transformations III – separate()","January 23, 2019","Eric Hare","https://www.r-bloggers.com/author/eric-hare/"
"Le Monde puzzle [#1081]","January 23, 2019","xi'an","https://www.r-bloggers.com/author/xian/"
"Introduction to Data Analysis in RStudio","January 23, 2019","melliferrari","https://www.r-bloggers.com/author/melliferrari/"
"LondonR calling","January 23, 2019","Kasia Kulma","https://www.r-bloggers.com/author/kasia-kulma/"
"If wealth had anything to do with intelligence…","January 23, 2019","Learning Machines","https://www.r-bloggers.com/author/learning-machines/"
"Introduction to sparklyr","January 22, 2019","Modeling with R","https://www.r-bloggers.com/author/modeling-with-r/"
"Why Management Loves Overfitting","January 22, 2019","Quantargo Blog","https://www.r-bloggers.com/author/quantargo-blog/"
"Why Management Loves Overfitting","January 22, 2019","Quantargo Blog","https://www.r-bloggers.com/author/quantargo-blog/"
"Why Management Loves Overfitting","January 22, 2019","Quantargo Blog","https://www.r-bloggers.com/author/quantargo-blog/"
"Why Management Loves Overfitting","January 22, 2019","Quantargo Blog","https://www.r-bloggers.com/author/quantargo-blog/"
"Onboard and Offboard Data Manipulation in Flexdashboard","January 22, 2019","R Views","https://www.r-bloggers.com/author/r-views/"
"How to prepare data for NLP (text classification) with Keras and TensorFlow","January 22, 2019","Dr. Shirin Glander","https://www.r-bloggers.com/author/dr-shirin-glander/"
"RStudio Server on Azure","January 22, 2019","David Smith","https://www.r-bloggers.com/author/david-smith/"
"Image Dithering in R","January 22, 2019","Rasmus Bååth","https://www.r-bloggers.com/author/rasmus-baath/"
"Tibbles, checking examples, & character encodings","January 22, 2019","Gavin L. Simpson","https://www.r-bloggers.com/author/gavin-l-simpson/"
"What’s the deal with wind chill?","January 22, 2019","dan","https://www.r-bloggers.com/author/dan/"
"rstudio::conf 2019","January 22, 2019","hfrick","https://www.r-bloggers.com/author/hfrick/"
"R for trial and model-based cost-effectiveness analysis","January 21, 2019","R | Gianluca Baio","https://www.r-bloggers.com/author/r-gianluca-baio/"
"An introduction to Stan with R","January 21, 2019","R on Coding Club UC3M","https://www.r-bloggers.com/author/r-on-coding-club-uc3m/"
"Correlated longitudinal data with varying time intervals","January 21, 2019","Keith Goldfeld","https://www.r-bloggers.com/author/keith-goldfeld/"
"wateRinfo – Downloading tidal data to understand the behaviour of a migrating eel","January 21, 2019","rOpenSci - open tools for open science","https://www.r-bloggers.com/author/ropensci-open-tools-for-open-science/"
"The Shiny Module Design Pattern","January 21, 2019","William Doane","https://www.r-bloggers.com/author/william-doane/"
"Chaining effect in clustering","January 21, 2019","Stanislas Morbieu","https://www.r-bloggers.com/author/stanislas-morbieu/"
"R Studio Conf 2019 – Easing your FOMO with R Resources","January 21, 2019","Laura Ellis","https://www.r-bloggers.com/author/laura-ellis/"
"hrbrthemes 0.6.0 on CRAN + Other In-Development Package News","January 21, 2019","hrbrmstr","https://www.r-bloggers.com/author/hrbrmstr/"
"A shiny Web App from LEGO— truck + trailer","January 21, 2019","Sebastian Wolf","https://www.r-bloggers.com/author/sebastian-wolf/"
"A shiny Web App from LEGO— truck + trailer","January 21, 2019","Sebastian Wolf","https://www.r-bloggers.com/author/sebastian-wolf/"
"RServe: Getting Started","January 20, 2019","R on datawookie","https://www.r-bloggers.com/author/r-on-datawookie/"
"Docker Images for R: r-base versus r-apt","January 20, 2019","R on datawookie","https://www.r-bloggers.com/author/r-on-datawookie/"
"Worked example on setting up SQL Server with R ODBC connection","January 20, 2019","R on The Stats Guy","https://www.r-bloggers.com/author/r-on-the-stats-guy/"
"[short] Worked example on setting up SQL Server with R ODBC connection","January 20, 2019","R on The Stats Guy","https://www.r-bloggers.com/author/r-on-the-stats-guy/"
"Which English County Has Won the Most Points","January 20, 2019","rstats on Robert Hickman","https://www.r-bloggers.com/author/rstats-on-robert-hickman/"
"Climate change: Modeling 140+ years of temperature data with tsibble and fable","January 20, 2019","R on R(e)Thinking","https://www.r-bloggers.com/author/r-on-rethinking/"
"Spatial lag model trees","January 20, 2019","Achim Zeileis","https://www.r-bloggers.com/author/achim-zeileis/"
"Multiple Rstudio Server instances using a single R/LaTeX install with KVM","January 20, 2019","R on chepec","https://www.r-bloggers.com/author/r-on-chepec/"
"Multiple Rstudio Server instances using a single R/LaTeX install with KVM","January 20, 2019","R on chepec","https://www.r-bloggers.com/author/r-on-chepec/"
"Intrinsic time for cryptocurrency data","January 20, 2019","Karsten W.","https://www.r-bloggers.com/author/karsten-w/"
"Short note about tidyeval","January 20, 2019","R on Adi Sarid's personal blog","https://www.r-bloggers.com/author/r-on-adi-sarids-personal-blog/"
"My presentations on ‘Elements of Neural Networks & Deep Learning’ -Parts 6,7,8","January 20, 2019","Tinniam V Ganesh","https://www.r-bloggers.com/author/tinniam-v-ganesh/"
"Fully General Record Transforms with cdata","January 20, 2019","John Mount","https://www.r-bloggers.com/author/john-mount/"
"How I set up my first website (again)","January 19, 2019","R on notast","https://www.r-bloggers.com/author/r-on-notast/"
"GeoPAT2: Entropy calculations for local landscapes","January 19, 2019","Rstats on Jakub Nowosad's website","https://www.r-bloggers.com/author/rstats-on-jakub-nowosads-website/"
"A Newbie’s Guide to Making A Pull Request (for an R package)","January 19, 2019","r on Tony ElHabr","https://www.r-bloggers.com/author/r-on-tony-elhabr/"
"Feeling the rstudio::conf <U+2764><U+FE0F>","January 19, 2019","Rstats on Julia Silge","https://www.r-bloggers.com/author/rstats-on-julia-silge/"
"How to authenticate using OAuth2 through R","January 19, 2019","Roman Luštrik","https://www.r-bloggers.com/author/roman-lustrik/"
"How to authenticate using OAuth2 through R","January 19, 2019","Roman Luštrik","https://www.r-bloggers.com/author/roman-lustrik/"
"Cyclists – Ladies, Gents and Lowly Dogs – Shiny Breakdown of London Ride 100 Results","January 19, 2019","nk761","https://www.r-bloggers.com/author/nk761/"
"Create R Markdown reports and presentations even better with these 3 practical tips","January 19, 2019","Jozef's Rblog","https://www.r-bloggers.com/author/jozefs-rblog/"
"Recap: what I learned in rstudio::conf2019","January 19, 2019","R on Adi Sarid's personal blog","https://www.r-bloggers.com/author/r-on-adi-sarids-personal-blog/"
"Create R Markdown reports and presentations even better with these 3 practical tips","January 19, 2019","Jozef's Rblog","https://www.r-bloggers.com/author/jozefs-rblog/"
"simmer 4.2.1","January 19, 2019","Iñaki Úcar","https://www.r-bloggers.com/author/inaki-ucar/"
"Factor Analysis in R: Measuring Consumer Involvement","January 18, 2019","Peter Prevos","https://www.r-bloggers.com/author/peter-prevos/"
"New R package: load and chart oceanic storms","January 18, 2019","Blog - BS","https://www.r-bloggers.com/author/blog-bs/"
"Extracting colours from your images with Image Quantization","January 18, 2019","R on Chi's Impe[r]fect Blog","https://www.r-bloggers.com/author/r-on-chis-imperfect-blog/"
"Summer Internships 2019","January 18, 2019","Greg Wilson","https://www.r-bloggers.com/author/greg-wilson/"
"Window Aggregate operator in batch mode in SQL Server 2019","January 18, 2019","tomaztsql","https://www.r-bloggers.com/author/tomaztsql/"
"Rcrastinate is moving.","January 18, 2019","Sascha W.","https://www.r-bloggers.com/author/sascha-w/"
"Factor Analysis in R with Psych Package: Measuring Consumer Involvement","January 18, 2019","Peter Prevos","https://www.r-bloggers.com/author/peter-prevos/"
"Are you parallelizing your raster operations? You should!","January 17, 2019","Francesco Bailo","https://www.r-bloggers.com/author/francesco-bailo/"
"RcppArmadillo 0.9.200.7.0","January 17, 2019","Thinking inside the box","https://www.r-bloggers.com/author/thinking-inside-the-box/"
"How to Build an Automated Trading System using R","January 17, 2019","Wei Lin","https://www.r-bloggers.com/author/wei-lin/"
"forecast 8.5","January 17, 2019","R on Rob J Hyndman","https://www.r-bloggers.com/author/r-on-rob-j-hyndman/"
"Make Teaching R Quasi-Quotation Easier","January 17, 2019","John Mount","https://www.r-bloggers.com/author/john-mount/"
"Winter courses opening! R for Data Science & Statistics for Data Science","January 17, 2019","Quantide","https://www.r-bloggers.com/author/quantide/"
"How I started a blog based on blogdown: A walkthrough","January 16, 2019","Rcrastinate","https://www.r-bloggers.com/author/rcrastinate/"
"Some perspectives on Xochitl Torres Small’s win in CD NM-02","January 16, 2019","Jason Timm","https://www.r-bloggers.com/author/jason-timm/"
"RStudio Connect 1.7.0","January 16, 2019","Sean Lopp","https://www.r-bloggers.com/author/sean-lopp/"
"ROC Curves","January 16, 2019","R Views","https://www.r-bloggers.com/author/r-views/"
"My course on Hyperparameter Tuning in R is now on Data Camp!","January 16, 2019","Dr. Shirin Glander","https://www.r-bloggers.com/author/dr-shirin-glander/"
"AI, Machine Learning and Data Science Roundup: January 2019","January 16, 2019","David Smith","https://www.r-bloggers.com/author/david-smith/"
"Using DataCamp reduces anxiety about learning R!","January 16, 2019","melliferrari","https://www.r-bloggers.com/author/melliferrari/"
"Lecture slides: Real-World Data Science (Fraud Detection, Customer Churn & Predictive Maintenance)","January 15, 2019","Dr. Shirin Glander","https://www.r-bloggers.com/author/dr-shirin-glander/"
"Use foreach with HPC schedulers thanks to the future package","January 15, 2019","David Smith","https://www.r-bloggers.com/author/david-smith/"
"Feature Selection using Genetic Algorithms in R","January 15, 2019","Pablo Casas","https://www.r-bloggers.com/author/pablo-casas/"
"Using clusterlab to benchmark clustering algorithms","January 15, 2019","chris2016","https://www.r-bloggers.com/author/chris2016/"
"Selecting ‘special’ photos on your phone","January 15, 2019","Longhow Lam","https://www.r-bloggers.com/author/longhow-lam/"
"Mango Solutions contributes to technology partners RStudio conference","January 15, 2019","Mango Solutions","https://www.r-bloggers.com/author/mango-solutions/"
"Neural Text Modelling with R package ruimtehol","January 15, 2019","Super User","https://www.r-bloggers.com/author/super-user/"
"Understanding the Magic of Neural Networks","January 15, 2019","Learning Machines","https://www.r-bloggers.com/author/learning-machines/"
"Scaling H2O analytics with AWS and p(f)urrr (Part 2)","January 15, 2019","Digital Age Economist on Digital Age Economist","https://www.r-bloggers.com/author/digital-age-economist-on-digital-age-economist/"
"Automating R-markdown Tables With Hooks","January 15, 2019","Paul Stevenson","https://www.r-bloggers.com/author/paul-stevenson/"
"My presentations on ‘Elements of Neural Networks & Deep Learning’ -Parts 4,5","January 14, 2019","Tinniam V Ganesh","https://www.r-bloggers.com/author/tinniam-v-ganesh/"
"splashr 0.6.0 Now Uses the CRAN-nascent stevedore Package for Docker Orchestration","January 14, 2019","hrbrmstr","https://www.r-bloggers.com/author/hrbrmstr/"
"Rcrastinate is now based on blogdown","January 14, 2019","Rcrastinate","https://www.r-bloggers.com/author/rcrastinate/"
"R-Bloggers","January 14, 2019","Rcrastinate","https://www.r-bloggers.com/author/rcrastinate/"
"Plotting the Affect Circumplex in R","January 14, 2019","R on Will Hipson","https://www.r-bloggers.com/author/r-on-will-hipson/"
"R Tip: Use Inline Operators For Legibility","January 14, 2019","John Mount","https://www.r-bloggers.com/author/john-mount/"
"ggeffects 0.8.0 now on CRAN: marginal effects for regression models #rstats","January 14, 2019","Daniel","https://www.r-bloggers.com/author/daniel/"
"pcLasso: a new method for sparse regression","January 13, 2019","kjytay","https://www.r-bloggers.com/author/kjytay/"
"???? R Coding Style Guide","January 13, 2019","Iegor Rudnytskyi","https://www.r-bloggers.com/author/iegor-rudnytskyi/"
"rOpenSci’s new Code of Conduct","January 13, 2019","rOpenSci - open tools for open science","https://www.r-bloggers.com/author/ropensci-open-tools-for-open-science/"
"colorspace: New Tools for Colors and Palettes","January 13, 2019","Achim Zeileis","https://www.r-bloggers.com/author/achim-zeileis/"
"Travis CI for R — Advanced guide","January 13, 2019","Sebastian Wolf","https://www.r-bloggers.com/author/sebastian-wolf/"
"Showing a difference in means between two groups","January 13, 2019","mrtnj","https://www.r-bloggers.com/author/mrtnj/"
"Medium + r-bloggers — How to integrate?","January 13, 2019","Sebastian Wolf","https://www.r-bloggers.com/author/sebastian-wolf/"
"Travis CI for R — Advanced guide","January 13, 2019","Sebastian Wolf","https://www.r-bloggers.com/author/sebastian-wolf/"
"XmR Chart | Step-by-Step Guide by Hand and with R","January 12, 2019","Kenith Grey","https://www.r-bloggers.com/author/kenith-grey/"
"Generating Synthetic Data Sets with ‘synthpop’ in R","January 12, 2019","Daniel Oehm","https://www.r-bloggers.com/author/daniel-oehm/"
"Making sense of the METS and ALTO XML standards","January 12, 2019","Econometrics and Free Software","https://www.r-bloggers.com/author/econometrics-and-free-software/"
"Practical Data Science with R, 2nd Edition discount!","January 12, 2019","John Mount","https://www.r-bloggers.com/author/john-mount/"
"I walk the (train) line – part deux – the weight loss continues","January 12, 2019","Justin","https://www.r-bloggers.com/author/justin/"
"I walk the (train) line – part deux – the weight loss continues","January 12, 2019","Justin","https://www.r-bloggers.com/author/justin/"
"10 years of playback history on Last.FM: ""Just sit back and listen""","January 12, 2019","Sascha W.","https://www.r-bloggers.com/author/sascha-w/"
"How to combine Multiple ggplot Plots to make Publication-ready Plots","January 11, 2019","Abdul Majed Raja","https://www.r-bloggers.com/author/abdul-majed-raja/"
"GetDFPData Ver 1.4","January 11, 2019","R on msperlin","https://www.r-bloggers.com/author/r-on-msperlin/"
"NYC Meetup Thursday: Under the hood: Stan’s library, language, and algorithms","January 11, 2019","Bob Carpenter","https://www.r-bloggers.com/author/bob-carpenter/"
"Parallelize a For-Loop by Rewriting it as an Lapply Call","January 11, 2019","JottR on R","https://www.r-bloggers.com/author/jottr-on-r/"
"R Tip: Use seqi() For Indexes","January 11, 2019","John Mount","https://www.r-bloggers.com/author/john-mount/"
"Curve fitting and the Gaussian distribution","January 11, 2019","Fabian Dablander","https://www.r-bloggers.com/author/fabian-dablander/"
"Satellite imagery generation with Generative Adversarial Networks (GANs)","January 11, 2019","Michal Maj","https://www.r-bloggers.com/author/michal-maj/"
"pinp 0.0.7: More small YAML options","January 11, 2019","Thinking inside the box","https://www.r-bloggers.com/author/thinking-inside-the-box/"
"Add a static pdf vignette to an R package","January 11, 2019","mark","https://www.r-bloggers.com/author/mark/"
"Poor Tom Mitchell","January 10, 2019","Analysis of AFL","https://www.r-bloggers.com/author/analysis-of-afl/"
"epubr 0.6.0 CRAN release","January 10, 2019","Matt's R Blog","https://www.r-bloggers.com/author/matts-r-blog/"
"Visualizing the Asian Cup with R!","January 10, 2019","R by R(yo)","https://www.r-bloggers.com/author/r-by-ryo/"
"Roll Your Own Federal Government Shutdown-caused SSL Certificate Expiration Monitor in R","January 10, 2019","hrbrmstr","https://www.r-bloggers.com/author/hrbrmstr/"
"Who is the greatest finisher in soccer?","January 10, 2019","David Smith","https://www.r-bloggers.com/author/david-smith/"
"Waffle Geoms & Other Miscellaneous In-Development Package Updates","January 10, 2019","hrbrmstr","https://www.r-bloggers.com/author/hrbrmstr/"
"Linguistic Signals of Album Quality: A Predictive Analysis of Pitchfork Review Scores Using Quanteda","January 10, 2019","Method Matters","https://www.r-bloggers.com/author/method-matters/"
"Linguistic Signals of Album Quality: A Predictive Analysis of Pitchfork Review Scores Using Quanteda","January 10, 2019","Method Matters","https://www.r-bloggers.com/author/method-matters/"
"Rcpp, Camarón de la Isla and the Beauty of Maths","January 10, 2019","@aschinchon","https://www.r-bloggers.com/author/aschinchon-2/"
"JSON Payload for POST Request","January 9, 2019","R on datawookie","https://www.r-bloggers.com/author/r-on-datawookie/"
"Six Sigma DMAIC Series in R – Part 5","January 9, 2019","Kamal Kumar","https://www.r-bloggers.com/author/kamal-kumar/"
"My presentations on ‘Elements of Neural Networks & Deep Learning’ -Part1,2,3","January 9, 2019","Tinniam V Ganesh","https://www.r-bloggers.com/author/tinniam-v-ganesh/"
"A New Way to Handle Multivariate Outliers","January 9, 2019","R on Will Hipson","https://www.r-bloggers.com/author/r-on-will-hipson/"
