"Title","Date","Author","Author_Hyperlink"
"Learning R: The Collatz Conjecture","March 12, 2019","Learning Machines","https://www.r-bloggers.com/author/learning-machines/"
"DALEX has a new skin! Learn how it was designed at gdansk2019.satRdays","March 12, 2019","smarterpoland","https://www.r-bloggers.com/author/smarterpoland/"
"Binning Data with rbin","March 11, 2019","Rsquared Academy Blog - Explore Discover Learn","https://www.r-bloggers.com/author/rsquared-academy-blog-explore-discover-learn/"
"Binning Data with rbin","March 11, 2019","Rsquared Academy Blog","https://www.r-bloggers.com/author/rsquared-academy-blog/"
"A case where prospective matching may limit bias in a randomized trial","March 11, 2019","Keith Goldfeld","https://www.r-bloggers.com/author/keith-goldfeld/"
"Statistics Sunday: Scatterplots and Correlations with ggpairs","March 11, 2019","","https://www.r-bloggers.com/author/"
"Data Science at AT&T Labs Research","March 11, 2019","Hugo Bowne-Anderson","https://www.r-bloggers.com/author/hugo-bowne-anderson/"
"Ranking places with Google to create maps","March 11, 2019","Thomas M","https://www.r-bloggers.com/author/thomas-m/"
"A/B Testing with Machine Learning – A Step-by-Step Tutorial","March 11, 2019","Business Science","https://www.r-bloggers.com/author/business-science/"
"This is not normal(ised)","March 11, 2019","nsaunders","https://www.r-bloggers.com/author/nsaunders/"
"Bayesian Statistics: Analysis of Health Data","March 10, 2019","Michael Grogan","https://www.r-bloggers.com/author/michael-grogan/"
"reciproceed : recipe, proceed, reciprocally","March 10, 2019","Guillaume Pressiat","https://www.r-bloggers.com/author/guillaume-pressiat/"
"reciproceed : recipe, proceed, reciprocally","March 10, 2019","Guillaume Pressiat","https://www.r-bloggers.com/author/guillaume-pressiat/"
"Data Manipulation Corner Cases","March 10, 2019","John Mount","https://www.r-bloggers.com/author/john-mount/"
"Assessing Causality from Observational Data using Pearl’s Structural Causal Models","March 10, 2019","Rstats on pi: predict/infer","https://www.r-bloggers.com/author/rstats-on-pi-predict-infer/"
"Community Call – Research Applications of rOpenSci Taxonomy and Biodiversity Tools","March 10, 2019","rOpenSci - open tools for open science","https://www.r-bloggers.com/author/ropensci-open-tools-for-open-science/"
"A Summary of My Home-Brew Binning Algorithms for Scorecard Development","March 10, 2019","statcompute","https://www.r-bloggers.com/author/statcompute/"
"Wrangling Content Security Policies in R","March 10, 2019","hrbrmstr","https://www.r-bloggers.com/author/hrbrmstr/"
"Exploring swings in Australian federal elections by @ellis2013nz","March 10, 2019","free range statistics - R","https://www.r-bloggers.com/author/free-range-statistics-r/"
"Import Excel sheets with R","March 9, 2019","R on Dominic Royé","https://www.r-bloggers.com/author/r-on-dominic-roye/"
"(2/2) Book promotion (paperback edition) – “Processing and Analyzing Financial Data with R”","March 9, 2019","R on msperlin","https://www.r-bloggers.com/author/r-on-msperlin/"
"Fantasy Tips From the Fantasy King","March 9, 2019","Analysis of AFL","https://www.r-bloggers.com/author/analysis-of-afl/"
"Wrapper of knitr::include_graphics to Handle URLs & PDF Outputs","March 9, 2019","Yongfu, Liao","https://www.r-bloggers.com/author/yongfu-liao/"
"RcppArmadillo 0.9.200.7.1","March 8, 2019","Thinking inside the box","https://www.r-bloggers.com/author/thinking-inside-the-box/"
"Specifying Accelerated Failure Time Models in STAN","March 8, 2019","R on","https://www.r-bloggers.com/author/r-on/"
"Specifying Accelerated Failure Time Models in STAN","March 8, 2019","R on","https://www.r-bloggers.com/author/r-on/"
"Making Sense of Simulation Models with Metamodels Part 1 – Low-Order Polynomials with Arena and R","March 8, 2019","R Blogs by Pedro N. de Lima","https://www.r-bloggers.com/author/r-blogs-by-pedro-n-de-lima/"
"Book promotion – “Processing and Analyzing Financial Data with R”","March 8, 2019","R on msperlin","https://www.r-bloggers.com/author/r-on-msperlin/"
"Plot shared favourability for two competing species","March 8, 2019","A.M. Barbosa","https://www.r-bloggers.com/author/a-m-barbosa/"
"Process Mining (Part 1/3): Introduction to bupaR package","March 7, 2019","R on notast","https://www.r-bloggers.com/author/r-on-notast/"
"Building tidy tools workshop","March 7, 2019","Roger Oberg","https://www.r-bloggers.com/author/roger-oberg/"
"SatRday Paris: Build interactive waffle plots","March 7, 2019","Sébastien Rochette","https://www.r-bloggers.com/author/sebastien-rochette/"
"Where to find the worst weather in the US","March 7, 2019","David Smith","https://www.r-bloggers.com/author/david-smith/"
"SatRday Paris 2019 Slides on Futures","March 7, 2019","JottR on R","https://www.r-bloggers.com/author/jottr-on-r/"
"gower 0.2.0 is on CRAN","March 7, 2019","mark","https://www.r-bloggers.com/author/mark/"
"Shiny vs. Dash: A Side-by-side comparison","March 6, 2019","Roz King","https://www.r-bloggers.com/author/roz-king/"
"Shiny vs. Dash: A Side-by-side comparison","March 6, 2019","Roz King","https://www.r-bloggers.com/author/roz-king/"
"How to eyeball a standard deviation","March 6, 2019","dan","https://www.r-bloggers.com/author/dan/"
"Forecasting From  a Regression with a Square Root Dependent Variable","March 6, 2019","Dave Giles","https://www.r-bloggers.com/author/dave-giles/"
"The Global Carbon Footprint (1970 – 2015)","March 6, 2019","Sabbir Mohammed","https://www.r-bloggers.com/author/sabbir-mohammed/"
"RInside 0.2.15","March 6, 2019","Thinking inside the box","https://www.r-bloggers.com/author/thinking-inside-the-box/"
"IRS Data shows Connecticut Taxpayers Also Pay Higher Federal Taxes","March 6, 2019","R on Redwall Analytics","https://www.r-bloggers.com/author/r-on-redwall-analytics/"
"R Vocabulary – Part 4","March 6, 2019","Anindya Mozumdar","https://www.r-bloggers.com/author/anindya-mozumdar/"
"MODIStsp v. 1.3.8 is out !","March 6, 2019","Posts on Lorenzo Busetto Website & Blog","https://www.r-bloggers.com/author/posts-on-lorenzo-busetto-website-blog/"
"Paid in Books: An Interview with Christian Westergaard","March 6, 2019","R Views","https://www.r-bloggers.com/author/r-views/"
"Quick post – detect and fix this ggplot2 antipattern","March 6, 2019","Roel M. Hogervorst","https://www.r-bloggers.com/author/roel-m-hogervorst/"
"See you in Barcelona this summer","March 6, 2019","Ilya Kashnitsky","https://www.r-bloggers.com/author/ilya-kashnitsky/"
"76th Tokyo.R Users Meetup Roundup!","March 6, 2019","R by R(yo)","https://www.r-bloggers.com/author/r-by-ryo/"
"The ggforce Awakens (again)","March 6, 2019","Data Imaginist","https://www.r-bloggers.com/author/data-imaginist/"
"Efficient landscape metrics calculations for buffers around sampling points","March 6, 2019","Rstats on Jakub Nowosad's website","https://www.r-bloggers.com/author/rstats-on-jakub-nowosads-website/"
"At the end of the rainbow","March 6, 2019","Achim Zeileis","https://www.r-bloggers.com/author/achim-zeileis/"
"R vs Python: Which is better for Data Science?","March 6, 2019","Arslan Shahid","https://www.r-bloggers.com/author/arslan-shahid/"
"Starting With Data Science: A Rigorous Hands-On Introduction to Data Science for Engineers","March 6, 2019","John Mount","https://www.r-bloggers.com/author/john-mount/"
"International Summer School on Geospatial Data Science with R in Jena","March 6, 2019","jannesm","https://www.r-bloggers.com/author/jannesm/"
"Dataiku with RStudio integration","March 5, 2019","Longhow Lam","https://www.r-bloggers.com/author/longhow-lam/"
"Building a Shiny app to show the impact of vaccines","March 5, 2019","R blog posts on sandsynligvis.dk","https://www.r-bloggers.com/author/r-blog-posts-on-sandsynligvis-dk/"
"Bayesian Survival Analysis with Data Augmentation","March 5, 2019","R on","https://www.r-bloggers.com/author/r-on/"
"Building a Shiny app to show the impact of vaccines","March 5, 2019","R blog posts on sandsynligvis.dk","https://www.r-bloggers.com/author/r-blog-posts-on-sandsynligvis-dk/"
"Lots of zeros or too many zeros?: Thinking about zero inflation in count data","March 5, 2019","Very statisticious on Very statisticious","https://www.r-bloggers.com/author/very-statisticious-on-very-statisticious/"
"Bayesian Survival Analysis with Data Augmentation","March 5, 2019","R on","https://www.r-bloggers.com/author/r-on/"
"Building a Shiny app to show the impact of vaccines","March 5, 2019","R blog posts on sandsynligvis.dk","https://www.r-bloggers.com/author/r-blog-posts-on-sandsynligvis-dk/"
"Getting started with RMarkdown & trying to make it in the world of Kaggle. Join MünsteR for our next meetup!","March 5, 2019","Dr. Shirin Glander","https://www.r-bloggers.com/author/dr-shirin-glander/"
"Graph analysis using the tidyverse","March 5, 2019","R Views","https://www.r-bloggers.com/author/r-views/"
"Cancer clusters and the Poisson distributions","March 5, 2019","Yossi Levy","https://www.r-bloggers.com/author/yossi-levy/"
"Head’s Up! Roll Your Own HTTP Headers Investigations with the ‘hdrs’ Package","March 5, 2019","hrbrmstr","https://www.r-bloggers.com/author/hrbrmstr/"
"How to become a Mango","March 5, 2019","Laura Swales","https://www.r-bloggers.com/author/laura-swales/"
"dqrng v0.1.0: breaking changes","March 5, 2019","Ralf Stubner","https://www.r-bloggers.com/author/ralf-stubner/"
"Evolution works!","March 5, 2019","Learning Machines","https://www.r-bloggers.com/author/learning-machines/"
"shapper is on CRAN, it’s an R wrapper over SHAP explainer for black-box models","March 5, 2019","smarterpoland","https://www.r-bloggers.com/author/smarterpoland/"
"Classification of historical newspapers content: a tutorial combining R, bash and Vowpal Wabbit, part 2","March 4, 2019","Econometrics and Free Software","https://www.r-bloggers.com/author/econometrics-and-free-software/"
"Getting Help in R","March 4, 2019","Rsquared Academy Blog - Explore Discover Learn","https://www.r-bloggers.com/author/rsquared-academy-blog-explore-discover-learn/"
"Overview of statistical tests","March 4, 2019","Philipp Probst","https://www.r-bloggers.com/author/philipp-probst/"
"Getting Help in R","March 4, 2019","Rsquared Academy Blog","https://www.r-bloggers.com/author/rsquared-academy-blog/"
"Classification of historical newspapers content: a tutorial combining R, bash and Vowpal Wabbit, part 2","March 4, 2019","Econometrics and Free Software","https://www.r-bloggers.com/author/econometrics-and-free-software/"
"Building Big Shiny Apps — A Workflow 2/2","March 4, 2019","Colin Fay","https://www.r-bloggers.com/author/colin-fay/"
"Calculate biotic threat of a stronger over a weaker species","March 4, 2019","A.M. Barbosa","https://www.r-bloggers.com/author/a-m-barbosa/"
"Getting Your First Data Science Job","March 4, 2019","Hugo Bowne-Anderson","https://www.r-bloggers.com/author/hugo-bowne-anderson/"
"The fastest cyclists of Europe live in …","March 4, 2019","Sebastian Wolf","https://www.r-bloggers.com/author/sebastian-wolf/"
"The fastest cyclists of Europe live in …","March 4, 2019","Sebastian Wolf","https://www.r-bloggers.com/author/sebastian-wolf/"
"The fastest cyclists of Europe live in …","March 4, 2019","Sebastian Wolf","https://www.r-bloggers.com/author/sebastian-wolf/"
"Using parameters in Rmarkdown","March 4, 2019","nsaunders","https://www.r-bloggers.com/author/nsaunders/"
"Sentiment Analysis, Word Embedding, and Topic Modeling on Venom Reviews","March 4, 2019","Riki Saito","https://www.r-bloggers.com/author/riki-saito/"
"2019-01 A Geometry Engine Interface for ‘grid’","March 3, 2019","pmur002","https://www.r-bloggers.com/author/pmur002/"
"Polished human cognitive characteristics chapter","March 3, 2019","Derek Jones","https://www.r-bloggers.com/author/derek-jones-2/"
"Web Scraping Amazon Reviews (March 2019)","March 3, 2019","Riki Saito","https://www.r-bloggers.com/author/riki-saito/"
"CRAN Mirror “Security”","March 3, 2019","hrbrmstr","https://www.r-bloggers.com/author/hrbrmstr/"
"Developing Data Products","March 3, 2019","John","https://www.r-bloggers.com/author/john/"
"Offline visualization of geolocation data from Statcounter logs with R","March 3, 2019","garuda","https://www.r-bloggers.com/author/garuda/"
"How to use Google Search Console API with R","March 3, 2019","Jean-Christophe Chouinard","https://www.r-bloggers.com/author/jean-christophe-chouinard/"
"Run Remote R Scripts with Mobile Device using E-mail Triggers","March 2, 2019","Kenith Grey","https://www.r-bloggers.com/author/kenith-grey/"
"Classification of historical newspapers content: a tutorial combining R, bash and Vowpal Wabbit, part 1","March 2, 2019","Econometrics and Free Software","https://www.r-bloggers.com/author/econometrics-and-free-software/"
"Color palettes inspired by Islamic art","March 2, 2019","R on From System to System","https://www.r-bloggers.com/author/r-on-from-system-to-system/"
"Classification of historical newspapers content: a tutorial combining R, bash and Vowpal Wabbit","March 2, 2019","Econometrics and Free Software","https://www.r-bloggers.com/author/econometrics-and-free-software/"
"Efficient MCMC with Caching","March 2, 2019","AO","https://www.r-bloggers.com/author/ao/"
"Using the R Package Profvis on a Linear Model","March 2, 2019","aaronddl","https://www.r-bloggers.com/author/aaronddl/"
"rquery Substitution","March 2, 2019","John Mount","https://www.r-bloggers.com/author/john-mount/"
"Creating blazing fast pivot tables from R with data.table – now with subtotals using grouping sets","March 2, 2019","Jozef's Rblog","https://www.r-bloggers.com/author/jozefs-rblog/"
"Creating blazing fast pivot tables from R with data.table – now with subtotals using grouping sets","March 2, 2019","Jozef's Rblog","https://www.r-bloggers.com/author/jozefs-rblog/"
"How the Victorians Mapped London’s Cholera","March 2, 2019","James","https://www.r-bloggers.com/author/james/"
"Visualizing Bike Share Data (NiceRide)","March 1, 2019","Matt","https://www.r-bloggers.com/author/matt/"
"Window Functions in SQL vs. R","March 1, 2019","Pete Talbert","https://www.r-bloggers.com/author/pete-talbert/"
"When principal component is not unique","March 1, 2019","R on From System to System","https://www.r-bloggers.com/author/r-on-from-system-to-system/"
"R blogs I follow","March 1, 2019","R on From System to System","https://www.r-bloggers.com/author/r-on-from-system-to-system/"
"Tractatus Logico (Phylo)sophicus","March 1, 2019","Blog - BS","https://www.r-bloggers.com/author/blog-bs/"
"My Shiny Dashboard, Milwaukee Beer","March 1, 2019","Posts on Anything Data","https://www.r-bloggers.com/author/posts-on-anything-data/"
"Top 8 Docker Images for Data Science","March 1, 2019","Nagdev","https://www.r-bloggers.com/author/nagdev/"
"An architecture for real-time scoring with R","March 1, 2019","David Smith","https://www.r-bloggers.com/author/david-smith/"
"The delta method and its implementation in R","March 1, 2019","Yossi Levy","https://www.r-bloggers.com/author/yossi-levy/"
"Powerball demystified","March 1, 2019","Yossi Levy","https://www.r-bloggers.com/author/yossi-levy/"
"R Journal publication","March 1, 2019","Eran Raviv","https://www.r-bloggers.com/author/eran-raviv/"
"A brief history of clinical trials","March 1, 2019","Yossi Levy","https://www.r-bloggers.com/author/yossi-levy/"
"Bayesian state space modelling of the Australian 2019 election by @ellis2013nz","March 1, 2019","free range statistics - R","https://www.r-bloggers.com/author/free-range-statistics-r/"
"What is logistic in the logistic regression?","March 1, 2019","Yossi Levy","https://www.r-bloggers.com/author/yossi-levy/"
"Some comments on AB testing implementation","March 1, 2019","Yossi Levy","https://www.r-bloggers.com/author/yossi-levy/"
"Set Analysis: A face off between Venn diagrams and UpSet plots","April 30, 2019","Laura Ellis","https://www.r-bloggers.com/author/laura-ellis/"
"Risk and return for B3","April 30, 2019","R on msperlin","https://www.r-bloggers.com/author/r-on-msperlin/"
"Building a Shiny App as a Package","April 30, 2019","Colin Fay","https://www.r-bloggers.com/author/colin-fay/"
"Machine Learning explained for statistics folk","April 30, 2019","Robert","https://www.r-bloggers.com/author/robert/"
"Spatial data and maps conference – FOSS4G","April 30, 2019","mikerspencer","https://www.r-bloggers.com/author/mikerspencer/"
"The Rich didn’t earn their Wealth, they just got Lucky","April 30, 2019","Learning Machines","https://www.r-bloggers.com/author/learning-machines/"
"Google Next 2019 – observations from the Mango viewing deck","April 30, 2019","Matt Aldridge","https://www.r-bloggers.com/author/matt-aldridge/"
"Zooming in on maps with sf and ggplot2","April 30, 2019","Markus Konrad","https://www.r-bloggers.com/author/markus-konrad/"
"RcppArmadillo 0.9.400.2.0","April 29, 2019","Thinking inside the box","https://www.r-bloggers.com/author/thinking-inside-the-box/"
"Could not Resist","April 29, 2019","John Mount","https://www.r-bloggers.com/author/john-mount/"
"Dealing with correlation in designed field experiments: part I","April 29, 2019","R on The broken bridge between biologists and statisticians","https://www.r-bloggers.com/author/r-on-the-broken-bridge-between-biologists-and-stat/"
"Compute R2s and other performance indices for all your models!","April 29, 2019","R on easystats","https://www.r-bloggers.com/author/r-on-easystats/"
"Dealing with correlation in designed field experiments: part I","April 29, 2019","R on The broken bridge between biologists and statisticians","https://www.r-bloggers.com/author/r-on-the-broken-bridge-between-biologists-and-stat/"
"Analysing the HIV pandemic, Part 1: HIV in sub-Sahara Africa","April 29, 2019","R Views","https://www.r-bloggers.com/author/r-views/"
"RStudio 1.2 Released","April 29, 2019","Jonathan McPherson","https://www.r-bloggers.com/author/jonathan-mcpherson/"
"ViennaR Meetup March – Full Talks Online","April 29, 2019","Quantargo Blog","https://www.r-bloggers.com/author/quantargo-blog/"
"Relaunching the qualtRics package","April 29, 2019","Rstats on Julia Silge","https://www.r-bloggers.com/author/rstats-on-julia-silge/"
"Relaunching the qualtRics package","April 29, 2019","rOpenSci - open tools for open science","https://www.r-bloggers.com/author/ropensci-open-tools-for-open-science/"
"What matters more in a cluster randomized trial: number or size?","April 29, 2019","Keith Goldfeld","https://www.r-bloggers.com/author/keith-goldfeld/"
"Compute R2s and other performance indices for all your models!","April 29, 2019","R on easystats","https://www.r-bloggers.com/author/r-on-easystats/"
"Marketing with Machine Learning: Apriori","April 29, 2019","Detroit Data Lab","https://www.r-bloggers.com/author/detroit-data-lab/"
"data.table by a dummy","April 29, 2019","HighlandR","https://www.r-bloggers.com/author/highlandr/"
"runcharter","April 29, 2019","HighlandR","https://www.r-bloggers.com/author/highlandr/"
"My book ‘Cricket analytics with cricketr and cricpy’ is now on Amazon","April 29, 2019","Tinniam V Ganesh","https://www.r-bloggers.com/author/tinniam-v-ganesh/"
"Getting a Data Science Job is not a Numbers Game!","April 29, 2019","Michael Toth","https://www.r-bloggers.com/author/michael-toth/"
"Why use RTutor for interactive tutorials if there is RStudio’s learnr?","April 29, 2019","Economics and R - R posts","https://www.r-bloggers.com/author/economics-and-r-r-posts/"
"ViennaR Meetup March – Full Talks Online","April 28, 2019","Quantargo Blog","https://www.r-bloggers.com/author/quantargo-blog/"
"ViennaR Meetup March – Full Talks Online","April 28, 2019","Quantargo Blog","https://www.r-bloggers.com/author/quantargo-blog/"
"Templated output in R","April 28, 2019","R on Abhijit Dasgupta","https://www.r-bloggers.com/author/r-on-abhijit-dasgupta/"
"visualising bias and unbiasedness","April 28, 2019","xi'an","https://www.r-bloggers.com/author/xian/"
"Interact with PostGIS from R","April 28, 2019","Sébastien Rochette","https://www.r-bloggers.com/author/sebastien-rochette/"
"How I Put Logos on ggplot2 Figures","April 28, 2019","Mark White","https://www.r-bloggers.com/author/mark-white/"
"RStudio’s multiple cursors rule!","April 28, 2019","Hello, world!My name is Justin.","https://www.r-bloggers.com/author/hello-worldmy-name-is-justin/"
"NYC… Dangerous or Deadly?","April 28, 2019","Aydan Ellman","https://www.r-bloggers.com/author/aydan-ellman/"
"Tips to Reduce the Complexity of Slide Making with Xaringan","April 28, 2019","Yongfu, Liao","https://www.r-bloggers.com/author/yongfu-liao/"
"The Mrs. White probability puzzle","April 28, 2019","Antoine R","https://www.r-bloggers.com/author/antoine-r/"
"Test your tidyness – a short quiz to check your tidyverse capabilities","April 28, 2019","R on Adi Sarid's personal blog","https://www.r-bloggers.com/author/r-on-adi-sarids-personal-blog/"
"Bayes vs. the Invaders! Part Four: Convergence","April 28, 2019","tealeaf","https://www.r-bloggers.com/author/tealeaf/"
"Parsing and Visualizing Transcriptomics Data in Shiny","April 27, 2019","Ryan Willett","https://www.r-bloggers.com/author/ryan-willett/"
"Fast food, causality and R packages, part 1","April 27, 2019","Econometrics and Free Software","https://www.r-bloggers.com/author/econometrics-and-free-software/"
"Teaching Factory Physics Flow Benchmarking with R and Many-Objective Visuals","April 27, 2019","R Blogs by Pedro N. de Lima","https://www.r-bloggers.com/author/r-blogs-by-pedro-n-de-lima/"
"Fast food, causality and R packages, part 1","April 27, 2019","Econometrics and Free Software","https://www.r-bloggers.com/author/econometrics-and-free-software/"
"11,264 Regressions in One Tidy Plot","April 27, 2019","An Accounting and Data Science Nerd's Corner","https://www.r-bloggers.com/author/an-accounting-and-data-science-nerds-corner/"
"Le Monde puzzle [#1099]","April 27, 2019","xi'an","https://www.r-bloggers.com/author/xian/"
"Earthquake Analysis (1/4): Quantitative Variables Exploratory Analysis","April 27, 2019","Giorgio Garziano","https://www.r-bloggers.com/author/giorgio-garziano/"
"More General Weighted Binning","April 27, 2019","statcompute","https://www.r-bloggers.com/author/statcompute/"
"Quick Hit: Scraping javascript-“enabled” Sites with {htmlunit}","April 27, 2019","hrbrmstr","https://www.r-bloggers.com/author/hrbrmstr/"
"Data Layout Exercises","April 27, 2019","John Mount","https://www.r-bloggers.com/author/john-mount/"
"Setting up continuous multi-platform R package building, checking and testing with R-Hub, Docker and GitLab CI/CD for free, with a working example","April 27, 2019","Jozef's Rblog","https://www.r-bloggers.com/author/jozefs-rblog/"
"A new image on DigitalOcean to start using RStudio Server without waiting more than 2 minutes","April 26, 2019","Pachá","https://www.r-bloggers.com/author/pacha/"
"A new image on DigitalOcean to start using RStudio Server without waiting more than 2 minutes","April 26, 2019","Pachá","https://www.r-bloggers.com/author/pacha/"
"My favourite alternative to Excel dashboards","April 26, 2019","Martin Chan","https://www.r-bloggers.com/author/martin-chan/"
"A new image on DigitalOcean to start using RStudio Server without waiting more than 2 minutes","April 26, 2019","Pachá","https://www.r-bloggers.com/author/pacha/"
"Robust measurement from a 2-way table","April 26, 2019","David Firth","https://www.r-bloggers.com/author/david-firth/"
"Frankfurt Data Science Meetup: Opening the Black Box","April 26, 2019","Lea Waniek","https://www.r-bloggers.com/author/lea-waniek/"
"Checking reverse dependencies: the tiny way","April 26, 2019","mark","https://www.r-bloggers.com/author/mark/"
"DALEX for keras and parsnip","April 26, 2019","smarterpoland","https://www.r-bloggers.com/author/smarterpoland/"
"Identifying regional differences in Perinatal Mental Health  indicators in the UK with R","April 25, 2019","Matt.0","https://www.r-bloggers.com/author/matt-0/"
"Shiny Modules (part 2): Share reactive among multiple modules","April 25, 2019","ArData","https://www.r-bloggers.com/author/ardata/"
"Shiny v1.3.2","April 25, 2019","Joe Cheng","https://www.r-bloggers.com/author/joe-cheng/"
"March 2019: “Top 40” New CRAN Packages","April 25, 2019","R Views","https://www.r-bloggers.com/author/r-views/"
"Couting Pairs","April 25, 2019","Analysis of AFL","https://www.r-bloggers.com/author/analysis-of-afl/"
"modelplotr v1.0 now on CRAN: Visualize the Business Value of your Predictive Models","April 25, 2019","Jurriaan Nagelkerke","https://www.r-bloggers.com/author/jurriaan-nagelkerke/"
"modelplotr v1.0 now on CRAN: Visualize the Business Value of your Predictive Models","April 25, 2019","Jurriaan Nagelkerke","https://www.r-bloggers.com/author/jurriaan-nagelkerke/"
"Encryptr now makes it easy to encrypt and decrypt files","April 25, 2019","Ewen Harrison","https://www.r-bloggers.com/author/ewen-harrison/"
"Probability of winning a best-of-7-series (part 2)","April 25, 2019","kjytay","https://www.r-bloggers.com/author/kjytay/"
"Meta analysis of multiple multi-omics data… Oy Vey","April 25, 2019","Dror Berel's R Blog","https://www.r-bloggers.com/author/dror-berels-r-blog/"
"How to handle CRAN checks with help from R-hub","April 24, 2019","R-hub blog","https://www.r-bloggers.com/author/r-hub-blog/"
"A Few Old Books","April 24, 2019","R Views","https://www.r-bloggers.com/author/r-views/"
"Real world tidy interest rate swap pricing","April 24, 2019","R on The CuRious Financial Risk ManageR","https://www.r-bloggers.com/author/r-on-the-curious-financial-risk-manager/"
"A new image on DigitalOcean to start using RStudio Server without waiting more than 2 minutes","April 24, 2019","Pachá","https://www.r-bloggers.com/author/pacha/"
"I walk the (train) line – part trois – Dijkstra’s revenge","April 24, 2019","Hello, world!My name is Justin.","https://www.r-bloggers.com/author/hello-worldmy-name-is-justin/"
