"Title","Date","Author","Author_Hyperlink"
"Multi-Armed Bandits as an A/B Testing Solution","September 26, 2019","INWT-Blog-RBloggers","https://www.r-bloggers.com/author/inwt-blog-rbloggers/"
"Debuting in a VFL/AFL Grand Final is rare","September 26, 2019","nsaunders","https://www.r-bloggers.com/author/nsaunders/"
"Spatial networks in R with sf and tidygraph","September 25, 2019","Lorena Abad, Robin Lovelace & Lucas van der Meer","https://www.r-bloggers.com/author/lorena-abad-robin-lovelace-lucas-van-der-meer/"
"August 2019: “Top 40” R packages","September 25, 2019","R Views","https://www.r-bloggers.com/author/r-views/"
"Multiple imputation support in Finalfit","September 25, 2019","Ewen Harrison","https://www.r-bloggers.com/author/ewen-harrison/"
"EARL London review","September 25, 2019","Mango Solutions","https://www.r-bloggers.com/author/mango-solutions/"
"How to build analytics platforms – Part 5: Data visualization and reliable results","September 25, 2019","eoda GmbH","https://www.r-bloggers.com/author/eoda-gmbh/"
"Time series forecasting with random forest","September 25, 2019","Manuel Tilgner","https://www.r-bloggers.com/author/manuel-tilgner/"
"Data Wrangling for Text mining: Extract individual elements from a Book","September 24, 2019","Posts | SERDAR KORUR","https://www.r-bloggers.com/author/posts-serdar-korur/"
"Preparing Data for Supervised Classification","September 24, 2019","John Mount","https://www.r-bloggers.com/author/john-mount/"
"new paper: “The metaRbolomics Toolbox in Bioconductor and beyond”","September 24, 2019","Egon Willighagen","https://www.r-bloggers.com/author/egon-willighagen/"
"new paper: “The metaRbolomics Toolbox in Bioconductor and beyond”","September 24, 2019","Egon Willighagen","https://www.r-bloggers.com/author/egon-willighagen/"
"R trainings in Frankfurt!","September 24, 2019","eoda GmbH","https://www.r-bloggers.com/author/eoda-gmbh/"
"Super Solutions for Shiny Architecture 1 of 5:  Using Session Data","September 24, 2019","Marcin Dubel","https://www.r-bloggers.com/author/marcin-dubel/"
"RcppAnnoy 0.0.13","September 23, 2019","Thinking inside the box","https://www.r-bloggers.com/author/thinking-inside-the-box/"
"DFIR Redefined Part 3: visNetwork for Network Data","September 23, 2019","Russ McRee","https://www.r-bloggers.com/author/russ-mcree/"
"DFIR Redefined Part 3: visNetwork for Network Data","September 23, 2019","Russ McRee","https://www.r-bloggers.com/author/russ-mcree/"
"Drake, Docker, and Gitlab-CI","September 23, 2019","Noam Ross","https://www.r-bloggers.com/author/noam-ross/"
"Mastering R presentations","September 23, 2019","R on Coding Club UC3M","https://www.r-bloggers.com/author/r-on-coding-club-uc3m/"
"poor statistics","September 23, 2019","xi'an","https://www.r-bloggers.com/author/xian/"
"Introducing Dash Bio for R","September 23, 2019","modern.data","https://www.r-bloggers.com/author/modern-data/"
"Cartography with R and QGIS, which to choose?","September 23, 2019","mikerspencer","https://www.r-bloggers.com/author/mikerspencer/"
"Handling Missing Values in R using tidyr","September 22, 2019","AbdulMajedRaja RS","https://www.r-bloggers.com/author/abdulmajedraja-rs/"
"PDF Scraping in R with tabulizer","September 22, 2019","Business Science","https://www.r-bloggers.com/author/business-science/"
"Selecting the max value from each group, a case study: dplyr and sparklyr","September 22, 2019","Random R Ramblings","https://www.r-bloggers.com/author/random-r-ramblings/"
"Trelliscopejs Hutch 2019","September 22, 2019","Ryan Hafen on Ryan Hafen","https://www.r-bloggers.com/author/ryan-hafen-on-ryan-hafen/"
"Introducing rwhatsapp","September 22, 2019","Johannes B. Gruber on Johannes B. Gruber","https://www.r-bloggers.com/author/johannes-b-gruber-on-johannes-b-gruber/"
"Introducing rwhatsapp","September 22, 2019","Johannes B. Gruber on Johannes B. Gruber","https://www.r-bloggers.com/author/johannes-b-gruber-on-johannes-b-gruber/"
"RStudio Connect 1.7.8 – Put a pin in it!","September 22, 2019","Sean Lopp","https://www.r-bloggers.com/author/sean-lopp/"
"(Re)Launching my supervised machine learning course","September 22, 2019","Rstats on Julia Silge","https://www.r-bloggers.com/author/rstats-on-julia-silge/"
"JavaScript cont in R","September 22, 2019","Colin Fay","https://www.r-bloggers.com/author/colin-fay/"
"R TensorFlow Deep Neural Network","September 22, 2019","Ian Johnson","https://www.r-bloggers.com/author/ian-johnson/"
"Gold-Mining Week 3 (2019)","September 22, 2019","Michael Griebe","https://www.r-bloggers.com/author/michael-griebe/"
"d3po: R package for easy interactive D3 visualization with Shiny","September 21, 2019","Pachá","https://www.r-bloggers.com/author/pacha/"
"Open Trade Statistics: An Independent project that values reproducible research and provides tidy trade data","September 21, 2019","Pachá","https://www.r-bloggers.com/author/pacha/"
"Workshops for Women and Girls","September 21, 2019","Blog on FORWARDS","https://www.r-bloggers.com/author/blog-on-forwards/"
"Open Trade Statistics: An Independent project that values reproducible research and provides tidy trade data","September 21, 2019","Pachá","https://www.r-bloggers.com/author/pacha/"
"d3po: R package for easy interactive D3 visualization with Shiny","September 21, 2019","Pachá","https://www.r-bloggers.com/author/pacha/"
"Data Science in Production: a Joint Event with Yotabites","September 21, 2019","Samantha Toet","https://www.r-bloggers.com/author/samantha-toet/"
"Workshops for Women and Girls","September 21, 2019","Blog on FORWARDS","https://www.r-bloggers.com/author/blog-on-forwards/"
"Informing priors for a time-series models to detect declines in tiger sharks","September 21, 2019","Bluecology blog","https://www.r-bloggers.com/author/bluecology-blog/"
"Make an abstract booklet with R and LaTeX","September 21, 2019","mikerspencer","https://www.r-bloggers.com/author/mikerspencer/"
"RSwitch 1.5.1 Released","September 21, 2019","hrbrmstr","https://www.r-bloggers.com/author/hrbrmstr/"
"Using Spark from R for performance with arbitrary code – Part 2 – Constructing functions by piping dplyr verbs","September 21, 2019","Jozef's Rblog","https://www.r-bloggers.com/author/jozefs-rblog/"
"GLM tip getting non-linear with splines","September 20, 2019","Bluecology blog","https://www.r-bloggers.com/author/bluecology-blog/"
"digest 0.6.21","September 20, 2019","Thinking inside the box","https://www.r-bloggers.com/author/thinking-inside-the-box/"
"My upcoming O’Reilly business analytics online training courses","September 20, 2019","George Mount","https://www.r-bloggers.com/author/george-mount/"
"Forecast Combination talk","September 20, 2019","Eran Raviv","https://www.r-bloggers.com/author/eran-raviv/"
"Is that Red Wine Good Enough?","September 19, 2019","R on Curious Joe","https://www.r-bloggers.com/author/r-on-curious-joe/"
"rmd syntax highlighting in vim","September 19, 2019","January","https://www.r-bloggers.com/author/january/"
"rminiconda","September 18, 2019","Ryan Hafen on Ryan Hafen","https://www.r-bloggers.com/author/ryan-hafen-on-ryan-hafen/"
"Functional Programming + Iterative Web Scraping in R","September 18, 2019","AbdulMajedRaja RS","https://www.r-bloggers.com/author/abdulmajedraja-rs/"
"RStudio Server Pro 1.2 Update","September 18, 2019","Jonathan McPherson","https://www.r-bloggers.com/author/jonathan-mcpherson/"
"Accelerate your plots with ggforce","September 18, 2019","R Views","https://www.r-bloggers.com/author/r-views/"
"The Advantages of Record Transform Specifications","September 18, 2019","John Mount","https://www.r-bloggers.com/author/john-mount/"
"Fast data exploration for predictive modeling","September 18, 2019","Pablo Casas","https://www.r-bloggers.com/author/pablo-casas/"
"Fast data exploration for predictive modeling","September 18, 2019","Pablo Casas","https://www.r-bloggers.com/author/pablo-casas/"
"Using emojis and .png as icons in your ggplot","September 18, 2019","Jakob Gepp","https://www.r-bloggers.com/author/jakob-gepp/"
"Data science 2019 – Interlinguality and the question of the „right“ programming language","September 18, 2019","eoda GmbH","https://www.r-bloggers.com/author/eoda-gmbh/"
"ICC Bot comes online","September 17, 2019","Higher Order Functions","https://www.r-bloggers.com/author/higher-order-functions/"
"Brownlow Competition","September 17, 2019","Analysis of AFL","https://www.r-bloggers.com/author/analysis-of-afl/"
"Modeling Particulate Counts as a Poisson Process in R","September 17, 2019","[R]eliability","https://www.r-bloggers.com/author/reliability/"
"Windows user space issues with installing R packages","September 17, 2019","Fellgernon Bit - rstats","https://www.r-bloggers.com/author/fellgernon-bit-rstats/"
"Le Monde puzzle [#1111]","September 17, 2019","xi'an","https://www.r-bloggers.com/author/xian/"
"The Learning Platform for Data-Driven Companies","September 17, 2019","Joyce Chiu","https://www.r-bloggers.com/author/joyce-chiu/"
"Retrieving google drive item shares and permissions (in R)","September 17, 2019","R on Adi Sarid's personal blog","https://www.r-bloggers.com/author/r-on-adi-sarids-personal-blog/"
"Obtaining tokens with AzureAuth inside a Shiny app","September 17, 2019","Hong Ooi","https://www.r-bloggers.com/author/hong-ooi/"
"Obtaining tokens with AzureAuth inside a Shiny app","September 17, 2019","Hong Ooi","https://www.r-bloggers.com/author/hong-ooi/"
"Hindi and Other Languages in India based on 2001 census","September 16, 2019","AbdulMajedRaja RS","https://www.r-bloggers.com/author/abdulmajedraja-rs/"
"Automatically update your publication list using R scholar II – get a PDF","September 16, 2019","Thomas Hackl | Coding Biologist","https://www.r-bloggers.com/author/thomas-hackl-coding-biologist/"
"Genomics at superresolution: Mapping Drug targets on single cell resolution in Fibrosis","September 16, 2019","Posts | SERDAR KORUR","https://www.r-bloggers.com/author/posts-serdar-korur/"
"citecorp: working with open citations","September 16, 2019","rOpenSci - open tools for open science","https://www.r-bloggers.com/author/ropensci-open-tools-for-open-science/"
"Easyalluvial 0.2.1 released","September 16, 2019","R on datistics","https://www.r-bloggers.com/author/r-on-datistics/"
"Simulating an open cohort stepped-wedge trial","September 16, 2019","Keith Goldfeld","https://www.r-bloggers.com/author/keith-goldfeld/"
"Learn R the Right Way in 5 Steps","September 16, 2019","Charlie Custer","https://www.r-bloggers.com/author/charlie-custer/"
"Business AI for SMB’s: A Management Take On The Challenges of Leveraging Data and AI for Sales Growth and Enhancing the Customer Experience (CX)","September 16, 2019","Nick Gausling and Douglas Pestana","https://www.r-bloggers.com/author/nick-gausling-and-douglas-pestana/"
"Feature-based time series analysis","September 15, 2019","R on Rob J Hyndman","https://www.r-bloggers.com/author/r-on-rob-j-hyndman/"
"Practical Data Science with R update","September 15, 2019","John Mount","https://www.r-bloggers.com/author/john-mount/"
"Le Monde puzzle [#1110]","September 15, 2019","xi'an","https://www.r-bloggers.com/author/xian/"
"pinp 0.0.9: Real Fix and Polish","September 15, 2019","Thinking inside the box","https://www.r-bloggers.com/author/thinking-inside-the-box/"
"Develop Performance Benchmark with GRNN","September 14, 2019","statcompute","https://www.r-bloggers.com/author/statcompute/"
"Selecting the max value from each group, a case study: data.table","September 14, 2019","Random R Ramblings","https://www.r-bloggers.com/author/random-r-ramblings/"
"Posts","September 14, 2019","Random R Ramblings","https://www.r-bloggers.com/author/random-r-ramblings/"
"Start blogging in 5 minutes on Netlify with Hugo and blogdown (September 2019 Update)","September 14, 2019","Posts | SERDAR KORUR","https://www.r-bloggers.com/author/posts-serdar-korur/"
"Selecting the max value from each group, a case study: base R","September 14, 2019","Random R Ramblings","https://www.r-bloggers.com/author/random-r-ramblings/"
"Twitter “Account Analysis” in R","September 14, 2019","hrbrmstr","https://www.r-bloggers.com/author/hrbrmstr/"
"RSwitch 1.5.0 Release Now Also Corrals RStudio Server Connections","September 14, 2019","hrbrmstr","https://www.r-bloggers.com/author/hrbrmstr/"
"September 2019 Democratic Debates Added to {ggchicklet}","September 14, 2019","hrbrmstr","https://www.r-bloggers.com/author/hrbrmstr/"
"ttdo 0.0.3: New package","September 13, 2019","Thinking inside the box","https://www.r-bloggers.com/author/thinking-inside-the-box/"
"Get Funded by the R Consortium – Call for Proposals Open Now!","September 13, 2019","R Consortium","https://www.r-bloggers.com/author/r-consortium/"
"Tell Me a Story: How to Generate Textual Explanations for Predictive Models","September 13, 2019","smarterpoland","https://www.r-bloggers.com/author/smarterpoland/"
"Tell Me a Story: How to Generate Textual Explanations for Predictive Models","September 13, 2019","Przemyslaw Biecek","https://www.r-bloggers.com/author/przemyslaw-biecek-2/"
"NIMBLE short course at Bayes Comp 2020 conference","September 13, 2019","Chris Paciorek","https://www.r-bloggers.com/author/chris-paciorek/"
"Initializing an empty list","September 13, 2019","kaijagahm","https://www.r-bloggers.com/author/kaijagahm/"
"Curiosity + Data + Customer Segmentation = Goodies","September 13, 2019","Krystian Igras","https://www.r-bloggers.com/author/krystian-igras/"
"#FunDataFriday – The magick package in R","September 13, 2019","Laura Ellis","https://www.r-bloggers.com/author/laura-ellis/"
"Reproducing the kidney cancer example from BDA","September 13, 2019","Robin Ryder","https://www.r-bloggers.com/author/robin-ryder/"
"Getting on the meet-up bandwagon – our first meet up event","September 12, 2019","Gary Hutson","https://www.r-bloggers.com/author/gary-hutson/"
"Regex Problem? Here’s an R package that will write Regex for you","September 12, 2019","AbdulMajedRaja RS","https://www.r-bloggers.com/author/abdulmajedraja-rs/"
"Fitting ‘complex’ mixed models with ‘nlme’: Example #2","September 12, 2019","R on The broken bridge between biologists and statisticians","https://www.r-bloggers.com/author/r-on-the-broken-bridge-between-biologists-and-stat/"
"Fitting ‘complex’ mixed models with ‘nlme’: Example #4","September 12, 2019","R on The broken bridge between biologists and statisticians","https://www.r-bloggers.com/author/r-on-the-broken-bridge-between-biologists-and-stat/"
"Fitting ‘complex’ mixed models with ‘nlme’: Example #4","September 12, 2019","R on The broken bridge between biologists and statisticians","https://www.r-bloggers.com/author/r-on-the-broken-bridge-between-biologists-and-stat/"
"Fitting ‘complex’ mixed models with ‘nlme’: Example #3","September 12, 2019","R on The broken bridge between biologists and statisticians","https://www.r-bloggers.com/author/r-on-the-broken-bridge-between-biologists-and-stat/"
"Athena and R … there is another way!?","September 12, 2019","Dyfan Jones Brain Dump HQ","https://www.r-bloggers.com/author/dyfan-jones-brain-dump-hq/"
"Laguerre-Samuelson Inequality","September 12, 2019","LeaRning Stats","https://www.r-bloggers.com/author/learning-stats/"
"Fitting ‘complex’ mixed models with ‘nlme’: Example #2","September 12, 2019","R on The broken bridge between biologists and statisticians","https://www.r-bloggers.com/author/r-on-the-broken-bridge-between-biologists-and-stat/"
"Social Network Visualization with R","September 12, 2019","JOURNEYOFANALYTICS","https://www.r-bloggers.com/author/journeyofanalytics/"
"Social Network Visualization with R","September 12, 2019","JOURNEYOFANALYTICS","https://www.r-bloggers.com/author/journeyofanalytics/"
"WVPlots 1.1.2 on CRAN","September 12, 2019","Nina Zumel","https://www.r-bloggers.com/author/nina-zumel/"
"Survival analysis with strata, clusters, frailties and competing risks in in Finalfit","September 12, 2019","Ewen Harrison","https://www.r-bloggers.com/author/ewen-harrison/"
"A DevOps Process for Deploying R to Production","September 12, 2019","David Smith","https://www.r-bloggers.com/author/david-smith/"
"Use more of your data with matrix factorisation","September 12, 2019","Daniel Oehm","https://www.r-bloggers.com/author/daniel-oehm/"
"Gold-Mining Week 2 (2019)","September 11, 2019","Michael Griebe","https://www.r-bloggers.com/author/michael-griebe/"
"Call for Help: Lead R/Shiny Developer","September 11, 2019","Isaac Petersen","https://www.r-bloggers.com/author/isaac-petersen/"
"R/Medicine 2019 Workshops","September 11, 2019","R Views","https://www.r-bloggers.com/author/r-views/"
"Running R Projects in MyBinder – Dockerfile Creation With Holepunch","September 11, 2019","Tony Hirst","https://www.r-bloggers.com/author/tony-hirst/"
"Dynamic UI Elements in Shiny","September 11, 2019","Oliver Guggenbühl","https://www.r-bloggers.com/author/oliver-guggenbuhl/"
"Finding the Modal School District","September 10, 2019","%>% dreams","https://www.r-bloggers.com/author/dreams/"
"investmentsim – an R Package for Simulating Investment Portfolios","September 10, 2019","Ryan Holbrook","https://www.r-bloggers.com/author/ryan-holbrook/"
"R comes to oil + gas","September 10, 2019","modern.data","https://www.r-bloggers.com/author/modern-data/"
"Looking Up R / CRAN Package Maintainers With an ac.uk Affiliation","September 10, 2019","Tony Hirst","https://www.r-bloggers.com/author/tony-hirst/"
"Hadley is a smash hit at LondonR","September 10, 2019","Matt Aldridge","https://www.r-bloggers.com/author/matt-aldridge/"
"Extracting Sydney transport data from Twitter","September 10, 2019","nsaunders","https://www.r-bloggers.com/author/nsaunders/"
"Is the pain worth it?: Can Rcpp speed up Passing Bablok Regression?","September 9, 2019","[email protected]","https://www.r-bloggers.com/author/dtholmesmail-ubc-ca/"
"parameters: a powerful and lightweight alternative to broom to describe your models’ coefficients","September 9, 2019","R on easystats","https://www.r-bloggers.com/author/r-on-easystats/"
"parameters: a powerful and lightweight alternative to broom to describe your models’ coefficients","September 9, 2019","R on easystats","https://www.r-bloggers.com/author/r-on-easystats/"
"auditor: a guided tour through residuals","September 9, 2019","R on FeelML","https://www.r-bloggers.com/author/r-on-feelml/"
"Multi Currency Swap Pricing with SwapPricer","September 9, 2019","R on The CuRious Financial Risk ManageR","https://www.r-bloggers.com/author/r-on-the-curious-financial-risk-manager/"
"parameters: a powerful and lightweight alternative to broom to describe your models’ coefficients","September 9, 2019","R on easystats","https://www.r-bloggers.com/author/r-on-easystats/"
"R Community Explorer – R User Groups","September 9, 2019","josephrickert","https://www.r-bloggers.com/author/josephrickert/"
"New R Consortium Blog Guidelines","September 9, 2019","R Consortium","https://www.r-bloggers.com/author/r-consortium/"
"Catch us at these conferences!","September 9, 2019","Theo Roe","https://www.r-bloggers.com/author/theo-roe/"
"Best Practice: Development of Robust Shiny Dashboards as R Packages","September 9, 2019","INWT-Blog-RBloggers","https://www.r-bloggers.com/author/inwt-blog-rbloggers/"
"R Neural Network","September 9, 2019","Ian Johnson","https://www.r-bloggers.com/author/ian-johnson/"
"pins: Pin, Discover and Share Resources","September 8, 2019","Javier Luraschi","https://www.r-bloggers.com/author/javier-luraschi/"
"pins: Pin, Discover and Share Resources","September 8, 2019","RStudio Team","https://www.r-bloggers.com/author/rstudio-team/"
"Parsing Text for Emotion Terms: Analysis & Visualization Using R: Updated Analysis","September 8, 2019","Mesfin Gebeyaw","https://www.r-bloggers.com/author/mesfin-gebeyaw/"
"Was Trump confused by rainbow color map?","September 8, 2019","Achim Zeileis","https://www.r-bloggers.com/author/achim-zeileis/"
"Was Trump confused by rainbow color map?","September 8, 2019","Achim Zeileis","https://www.r-bloggers.com/author/achim-zeileis/"
"Was Trump confused by rainbow color map?","September 8, 2019","Achim Zeileis","https://www.r-bloggers.com/author/achim-zeileis/"
"pinp 0.0.8: Bugfix","September 8, 2019","Thinking inside the box","https://www.r-bloggers.com/author/thinking-inside-the-box/"
"Finding Undervalued Air Bnb’s","September 8, 2019","Part Time Analyst","https://www.r-bloggers.com/author/part-time-analyst/"
"An updated version of The Hitchhiker’s Guide to Ggplot2","September 7, 2019","Pachá","https://www.r-bloggers.com/author/pacha/"
"Hyde Mod: A blogdown theme with full XML feed and custom MathJax for equation numbering","September 7, 2019","Pachá","https://www.r-bloggers.com/author/pacha/"
"Built-in Colour Names in R","September 7, 2019","R on Chi's Impe[r]fect Blog","https://www.r-bloggers.com/author/r-on-chis-imperfect-blog/"
"Hyde Mod: A blogdown theme with full XML feed and custom MathJax for equation numbering","September 7, 2019","Pachá","https://www.r-bloggers.com/author/pacha/"
"First World Problems: Very long RMarkdown documents","September 7, 2019","Martin Chan","https://www.r-bloggers.com/author/martin-chan/"
"An updated version of The Hitchhiker’s Guide to Ggplot2","September 7, 2019","Pachá","https://www.r-bloggers.com/author/pacha/"
"R Companion to Linear Algebra Step by Step, Chapter 2 part 1","September 7, 2019","Detroit Data Lab","https://www.r-bloggers.com/author/detroit-data-lab/"
"Getting Your Comparison Groups Right","September 6, 2019","R on Sam Portnow's Blog","https://www.r-bloggers.com/author/r-on-sam-portnows-blog/"
"Calendar Heatmaps in ggplot","September 6, 2019","R on Ryan Plant","https://www.r-bloggers.com/author/r-on-ryan-plant/"
"The most annoying warning for CRAN submission","September 6, 2019","Neonira","https://www.r-bloggers.com/author/neonira/"
"Poisson point processes, mass shootings and clumping by @ellis2013nz","September 6, 2019","free range statistics - R","https://www.r-bloggers.com/author/free-range-statistics-r/"
"Predictive Solutions Series – Draper & Dash’s Stranded and Super Stranded Patient Module","September 6, 2019","Gary Hutson","https://www.r-bloggers.com/author/gary-hutson/"
"Including Optional Functionality from Other Packages in Your Code","September 5, 2019","Random R Ramblings","https://www.r-bloggers.com/author/random-r-ramblings/"
"Stopping Rules for Significance Testing in R","September 5, 2019","[R]eliability","https://www.r-bloggers.com/author/reliability/"
"One week as a Shiny dev, seen through Google search","September 5, 2019","Colin Fay","https://www.r-bloggers.com/author/colin-fay/"
"Deadline extended for rstudio::conf(2020) abstract submissions","September 5, 2019","Hadley Wickham","https://www.r-bloggers.com/author/hadley-wickham/"
"UCSCXenaTools: Retrieve Gene Expression and Clinical Information from UCSC Xena for Survival Analysis","September 5, 2019","rOpenSci - open tools for open science","https://www.r-bloggers.com/author/ropensci-open-tools-for-open-science/"
"Simulating the Rugby World Cup 2019 Japan in R","September 5, 2019","stats_on_the_cloud","https://www.r-bloggers.com/author/stats_on_the_cloud/"
"{tvthemes 1.0.0} is on CRAN: Code improvements, Kim Possible, Stannis Baratheon, Hilda palettes/themes, and more!","September 5, 2019","R by R(yo)","https://www.r-bloggers.com/author/r-by-ryo/"
"Chi-Square and the Egon Pearson correction","September 5, 2019","Thom","https://www.r-bloggers.com/author/thom/"
"Bucketing and highlighting dominant predictors in your ML models","September 5, 2019","Gary Hutson","https://www.r-bloggers.com/author/gary-hutson/"
"CSS Enhances R Shiny; SASS Enhances CSS","September 5, 2019","Joseph Cha","https://www.r-bloggers.com/author/joseph-cha/"
"How to build analytics platforms – Part 4: Database scalability and business models","September 5, 2019","eoda GmbH","https://www.r-bloggers.com/author/eoda-gmbh/"
"Moderated Network Models for Continuous Data","September 5, 2019","Jonas Haslbeck - r","https://www.r-bloggers.com/author/jonas-haslbeck-r/"
"Gold-Mining Week 1 (2019)","September 4, 2019","Michael Griebe","https://www.r-bloggers.com/author/michael-griebe/"
"Bayesian Linear Mixed Models: Random Intercepts, Slopes, and Missing Data","September 4, 2019","R on Will Hipson","https://www.r-bloggers.com/author/r-on-will-hipson/"
"Advanced Data Reshaping in Python and R","September 4, 2019","John Mount","https://www.r-bloggers.com/author/john-mount/"
"Create an Icon Map in R with ggmap and ggimage","September 4, 2019","Laura Ellis","https://www.r-bloggers.com/author/laura-ellis/"
"R or Python","September 4, 2019","Fran Peric","https://www.r-bloggers.com/author/fran-peric/"
"Game theory in R with the new gtree package","September 4, 2019","Economics and R - R posts","https://www.r-bloggers.com/author/economics-and-r-r-posts/"
"Easy data access: The advantages of a unique database connection with ODBC and DBI","September 4, 2019","eoda GmbH","https://www.r-bloggers.com/author/eoda-gmbh/"
"How to do Tamil Text Analysis & NLP in R","September 3, 2019","AbdulMajedRaja RS","https://www.r-bloggers.com/author/abdulmajedraja-rs/"
"Data Chats: From Physics student to Data Science Consultant","September 3, 2019","Martin Chan","https://www.r-bloggers.com/author/martin-chan/"
"How to Send Custom E-mails with R","September 3, 2019","R Views","https://www.r-bloggers.com/author/r-views/"
"Meet T3 – Tychobra Time Tracker","September 3, 2019","Posts on Tychobra","https://www.r-bloggers.com/author/posts-on-tychobra/"
"New RStudio addins for network analysis","September 3, 2019","schochastics","https://www.r-bloggers.com/author/schochastics/"
"Grids and graticules in the tmap package","September 3, 2019","the Geocomputation with R website","https://www.r-bloggers.com/author/the-geocomputation-with-r-website/"
